id,name,text,trans
3,クリスティーナ/克里斯提娜,おやおや、\n去年学んだはずだろう子猫ちゃん。,哎呀哎呀，\n从去年的事你应该已经学到了吧，\n小猫。
4,クリスティーナ/克里斯提娜,トリートを差し出そうと、\n上目遣いで頼み込もうと……\n決めるのは、このアタシ。,不管你是交出糖果，\n还是用向上的视线来求我……\n做决定的都是我。
5,クリスティーナ/克里斯提娜,悪戯をすると決めたんでね、\nおねだりを聞いてやるわけには\nいかないな。,我已经决定恶作剧了，\n所以不会听你的请求。
6,クリスティーナ/克里斯提娜,年に一度のハロウィンだ。\n存分に悪戯を楽しませてもらおう。,一年一次的万圣节。\n就让我尽情享受恶作剧吧。
7,クリスティーナ/克里斯提娜,しかし、\nこれから悪戯をしますと言って\n悪戯を始めるのも無粋だ。,不过，说着接下来要恶作剧\n就开始恶作剧也算不懂风趣。
8,クリスティーナ/克里斯提娜,だから、さぁお逃げ子猫ちゃん。\n今日一日……いつ悪戯されるか\n可愛い涙目で過ごすといい。,所以，逃吧小猫。\n今天一整天……什么时候会被恶作剧……\n就带着可爱的泪目度过吧。
info,,,scene_s5_halloween_3016_v1_0_2004_5_3040018000
译者,,,