id,name,text,trans
0,ブローディア/布罗蒂娅,特異点よ、イタズラを仕掛けて来る\n子供達に対しては、\nやはり手加減すべきだろうか？,姬塔，\n对向我恶作剧的孩子，\n是不是还是得手下留情？
1,ブローディア/布罗蒂娅,それとも、この世の中の厳しさを、\nハロウィンという行事を通して\n学ばせるべきなのだろうか？,还是说要通过万圣节这个节日，\n教会他们这世间的残酷？
2,ブローディア/布罗蒂娅,昨夜から考え続けているのだが、\nどちらが正解なのか、\nまだ答えが出ていなくてな。,从昨晚上开始我就一直在思考这些，\n到底哪个才是正确答案，\n到现在我也没有想明白。
3,ブローディア/布罗蒂娅,"特異点はどう考える？ ",姬塔你怎么看？
4,ブローディア/布罗蒂娅,ふっ、楽しめばいい、か。\nそれは至極単純だが……まさに真理。,开心就好，吗。\n这确实简单至极…\n…不过正是真理。
5,ブローディア/布罗蒂娅,まずは……\n我も精一杯、楽しむとしようか！,那么首先……\n我也来尽情享受吧！
info,,,scene_s3_halloween_3098_v1_0_2004_3_3040158000
译者,,,