id,name,text,trans
0,ベアトリクス/贝阿朵丽丝,あけましておめでとう。<br>姬塔！,新年快乐，姬塔！
1,ベアトリクス/贝阿朵丽丝,去年一年……<br>色んなことがあったな……,去年一年……<br>发生了各种各样的事啊……
2,ベアトリクス/贝阿朵丽丝,忘れられないぐらい、<br>楽しいことも……<br>危険なことも、いっぱい……,难以忘记的事，<br>开心的……<br>危险的，很多很多……
3,ベアトリクス/贝阿朵丽丝,…………,…………
4,ベアトリクス/贝阿朵丽丝,もう……私は大切なモノを、<br>絶対に失いたくない。,我绝对不能失去自己<br>重要的东西。
5,ベアトリクス/贝阿朵丽丝,だから、今年はもっともっと！<br>私は強くなってみせる……！！,所以，<br>今年我也要更多更多地变强……！
6,ベアトリクス/贝阿朵丽丝,姬塔達と、<br>ずっと一緒にいるためにも、な。<br>ふふふ……,也为了能一直和团长你们在一起。<br>嘿嘿……
7,ベアトリクス/贝阿朵丽丝,今年も仲良くしてくれよなっ！<br>姬塔！,今年也好好相处吧，<br>姬塔！
info,,,scene_s4_newyear_3050_v1_0_2001_4_3040070000