id,name,text,trans
0,バザラガ/巴萨拉卡,姬塔……\nこれを受け取ってくれないか。,姬塔……\n你能收下这个吗。
1,バザラガ/巴萨拉卡,今年も菓子を作った。\nこちらの方がいいと、\n去年言っていただろう？,今年也做了点心。\n你去年说了，\n想吃我做的对吧？
2,バザラガ/巴萨拉卡,ビィとルリアに\n姬塔の好物を聞いてな。,我也问了碧和露莉亚，\n姬塔喜欢的东西。
3,バザラガ/巴萨拉卡,選択は間違っていないと思うが、\nやはり味の保証はできん。,虽然我觉得我的选择没有错，\n但果然还是无法保证味道。
4,バザラガ/巴萨拉卡,ついでに手紙を渡しておく。\n先月の菓子の山は食い尽くしたからな。\nその礼と感想を書いておいた。,顺带给你这封信。\n因为上个月的点心山全都吃完了。\n我把感谢和感想全写在上面了。
5,バザラガ/巴萨拉卡,一番気に入ったものか……\nチョコレートの入ったクッキーだな。\n苦味がいい塩梅にきいていた。,那里面最中意的吗……\n放了巧克力的饼干吧。\n那个的苦味恰到好处。
6,バザラガ/巴萨拉卡,姬塔の誠意に応えられる\n返礼を目指してみたが……\n気に入ってもらえれば幸いだ。,虽然回礼本来的目标是\n为了回应姬塔的诚意……\n但如果你能喜欢的话就太好了。
info,,,scene_s5_white_3025_v2_0_2003_5_3040146000_0
译者,,,ゼタラガ推し