id,name,text,trans
0-chapter_name,,決意の姫君,下定决心的公主 
0-synopsis,,<span class='scene-font-place'>アルスター島</span>の復興を進めてきたヘルエス。だが彼女は姬塔一行を呼び出し、その旅に加わりたいと話す。ヘルエスは議会が元王女である自分に頼りすぎていることを懸念し、それを正すために島を出ようとしていた。以前の恩義を返すためにも姬塔に同行したいというヘルエスを一同は仲間として受け入れるのだった。,进行着阿尔斯塔岛的复兴的赫尔艾斯将姬塔一行人叫来了岛上，提出了也想加入旅行的请求。赫尔艾斯认为议会过于依赖身为前王女的自己了、为了纠正这一点决定离开岛。为了报答以前的恩义所以想要和姬塔一起同行的赫尔艾斯加这么加入了骑空团。
0,,<span class='scene-font-katari'>姬塔達は以前、旅の途中で</span><br><span class='scene-font-katari'>島を荒らす魔物達に悩む</span><br><span class='scene-font-place'>アルスター島</span><span class='scene-font-katari'>を訪れた。</span>,<span class='scene-font-katari'>姬塔一行以前，在旅行的途中到访了因为魔物们在岛上大肆破坏而荒废的阿尔斯塔岛。</span>
1,,<span class='scene-font-katari'> 姬塔一行の協力を受け、</span><br><span class='scene-font-place'>アルスター島</span><span class='scene-font-katari'>は</span><br><span class='scene-font-katari'>無事平和を取り戻したのだった。</span>,<span class='scene-font-katari'> 在姬塔一行人的帮助下、</span><br><span class='scene-font-place'>阿尔斯塔岛</span><span class='scene-font-katari'>终于</span><br><span class='scene-font-katari'>取回了和平的日常。</span>
3,,<span class='scene-font-katari'>その時に知り合った、</span><br><span class='scene-font-katari'>魔物によって滅んだ王国の王女に</span><br><span class='scene-font-katari'>姬塔は呼び出された。</span>,<span class='scene-font-katari'>在那时结识的、</span><br><span class='scene-font-katari'>被魔物毁灭的国家的王女</span><br><span class='scene-font-katari'>将姬塔一行请来了岛上。</span>
5,ヘルエス/赫尔艾斯,よく来てくれました、皆さん。<br>ご足労に感謝します。,终于来了呢，各位。劳烦各位前来，非常感谢。
6,ルリア/露莉亚,いえ！<br>またヘルエスさんに会えて嬉しいです。<br>あれから島の復興は進んでますか？,不会！能再次见到赫尔艾斯小姐我们也很高兴。在那之后岛的复兴进行的怎么样了呢？
7,ヘルエス/赫尔艾斯,ええ。幸いなことに<br>かつてアイルスト王国があった頃と<br>遜色ない賑わいを見せています。,是呢，十分幸运的是，现在的岛上和以前埃卢斯塔王国仍在的时候一样热闹。
8,ビィ/碧,そりゃあ良かった！<br>……で、オイラ達に何の用なんだ？<br>また魔物退治か？,那就太好了！……那、找我们有什么事吗？又是魔物退治吗？
9,ヘルエス/赫尔艾斯,いえ……貴方がたに頼みたいのは、<br>全く別のことです。,不……想要拜托各位的是完全不一样的事情。
10,ヘルエス/赫尔艾斯,私を貴方がたの旅へ<br>同行させて頂きたい。,请让我也加入你们的旅行。
11,ルリア/露莉亚,ええっ！？　どうしてですか？<br>ヘルエスさんはこの島の人達に<br>頼りにされているのに……,诶诶！？为什么呢？岛上的大家明明都很依赖赫尔艾斯小姐……
12,ルリア/露莉亚,ヘルエスさんが<br>いなくなってしまったら、<br>島の人達が困るんじゃ……？,如果赫尔艾斯小姐不在的话、岛上的人们不会困扰吗……？
13,ヘルエス/赫尔艾斯,正に、それこそが<br>私が島を出たい理由なのです。,你说得对，这正是我要离开岛的原因。
14,ビィ/碧,んん？　どういうことだ？,嗯嗯？怎么回事？
18,ヘルエス/赫尔艾斯,この<span class='scene-font-place'>アルスター島</span>は長く<br>アイルスト王家によって<br>統治されてきました。,这个<span class='scene-font-place'>阿尔斯塔岛</span>长期都处在埃卢斯塔王家的统治之下。
19,ヘルエス/赫尔艾斯,我が父コノール王の失策により、<br>アイルスト王国は<br>魔物によって滅ぼされたわけですが……,虽然因为我的父王科诺尔王的失策、埃尔斯特王国被魔物毁灭了……
20,ヘルエス/赫尔艾斯,その後、復興に当たって<br>街や村から有力者を集め方針を話し合う<br>議会を作ったのです。,在那之后，为了复兴，决定更好地集合街上和村里的有能力的人的意见而建立了议会。
21,ルリア/露莉亚,だから、お城が会議所って<br>呼ばれるようになったんですね！,所以城堡才被叫做会议所呢！
22,ヘルエス/赫尔艾斯,ええ、ここが島の中心として<br>利便性が高い場所にあることは<br>間違いありませんから。,是的，毕竟这里作为岛的中心，是十分方便的场所。
25,ヘルエス/赫尔艾斯,話を戻しましょう。王家の跡継ぎが<br>国を治めるに足る器を持たない場合、<br>脅かされるのは国民です。,继续之前的话题吧。如果王家的继承者没有足够统治国家的能力的情况，受到威胁的是国民。
26,ヘルエス/赫尔艾斯,父の行いによりそれを悟った<br>私と弟は王政を排し、<br>議会を主導してきました。,通过父王的行动了解了这一点的我和弟弟废除了王政，主张建立议会。
27,ヘルエス/赫尔艾斯,ですが議会は発足したばかりで<br>経験不足。故にか、皆が私を<br>あまりにも頼りすぎてしまう。,但是议会才刚刚建立，目前经验不足。所以大家才过于依赖我了。
28,ビィ/碧,でもさ、それは当然じゃねぇか？<br>国だなんてドデカいもの、いきなり<br>どうにかしろって言われてもさ。,但是、这不是当然的吗？国家这么大的东西、突然说要做点什么的也不知道该做什么啊。
29,ヘルエス/赫尔艾斯,勿論、最初はそれで良いのです。<br>誰しも始めは手本を求めるもの。,是的，刚开始的话这样是可以的。不论是谁开始都需要一个范本。
30,ヘルエス/赫尔艾斯,しかし、いつまでも<br>そのままにはしておけません。,可是，如果一直都这样下去是不行的。
31,ヘルエス/赫尔艾斯,彼等も実務能力は充分です。<br>後は経験を積み、判断力を養うだけ。<br>そのために、却って私は邪魔なのです。,他们已经具备了充分的能力。剩下的只有积攒经验、锻炼判断力而已。为此，我的存在是一种障碍。
32,ビィ/碧,う～ん、厳しいけど<br>島の人のためってことか……,嗯……虽然很严厉但也是为了岛上的人啊……
33,ヘルエス/赫尔艾斯,ええ。<br>私が手を離す時が来た、<br>ただそれだけのことです。,是的。我该放手的时候到了，仅此而已。
34,ヘルエス/赫尔艾斯,貴方がたなら信頼が置ける。<br>それに以前の恩義を返したい。<br>私を旅に同行させて頂けませんか？,如果是你的话我可以信赖你，而且也想报答以前的恩情。可以让我加入你们的旅行吗？
34-sel1_txt,,<span class='scene-font-katari'>いいよ、一緒に行こう</span>,可以哦，一起来吧
34-sel2_txt,,<span class='scene-font-katari'>もっと安全な場所がいいんじゃない？</span>,更加安全的地方会更好吧？
35,ヘルエス/赫尔艾斯,感謝します、姬塔殿。<br>いや……姬塔殿。,非常感谢、姬塔阁下。不……团长阁下。
36,ヘルエス/赫尔艾斯,槍の腕には自信があります。<br>空の果てを目指す貴方がたの<br>力となりましょう。,我对用枪还是很有自信的。一定会成为想要到达空的尽头的你的助力的。
37,ヘルエス/赫尔艾斯,ふふ……,呵呵……
38,ヘルエス/赫尔艾斯,実は、他国の依頼で行く<br>遠征以外で島を離れるのは<br>初めてです。,其实、除了接受外国的委托而去远征之外，离开岛还是第一次。
39,ルリア/露莉亚,そうだったんですか？,是这样的吗？
40,ヘルエス/赫尔艾斯,ええ。<br>柄にもなく、気分が高揚します。,是的。无关身份、实在是令人兴奋呢。
41,ビィ/碧,確かに……オイラ達は<br>星晶獣とも戦うしなぁ。,那确实……可是我们还会和星晶兽战斗哦。
42,ヘルエス/赫尔艾斯,私の技量が貴方がたに劣る、と？<br>ならばそれは実戦で確かめて下さい。,你是想说、我的实力比你们逊色吗？既然这样的话就用实战演习来确认吧。
43,ルリア/露莉亚,ヘルエスさんはとっても<br>頼りになりますけど、どうして<br>そんなに騎空団にこだわるんですか？,虽然赫尔艾斯小姐非常值得信赖、但为什么要这么执着于骑空团呢？
44,ヘルエス/赫尔艾斯,……私は、貴方がたの自由さに<br>感銘を受けたのです。私は任務以外で<br>島を出たことがありませんから。,……我深深地感受到了你们自由的生存方式。毕竟我除了任务以外就没有出过岛。
45,ヘルエス/赫尔艾斯,私も、一度は貴方がたのように<br>自由に生きてみたい。<br>そんな風に思ったのです。,看到你们之后，我不禁也想，就算一次也好，像你们那样自由地生活。
46,ヘルエス/赫尔艾斯,……折れてくれますか、<br>姬塔殿。<br>あなたの寛容に感謝します。,……让你们操心了呢、姬塔阁下。感谢你的宽容。
47,ヘルエス/赫尔艾斯,解らぬことも多々あるでしょう。<br>ご指導ご鞭撻を<br>よろしくお願いいたします。,我或许会有很多不了解的事情。也请拜托你多加关照了。
48,,<span class='scene-font-katari'>こうして、亡国の王女</span><br><span class='scene-font-katari'>ヘルエスが騎空団に加わった。</span>,<span class='scene-font-katari'>就这样、王国的王女赫尔艾斯</span><br><span class='scene-font-katari'>加入了骑空团。</span>
49,,<span class='scene-font-katari'>頼りになる仲間として、</span><br><span class='scene-font-katari'>彼女は姬塔達の旅を</span><br><span class='scene-font-katari'>支えてくれることだろう。</span>,<span class='scene-font-katari'>此后她也会作为可靠的同伴、</span><br><span class='scene-font-katari'>支持着姬塔他们的旅行的吧。</span>
info,,,scene_fate_chr199_ep1
译者,,,碘