id,trans
filename,scene_chr804_q1_s10
translator,psyche
info,scene_chr804_q1_s10
117,然而前往星之民的研究所的路上，\n我的手一直在弹奏同一个旋律，\n就仿佛在诉说着什么。
116,完全无法积极起来。\n我觉得创作\n对我来说是高不可攀的。
115,嗯……\n希望有一天，\n你能找到安身之所。
114,也不是这样。\n我只是无论在哪里都不自在，\n无法在一个地方久留罢了。
113,旅人……真羡慕呢。\n你看起来无牵无挂的。
112,我没有值得说的名字。\n你就当我是个\n漫无目的漂泊在天空的旅人吧。
111,说起来你究竟是谁？\n我应该从没见过你。
110,是啊。\n我会去思考的。
108,字面意义上来看，时间有的是。\n既然十年能学会弹奏一首曲子，\n给你一百年，有什么成果都不奇怪。
107,你有身为实验对象的自觉吧。\n去写。你无权拒绝。
106,我？\n怎么可能办到呢。
105,既然这样的话，\n就由你来为这首曲子作词，怎么样？
104,没有。\n多梅尼科不擅长作词。
103,呵，十年啊……\n有歌词吗？
102,……毕竟这十年里\n我只练了这一首曲子。
101,喔……？\n弹得挺不错的嘛。
99,或许是为了减轻焦躁感吧，\n我抱着乐器的手\n无意识地弹奏起来。
98,意思是我就是这个实验对象？\n真是麻烦。\n明明当个观测器比较轻松。
97,给你添加这一设定的<span class='scene-font-spword'>星之民</span>\n可能有一个愚蠢的假设吧？\n星也有变化的可能性。
96,太矛盾了。不明白有什么意义。\n星晶兽是不变的，没有成长，也不会衰退，\n为什么要让我这么努力。
95,答案不是很简单么。\n我没有创造东西的机能，\n被赋予的只有好奇心与探求心。
94,岛上的人学上一年就有模有样了，\n你却做不到。\n如此没有才华，真是可怜啊。
93,你很烦恼吧。\n无论怎么练都没有进步。
92,…………
91,你这个外人居然和大家混得这么熟，\n现在都是岛上最受欢迎的人了。\n是吧，假装成艺术家的凡人。
90,我是在夸你。\n对所有人的才艺予以肯定，\n表示敬意。请教、模仿。
89,设定就是这样的。\n如果是为了来取笑我，\n可否请你回去呢。
88,面对多数人敬而远之的\n难打交道的对象，你都不会退缩，\n大大咧咧地去靠近。
87,我一直在远处观察你，\n只要是才艺，无论采取什么方式\n都要学到手，真是求知欲旺盛啊。
86,…………
85,哟。\n边走路边练习，\n还真有热情啊。
83,这里要，按住二品……\n右手则这样……
76,这种机能究竟是为了什么？\n从没想过的话从嘴里说出来的时候，\n我的心就会冷下来。
75,和我自己的意志无关。\n站在空之民面前，我就会不由自主地\n按照设定行动。甚至连想法都会改变。
69,谢谢……！\n能遇见你这么好心的人，\n我真是太幸运了！
68,谁都不在意你的过去。\n从现在开始，\n就作为岛民在这里生活吧。
67,居然有这种遭遇。\n阿尔特你没事真是太好了。
66,所以我不是这座岛上的人……\n不方便的话我就去别的岛，\n只是我没法瞒着<span class='scene-font-spword'>星之民</span>偷偷上船了……
65,我想着一定要逃跑，\n就登上了附近的一艘骑空艇，\n来到这座岛上。
64,那个，我……\n被<span class='scene-font-spword'>星之民</span>抓来当做实验对象……
63,这个问题的答案也是设定好的。
62,等一下，先回答我的问题。\n我头一次见到你这样的青年。\n你是从哪里来的？
61,对所有人笑脸相迎。\n孩童般天真无邪地说话。\n无论何时都表现得像个人类。
60,交流的方式全是预先设定好的。\n询问对方有什么才艺，\n夸奖对方。向对方请教。模仿。
59,与岛民的交流机能。\n这就是我被赋予的另一种能力。
58,我名叫阿尔特。\n用这把乐器弹奏的吗？\n怎么才能发出声音？
57,咦，你是什么人？
56,哇……！\n这曲子真好听！\n是你自己写的吗？
54,是的，考虑到调查这一职责\n我只要做一台观测器也足够了。\n然而我还具备别的机能。
53,使用力量将观测到的感情具象化，\n变成小动物和魔物，取悦星之民。\n作为道具的我，平淡地执行着命令。
52,岛民们的心声源源不断地流进\n与岛屿结下契约的我的心中。
51,嗯，要的！我也完成了新的雕像，\n希望你来看看！
50,新的曲子写完了。\n要听吗？
45,那就是对艺术的热爱之心……\n最初对心境的变化产生困惑的岛民们\n在数十年间就发展了艺术的文化。
44,在还未产生自我意识之前，\n我就在她的命令下\n把研究的必要条件植入岛民的心中。
43,使用的是发现瑕疵的核心，\n反正也要丢掉，干脆就废物利用，\n制造一个用完就能舍弃的道具。
42,对空之民的心产生兴趣的星之民\n在建立在自己辖区内的研究所里\n制作了一只星晶兽。那就是我。
41,当时还是星支配天空的时代。
33,看来启动进程正常完成了。\n听得见我的声音吗，阿尔特？
22,如果岛民们的传说准确无误，\n那是将近一千年前的事了。\n我是在那座岛上诞生的——
21,卡洛开心地点点头，\n把乐器摆到一旁，端正地坐好。
20,告诉我吧。\n时间我有的是。
19,是吗，原来你在意这个。\n是艾尔塔的话，对你说出来也无妨。\n虽说这故事稍微有点长……
18,说到这个，\n卡洛先生为什么\n会用“卡洛”这个名字自称呢？
17,真是不可思议。现在我觉得，\n我真的成为“卡洛”了。
16,看到卡洛笑得如此满足，\n艾尔塔也露出安心的神色。
15,要说不寂寞，那是在撒谎。\n但是有你们在，\n每一天我都过得很充实。
14,不会感到寂寞吗？\n离开岛上后，\n就听不见岛民们的心声了吧？
13,呵呵，现在的卡洛先生\n优哉游哉的，真是太好了。
12,因为有艾尔塔在的话，\n无论我做什么你都能圆场吧。\n于是，我就有点想依赖你。
11,在岛上我通常是配合的那一方，\n结果这次一不留神就冒险起来了。
10,因为低音通常用来伴奏嘛。\n我倒是很意外\n卡洛先生居然发挥得如此自由。
9,艾尔塔真的\n很擅长配合别人来演奏呢。
7,晴天的甲板上，\n卡洛和艾尔塔进行了二重奏。
1,卡洛踏上旅途后，过了数日。
0-synopsis,某日，艾尔塔问卡洛为何给自己起“卡洛”这个名字。卡洛从千年前他被制造出来，自称“阿尔特”的时期开始说起。阿尔特被赋予了两个机能，观测岛民的心，以及与岛民交流。正当阿尔特对这一交流机能产生疑惑的时候，突然出现在森林里的旅人建议他给岛民教他弹奏的曲子填写歌词。
0-chapter_name,成为大家的卡洛