id,trans
filename,scene_evt230428_cp4_q3_s10
translator,psyche
info,scene_evt230428_cp4_q3_s10
125,向乐器工匠打听完\n坎塔特所在的位置，\n姬塔一行也从座椅上站了起来。
124,不好意思，你们能去接坎塔特吗？\n如果是你们的话，\n她也不会把你们赶走的吧。
123,聊得太久了。
122,（而且还有可怕的传说……\n难道卡洛先生\n有我们不知道的一面吗……？）
121,（我也觉得这个岛的价值观很特殊，\n但这竟是卡洛先生用星晶兽的力量\n强制灌输给岛民们的吗？）
120,（可是这两个人无法合作\n竟让我觉得如此难过……\n我真的无能为力了吗？）
119,（坎塔特想说什么我也明白。\n正是因为她知道声音有多重要，\n才希望用别人买得起的价格来贩售。）
118,（费鲁齐欧先生是个有良心，\n值得信赖的人。\n他对价值的观点也没有错。）
117,费鲁齐欧垂头丧气地离开了。
114,根据定期渡船的日程决定吧。\n也许会暂时逗留几天，\n没必要太着急。
113,你要离开这座岛吗？\n坎塔特也许想和你道别。
110,如今想来，交易只是借口罢了。\n或许我只是想\n再听一次那无比美妙的音色……
109,不知不觉中，我已经登上了\n前往佩尔菲特岛的定期渡船。
108,其实在坎塔特回岛上的时候，\n我就已经放弃了。但当我从一个\n相熟的工匠那里听说了艺术节的事……
107,这座岛的价值观十之八九\n是由星晶兽决定的。\n没有交涉的余地。而且……
106,这样好吗？\n你那么欣赏坎塔特小姐……
105,给你们添麻烦了。\n我放弃与坎塔特交易的打算了。
104,费鲁齐欧将杯中剩余的\n红茶一饮而尽，\n慢慢地从坐位上站起来。
103,所以诞生坎塔特这样的天才\n也是必然的事……\n但我认为这是个不幸的事故……
102,对于各种艺术家来说，\n这座岛的确是个理想乡吧。\n艺术家的人口自然也会不断增加。
101,司掌艺术的星晶兽所守护的艺术之岛。\n无论拿出什么样的作品\n都不会被否定……
100,费鲁齐欧深深地叹了口气，\n苦涩地仰望天花板。
99,……我终于明白了。\n原来坎塔特无法理解……
97,是的。\n重要的是，作品里倾注的感情。
96,什么……那么资深工匠的杰作\n和小孩子做的玩意儿，\n只要是盘子，就全部是同样的价格吗？
95,所以价格是由性能决定的。\n比方说，尽管材料费多少有差别，\n但只要是个盘子，那就卖盘子的价格。
94,在这个岛上，\n要是开出普通人无法出手的高价，\n会招人反感的。
93,岛外的话随便你们怎么定价……
92,贡品……？
91,都是边想阿尔特大人边做的东西，\n我们怎么能擅自区分其优劣呢？\n这实在太不像话了。
90,你都这么说了，就算是吧。\n但是，对于我们而言，\n艺术品是献给阿尔特大人的贡品。
89,为了顾客买到合适的商品，\n用以划分等级的就是价格。\n区分优劣不是理所当然的事吗？
88,购买者支付金钱的时候，\n期待得到与金额相称的回报。\n故而价格是品质的重要指标。
87,你在说什么……？
86,把精心制成的作品\n用价格来区分其优劣，\n稍微有点……
85,怎么说呢……\n在外面确实是这样的吧……
84,为何沉默？
83,…………
82,顾客根据价格判断商品的优劣。\n你们也会给乐器定价的吧？
81,这不是理所当然的事么。\n性能、品质、稀有度、背景……\n价格就是将这些东西数值化的产物。
80,……价格是由价值决定的吗？
79,价值就是价值吧。\n指商品的话，就是价格，\n还能是别的什么吗？
78,我说，刚才你们讲的<span class='scene-font-spword'>价值</span>，\n究竟是指什么？
77,你是希望把如此出色的乐器\n送到了解其价值的人手中吧……
76,坎塔特不是普通的工匠。\n必须严谨地设置合理价格，\n决不能廉价收购。
75,没必要为自己感到羞耻。\n你是个职业演奏家，了解她的价值，\n才会觉得矛盾，仅此而已。
74,…………
73,“作为朋友，我会照顾她的想法。\n但作为专业人员，我不希望她\n低估自己的才能”，差不多是这样吧。
72,你没法点头吧。\n这是你认可她的证据。
71,这个……
70,既然如此，\n你觉得她的才华应该被埋没在民间吗？
69,是的，我知道……
68,你知道坎塔特\n在制作小提琴上倾注了多少热情，\n而她的技术又有多精湛吗？
67,姑且也算个专业的吧。\n那我问你……
66,呃，基本没……\n维亚莱交响乐团曾经找过我，\n不过我现在是个旅行的演奏家。
65,……你也是演奏家吧。\n所属哪家乐团？获奖经历呢？
64,但既然坎塔特不愿意，\n也没必要勉强她接受交易啊？
63,说的也是，不情不愿的话，\n做不出什么好东西，\n谁都不会想买的。
62,如果因为情绪而影响质量，延误生产，\n制作者和销售商都会失去信誉。\n这不是在玩游戏。
61,对自己能做出什么东西\n要有认知，如果不能正视，\n就无法保证制品的品质。
60,但我也不是从事慈善事业的。\n工匠必须客观地理解自己的价值，\n对自己负责。
59,毕竟没有工匠，\n就没有人制作乐器。
58,大叔，你真是好人啊。
57,有不少工匠吃了恶德商人的亏，\n就此不再制作乐器了。\n正因如此，我必须诚实有信。
56,金钱是一把利刃。\n如果处理不当，会给被视作工匠灵魂的\n自尊心带去致命的伤害。
50,这倒也是……
49,我反过来问吧，要是我\n把低价买进的乐器高价出售，\n坎塔特会开心吗？
48,既然你想卖坎塔特的乐器，\n把收购价开低点不就行了吗？\n为什么不这么做？
47,但是，我搞不懂啊。
46,那孩子，从来不和\n她讨厌的人说话……
45,虽说没能做成交易，\n但起码还能和她有来往，\n我算是运气比较好的吧。
44,据说也有别的收购商\n看中她的才能，\n但全部都被她一口回绝了。
43,作为收购商，自然会这么做。\n几乎没人会抱怨开价太高吧。
42,她说我提出的价格太高，让她讨厌。\n这句话让我震惊不已。\n其实，每次见到她，我都会继续加价。
41,话虽如此，我也感到很困惑，\n于是某次我便直截了当地问她，\n为何不同意与我进行交易。
35,想到这是为了取得她的信任\n而进行的投资，我就非常乐意奉陪。\n其实，坎塔特确实对我相当亲近。
34,你完全被耍得团团转呢……
33,但她只是把我当做时不时\n请她吃蛋糕的亲切大叔罢了。
32,但是，问题是那个性格。\n她总是含糊地支开话题，\n尽管我多次安排交谈的场合……
31,相逢的那一刻……\n太、太厉害了……
30,所以在我与坎塔特相逢的那一刻，\n我便提出要收购她的作品。
29,她一定会震撼全空，\n让无数音乐爱好家为她献上\n如雷的掌声！
28,我觉得我找到至宝了。\n我有了一个梦想。梦想她的才华，\n能孕育出数不尽的音色……
22,在持续演奏中培养出的卓越听觉，\n对音质的执著追求，\n简直堪称神迹。
21,如此年轻，却能成功地\n创造出震撼灵魂的无上音色……
20,她的理想是做出任何人\n都能轻易演奏的小提琴，\n对她而言，这就是最高的目标。
19,无论是谁都能驾驭，\n表现出小提琴理想形态的杰作，\n只要是乐器工匠，都曾憧憬过……
18,能发出那种音色的小提琴的设计\n就被称为黄金分割，\n坎塔特也在热心地研究。
17," 对闻名遐迩的施特拉达琴\n所拥有的音色的美誉。"
16,<span class='scene-font-spword'>辉煌音调</span>是什么呀？
15,我甚至以为自己只是产生了幻听。\n我受到的就是这样的震撼。
14,那是金刚石般璀璨夺目的音色……\n拥有与<span class='scene-font-spword'>辉煌音调</span>同等的回响，\n毋庸置疑的杰作就在那里。
13,某天，我听到一件乐器的声音，\n它回荡着甜美芬芳的音色，\n让听者如痴如醉。
12,虽说有不少优秀的工匠，\n但都没到能引起我注意的水平。\n然而……
11,为了打开工匠的知名度，\n也需要这样的场所吧。\n虽说这种事和这个岛无缘……
10,届时，可以看到从各地聚集而来的\n未来乐器工匠们精挑细选的作品。\n所以我每年都会光顾。
9,坎塔特留学的学校\n每年举办一次学生作品品评会。
3,我与坎塔特相遇是在两年前，\n这个岛屿发生灾害的数个月前。
2,姬塔等人与费鲁齐欧围坐桌边，\n喝着送上来的红茶。
0-synopsis,费鲁齐欧告诉众人坎塔特的才能有多大的价值，他懊恼坎塔特不愿接受高价收购乐器，而乐器工匠夫妇告诉他，这个岛上的艺术品都是献给阿尔特大人的礼物，不能用价格划分优劣。这一价值观让费鲁齐欧认为不可能说服坎塔特，放弃了收购的打算。
0-chapter_name,第4话 agitato