id,trans
filename,主线剧情第71章第2节第2幕
info,scene_cp71_q2_s20
13,好嘞！那么就赶快收拾了这些魔物回王宫去吧！
12,要找东西的话，不管怎么说人手和情报都是必要的。
11,哈哈！果然大将很可靠啊！
10,我也会在城内打听一下，有没有人知道帝国时期之前的埃尔斯特的中枢人物的去向。
9,当然，毕竟各位对我们有着回报不完的恩情。
8,当然乐意，但是这样真的好吗？
7,哇！我也想和小欧尔姬丝多玩会呢！
6,女王陛下一定会为此感到高兴的。
5,那么，如果可以的话，居住在王宫里怎样呢？
4,是的，要是长期居留的话，像伊欧酱这样有精神点才好呢。
3,嘛，偶尔这样不也挺好的吗？这个城市和<span class='scene-font-place'>瓦尔兹</span>有点像我还蛮喜欢的。
2,一小段时间吗…要是只有几天就好了……
1,这么一来要在这座岛上待上一小段时间了啊。
0,<span class='scene-font-katari'>从沙漠的监狱那里回来后，姬塔等人为了寻找投宿的地方在</span><span class='scene-font-place'>美佛拉修</span><span class='scene-font-katari'>的大街上漫步着。</span>
0-synopsis,由于搜索可能需要比他们计划的时间更长，因此在骑空团在拉维岛逗留期间提供住宿和协助。
0-chapter_name,71：囚禁的真实