id,name,text,trans
0-chapter_name,,第3話 赤いリンゴ,第3话 红色的苹果
0-synopsis,,姬塔一行はかつて港町に住んでいた町長夫妻と共に七級軍武島に降り立っていた。星晶獣パレタを連れてきてほしいとの依頼を受けた一行は、遠くから響いた銃声を聞き、現場に急行する。そこで一行は、傭兵団リフノスから星晶獣パレタを守ったのだが、星晶獣パレタは「ごめんなさい」と呟き姿を消した。カインは一行と鉢合わせるが、互いに知らないふりをし、その場から離脱するのであった。,姬塔一行人与曾居住于港口小镇的镇长夫妇一起降落在七级军武岛。一行人接到了带回星晶兽帕雷塔的委托，在听到远处传来枪声后急忙赶往现场。在那里，一行人从佣兵团利弗诺斯手中保护了星晶兽帕雷塔，但星晶兽帕雷塔低语了一句「对不起」便消失了踪影。该隐与一行人碰个正着，但双方都装作互不相识，各自离开了现场。
1,,アベルの記憶を\n追体験していたカインが\n目を覚ました頃──,就在该隐体验过亚伯的记忆后醒来之时──
2,,姬塔一行は、かつて港町に\n住んでいた町長夫妻を連れ、\n七級軍武島に降り立っていた。,姬塔一行人带着曾居住于港口小镇的镇长夫妇降落在七级军武岛。
3,フォリア/芙莉亚,いやはや驚いたぞ。\nまさかアベルの名を\n聞くことになろうとはのう。,哎呀呀，真是令人吃惊。没想到居然会听到亚伯的名字啊。
4,港町のおばちゃん,それはこっちも一緒だよ。\nまさか、依頼をした騎空団に\nアベルを知る人がいたなんてねぇ。,我们这边也一样哦。真没想到，接受委托的骑空团里居然有认识亚伯的人呢。
5,ビィ/碧,とにかくオイラ達は\nパレタっていう星晶獣を見つけ出して\n連れてくりゃいいんだな！,总之我们就是要找出那个叫帕雷塔的星晶兽然后带回来就行了吧！
6,港町の町長,しかし……\n失礼を承知で聞くが、\n本当に信用していいんじゃな？,不过……恕我冒昧再问一句，真的可以信任你们吗？
7,港町の町長,パレタが暴走している星晶獣と\n知った途端、逃げ出す騎空団が\n多くてのう……,一听说帕雷塔是个处于暴走状态的星晶兽后，可是有很多骑空团当场逃离啊……
8,ルリア/露莉亚,任せてください！\nおふたりの気持ちを\n必ずパレタさんに届けてみせます！,请交给我们吧！我们一定会将二位的心意传达给帕雷塔的！
9,港町のおばちゃん,ありがとうねぇ……\nパレタとは\nひどいお別れになっちゃって……,谢谢你们啊……当时我们和帕雷塔分别得很不愉快……
10,港町のおばちゃん,私達はパレタに一言謝りたいんだよ。\n哀しむあの子に寄り添うどころか、\n怖がっちまったんだから……,我们想向帕雷塔道个歉。他陷在悲伤之中，\n我们非但没能陪伴在他身边，反而因为害怕而……
11,フォリア/芙莉亚,……とはいえ、そのパレタとやらは\n神出鬼没なのであろう？\nどうやって見つけ出したものか。,……话虽如此，那个叫帕雷塔的家伙想必神出鬼没吧？该如何找到他呢？
12,港町の町長,島には、\nリフノスという傭兵団がおってのう。\n元々はトリッド王国の軍人で……,岛上有一个叫做利弗诺斯的佣兵团。\n他们原本是特里德王国的军人……
13,港町の町長,わしらとは目的が違うんじゃが、\n彼らもパレタを追っておる。,虽然目的与我们不同，但他们也正在追踪帕雷塔。
14,港町の町長,まずはリフノスの野営地に行って、\n情報をもらうと良いかもしれん。,首先去利弗诺斯的野营地获取情报或许是个好办法。
15,港町のおばちゃん,時折、連絡は取ってるんだけど、\n最近、パレタがよく現れるように\nなったらしくてねぇ……,我们偶尔会有联系，听说最近帕雷塔现身得更加频繁了……
16,港町のおばちゃん,何か悪い方向に進んでるんじゃないか、\nって心配で心配で……,我们很担心事态是不是正朝着什么不好的方向发展……
17,ルリア/露莉亚,よく現れるようになったっていうのは\n何か理由が\nあるんでしょうか……？,出现更频繁这件事，是有什么原因吗……？
18,港町の町長,いや、それについては、\n彼らもわかっておらんらしい。,不，关于这一点，他们好像也不清楚。
19,フォリア/芙莉亚,（これまでの話を聞けば、\nアベルと関わりが深いことは明白……）,（听他们之前的说明，这星晶兽显然与亚伯关系匪浅……）
20,フォリア/芙莉亚,（と、すれば……カイン達がイデルバを\n発ったことが影響しておるのか）,（既然如此……莫非是该隐他们离开伊德尔瓦这件事造成了影响）
21,フォリア/芙莉亚,（もしそうならば、\nなんたる因果よ……）,（若果真如此，那是何等曲折的因果啊……）
23,,その時、\n森の方から激しい銃声が轟いた。,就在这时，从森林方向传来了激烈的枪响。
24,港町の町長,パレタが……\nリフノスに見つかったのかもしれん。,帕雷塔……可能是帕雷塔被利弗诺斯发现了。
25,港町の町長,リフノスはわしらとは違い、\n暴走するパレタを\n倒してしまうつもりなのじゃ……！,利弗诺斯与我们不同，他们的目的是打倒失控的帕雷塔……！
26,ルリア/露莉亚,姬塔、急ぎましょう！\nこっちです……！,姬塔，我们快走吧！是这边……！
32,パレタ,アベル……,亚伯……
33,カイン/该隐,パレタ……！\n頼む、もう一度俺と話を──,帕雷塔……！求你了，再和我谈一次──
35,リフノスの指揮官,<span class='scene-font-4'>畳みかけろ！</span>\n奴らの甘言に耳を貸す必要はない！,<span class='scene-font-4'>全员进攻！</span>\n没必要听信他们的花言巧语！
36,パレタ,…………！,…………！
38,ラインハルザ/莱茵哈萨,チッ……\n連中はオレが食い止める。\nカイン、お前はパレタを追え！,啧……那帮家伙由我来拖住。\n该隐，你去追帕雷塔！
39,カイン/该隐,頼んだ……！,拜托了……！
43,,しかしカインが走りだそうとした刹那、\n森に潜んでいた伏兵達が\nパレタに躍りかかった。,然而就在该隐准备奔跑的一瞬间，林中的伏兵们扑向了帕雷塔。
44,リフノス２,はああああ！,哈啊啊啊！
45,カイン/该隐,パレタ……！,帕雷塔……！
49,姬塔,────！,────！
52,リフノス２,な、なんなんだ貴様らは！？,你、你们这些家伙是什么人！？
55,フォリア/芙莉亚,通りすがりの騎空団じゃ。,只是路过的骑空团罢了。
56,ハクタク/白泽,我が王よ、そのような説明では\n納得していただけないのでは？,吾王啊，这样的说明恐怕难以让对方接受吧？
57,ビィ/碧,お前らが傭兵団リフノスだな！\n悪ぃけどよ、\nパレタはオイラ達が守るぜ！,你们就是佣兵团利弗诺斯吧！\n对不住了，帕雷塔由我们来保护！
58,リフノスの指揮官,余所者がなぜこうも邪魔ばかり……\n首を突っ込まないでもらおうか！？,为何总有外人来碍事……\n能请你们别来插手吗！？
59,フォリア/芙莉亚,妾達は余所者じゃが、\n依頼主はこの島に縁がある。\n町長と言っていたかのう……,我等虽是外人，但委托人与这座岛颇有渊源。他自称是镇长来着呢……
60,リフノスの指揮官,そうか……彼らの後悔はわかる。\nだが、我々の邪魔はさせん！,是吗……我明白他们心存后悔。但是，我绝不会让你们妨碍我们！
61,,姬塔達とリフノスの睨み合いが\n続く中、ルリアはこの場にカインと\nラインハルザがいることに気づく。,在姬塔等人与利弗诺斯持续对峙的过程中，露莉亚注意到了该隐和莱茵哈萨也在场。
62,ルリア/露莉亚,あれ……？,咦……？
63,カイン/该隐,しーっ……しーっ……！,嘘——……嘘——……！
64,ルリア/露莉亚,あ、えっと……その……,啊、那个……这个……
65,フォリア/芙莉亚,ふむ……,唔……
66,フォリア/芙莉亚,姬塔、ここは撤退じゃ。\nパレタを連れ、\n早々にこの場を離れようぞ。,姬塔，暂且撤退吧。\n带上帕雷塔，尽快离开此地。
67,ルリア/露莉亚,パレタさん……\n私達と一緒に来てくれませんか？\n貴方に謝りたいっていう人達がいて……,帕雷塔……你愿意和我们一起来吗？\n有人想要向你道歉……
68,パレタ,…………,…………
69,パレタ,ごめん、な……さい……,对、不……起……
75,,苦しそうに呟いたパレタは、\nその場にいた全員が見守る中、\n黒煙と共に姿を消した。,在一声痛苦低语后，帕雷塔在现场所有人的注视下升起黑烟消失了踪影。
76,ルリア/露莉亚,パレタさん……\nどうして……,帕雷塔……为什么……
77,リフノスの指揮官,…………,…………
78,フォリア/芙莉亚,そう簡単にはいかぬか……\n彼奴らの視線が痛いでな。\nひとまずは退くぞ。,看来事情没那么简单……那些家伙的视线真刺人啊。暂且先撤退吧。
79,カイン/该隐,きちんと事情を説明させてくれ。\nパレタと接触して、\n幾つかわかったことがあるんだ。,让我好好说明一下事情的原委。和帕雷塔接触后，我了解到了一些信息。
80,リフノスの指揮官,わかった……\nまずは野営地に戻って話を聞こう。,我明白了……回野营地之后我会听你细说。
81,,カイン達はリフノスの面々と共に、\n姬塔達もまた、\nその場を離れるのであった。,该隐他们与利弗诺斯的众人一同离去，姬塔等人也从那里撤退。
86,ルリア/露莉亚,パレタさんから\n深い後悔を感じました……,我从帕雷塔身上感受到了深深的悔意……
87,ビィ/碧,なんか謝ってたよな。\nごめんなさい、って……,他好像道歉了吧。他说，「对不起」……
88,ハクタク/白泽,星晶獣パレタは、\n聞いていた通り、機能の一部が\n欠損しているようですね。,星晶兽帕雷塔，正如我等听闻的那样，一部分功似乎存在缺陷。
89,ハクタク/白泽,そのせいでしょう。\n彼が持つ「黒色」の力が\n暴れているのかもしれません。,恐怕正是这个缘故，他所拥有的「黑色」之力失控了。
90,ハクタク/白泽,その力を諫めることができれば、\n彼も歩み寄れるのではないかと。,若是能够削弱那股力量，或许他也能够更加接近我们。
91,フォリア/芙莉亚,話し合うだけが望みとはいえ、\nなかなか難儀な依頼じゃな……,虽说委托人只是想和他说话，但这委托还真是相当棘手啊……
92,フォリア/芙莉亚,パレタは力も状態も難解極まる。\n諫めるとは言っても、\nどのような方法があるのやら……,帕雷塔的力量和现状都极其复杂难解。\n就算要削弱，但具体有何方法呢……
93,,姬塔達は解決方法を\n模索しながら、港町で待つ町長夫妻に\n状況を報告しに向かうのであった。,姬塔一行人一边思索着解决方法一边前往小镇，去向等待他们的镇长夫妇汇报情况。
info,,,scene_evt251128_cp3_q4_s10
译者,,,朔夜Rei