id,name,text,trans
0,レ・フィーエ/蕾・芬耶,姬塔さん？　貴方……<br>その手に沢山のチョコレートを<br>抱えているという事は……,姬塔？你……<br>手上抱着那么多巧克力，也就是说……
1,レ・フィーエ/蕾・芬耶,甘いものを嫌いではない、<br>ということですわね……<br>よろしくてよ。では差し上げます。,你不讨厌甜食……对吧……<br>很好。那么这个给你。
2,レ・フィーエ/蕾・芬耶,え？　何って……<br>チョ、チョコレートですわ！<br>貴方が欲しそうな瞳をなさるから！,哎？你问这是什么……<br>是、是巧克力！<br>因为你的眼神写着你很想要！
3,レ・フィーエ/蕾・芬耶,してない？　いいえ、してますわ！<br>顔にも書いてあります！,没有？不，一定有！<br>脸上也这么写着！
4,レ・フィーエ/蕾・芬耶,さぁ、はっきり仰いなさい！<br>私のこのチョコが欲しいと！,来，明说吧！<br>说你想要我的这个巧克力！
5,レ・フィーエ/蕾・芬耶,そ、それでいいんですのよ。<br>早く仰ってくださいな。<br>まったく……素直じゃない人ですわ！,这、这就行了。<br>早点说啊。<br>真是的……一点也不率直！
info,,,scene_s2_valentine_3004_v3_0_2002_2_3040113000_1