id,name,text,trans
207,ハーゼリーラ,あんたの駒として、新世界の\nお飾りになるなんてごめんよ。それに、\n姬塔さん達の方が強いもの。,我可不想作为你的棋子，\n成为新世界的装饰品。\n而且，姬塔他们要更强。
208,胎動する世界/胎动中的世界,……何だと？,……你说什么？
209,ハーゼリーラ,ハーゼは、\n姬塔さん達のおかげで、\n考えを改めましたの。,哈泽，\n因为姬塔他们，\n改变了想法。
210,ハーゼリーラ,復讐は何も生みません。\nハーゼが望むのは、\n叔父達が改心して償うこと……,复仇什么都不会改变。\n哈泽所希望的是，\n叔父们能够洗心赎罪。
211,ハーゼリーラ,それを真に促すのは力ではなく、\n偽りなき言葉ですわ。,真正促成这一切的不是力量，\n而是毫无虚伪的语言。
212,ハーゼリーラ,それに、強大な力を持って\n弱者を虐げる……貴方の行いは\n叔父達と同じです。,而且，\n用强大的力量欺压弱者……\n你的所作所为和叔父们一样。
213,ハーゼリーラ,空の世界を滅ぼそうなど……,毁灭空之世界什么的……
214,ハーゼリーラ,誇り高きガルゲニア皇国の皇族として、\nハーゼは貴方の企みを許しませんわ！,作为骄傲的\n加尔盖涅亚皇国的皇族，\n哈泽是不会允许你的企图！
219,ザ・ムーン,主の悲願、そして我が悲願……\n成就の時は近い。,主之悲愿，\n以及我之悲愿……\n实现之时将近。
220,ザ・ムーン,真実を背負い歩む者よ。\n汝が真に求める結末に至るべく、\n我は力を貸そう。,背负真实前行的人啊。\n为了让你达到真正寻求的结果，\n我将助你一臂之力。
221,ザ・ムーン,汝が心の欺瞞と真実、遍く受け入れん。,你心中的欺瞒与真实，\n我全盘接收。
222,ハーゼリーラ,ふふ……\n激励痛み入りますわ、ムーン。,呵呵……\n激励人心啊，Moon。,【
223,ニーア/尼娅,…………,…………
224,胎動する世界/胎动中的世界,デスに選ばれし賢人よ。\nなぜ、新世界創造を拒絶する？,被Death选中的贤者啊。\n为什么，要拒绝新世界创造？
225,胎動する世界/胎动中的世界,お前達を愛して……認めてくれる\n世界など、オレ達が作る\n新世界以外にはありえぬ。,会爱着你们……认同你们的世界，\n除了我们创造的新世界以外，\n不可能存在其他。
226,胎動する世界/胎动中的世界,そのことはお前自身が\n誰よりも理解しているはずだ。,你自己应该要比谁\n都明白这一点。
227,ニーア/尼娅,うん。私もそう思ってた……よ。\nだから、貴方に協力した……,嗯。我也是这么想……的。\n所以，才协助了你……
228,ニーア/尼娅,でも……ね、姬塔さん達が\n世界を壊さなくても\nみんなに愛される……,但是……姬塔他们说\n即使不破坏世界，\n也能被大家所爱……
229,ニーア/尼娅,みんなに認めてもらえる……\nそんな道を一緒に\n探そうって……,被大家所认同……\n会和我一起寻找\n这样的道路……
230,ニーア/尼娅,私とずっと一緒に\nいてくれる……って、\n約束してくれた……の。,会一直和我在一起……\n约定好了……
231,胎動する世界/胎动中的世界,だから、新世界創造を\n拒絶する……と？,所以，\n就拒绝了新世界创造……？
232,ニーア/尼娅,うん。姬塔さん達が……\n私のことを認めてくれる大切な人達が\n消えるのは嫌……だから。,嗯。因为……\n我不想让姬塔他们……\n不想让认同我的重要的人消失。
233,ニーア/尼娅,だから……ね、ワールド。\n私、貴方を消す……よ。,所以呢World……\n我，要将你消灭……
234,ニーア/尼娅,姬塔さん達を……\n私の大切な人達を\n守るために……,为了保护姬塔他们……\n为了保护我重要的人……
235,ニーア/尼娅,そう……姬塔さん達を\n傷つけるものは、みんな……\nみんな……私達が消す。,没错……伤害姬塔他们的人，\n全部……全部……\n都由我们消灭。
240,デス/Death,クキ、クケケ。\n愛シイ人、全テハ貴方ノ\n望ムガママニ。,咳嗑，咳咯咯，\n所爱之人，\n一切如你所愿。
241,デス/Death,貴方ノ願イハ全テ私ガ\n叶エマショウ。,你的愿望\n全部都由我来实现吧。
242,ニーア/尼娅,ありがとう、デス。\n頼りにしてるね。,谢谢你，Death。\n全靠你了呢。
243,胎動する世界/胎动中的世界,脆弱な人の身でありながら、\n神の使徒の依代となりし者……,身为脆弱之人的肉身，\n却成为神之使徒的代理人……
244,胎動する世界/胎动中的世界,「選ばれし者」「聡明な人間」と\nいう意味で、敬意をこめ「賢人」の\n称号を授けたのだが……,“被选中之人”、“聪慧之人”，\n我怀着这样的敬意\n授予你“贤者”的称号……
245,胎動する世界/胎动中的世界,どうやら、オレの見込み違い\nだったようだな……,但是看来，\n我对你的期望是错误的……
246,胎動する世界/胎动中的世界,ならば、いいだろう。\n好きにするがいい。,那么，好吧，\n随你的便。
247,胎動する世界/胎动中的世界,お前もお前に付き従う\nアーカルムシリーズも\nもはや不要だ。,你和跟随你的\n阿卡姆转世系列，\n都已经不需要了。
248,胎動する世界/胎动中的世界,だが、賢人よ、覚えておけ。\nその選択がどのような結果を\n導くのかを……,但是，贤者啊，记住。\n这个选择\n会带来怎样的后果……
249,胎動する世界/胎动中的世界,いずれ、お前は知ることになる。\n己の選択した道が誤りであった\nということにな……,不久，你就会明白，\n自己所选择的道路\n是错误的……
254,,その言葉と共にどこかへと\n消えていく胎動する世界。,伴随着这句话，\n胎动中的世界消失了。
255,,それを前に姬塔達は\n互いに顔を見合わせる。,姬塔等人相视对方\n确认彼此。
255-sel1_txt,,進もう！,前进吧！
277,マリア・テレサ/玛利亚・特蕾莎,ええ。\nどうか気を付けて、\n姬塔さん……！,嗯。还请多小心，\n姬塔……！
278,フラウ/芙劳,うん。私と姬塔なら\nどんな悪意だって跳ね返せる。\n進もう！,嗯。是我和姬塔的话，\n任何恶意都能抵挡。\n前进吧！
279,エスタリオラ/埃斯塔里奥拉,むにゃ……若き騎空士よ、\n今こそ世界の為、\nワールドを打倒せん……！,嗯……年轻的骑空士啊，\n现在正是为了世界，\n讨伐World之时……！
280,ガイゼンボーガ/盖森伯格,フッ、すでに時は満ちた。\n遅れをとるなよ、姬塔！,哼，时机已到。\n不要落后了，姬塔！
281,ニーア/尼娅,うん。行こう。\n私と姬塔さん達の\n未来を守るために……,嗯，走吧。\n为了守护\n我与姬塔你们的未来……
282,ロベリア/罗贝利亚,ああ、証明して見せよう。\n姬塔にオレの全てを\n捧げると誓った、あの時の言葉をね。,嗯，证明给你看。\n将我的一切\n都献给姬塔的那句话。
283,カイム/凯姆,姬塔……あいつ、\nすごく嫌な感じがした。\n気を付けて、怪我したらいやだよ！,姬塔……\n那家伙让我觉得很讨厌。\n小心点，不要受伤了！
284,アラナン/阿拉南,おう、姬塔殿。\n気合いを入れて禊と行こうじゃねぇか。,噢，姬塔阁下。\n打起精神来举行祓禊吧。
285,カッツェリーラ/卡兹里拉,ああ、姬塔。\n行進曲は任せてくれ。\nとびきり奮い立つものを奏でよう！,嗯，姬塔。\n行进曲就交给我吧。\n奏响振奋人心的乐曲！
286,ハーゼリーラ/哈泽丽拉,ええ、頼りにしています、\n姬塔さん。\nしかし無茶は禁物、ですわ。,嗯，靠你了，姬塔。\n但是禁止乱来哦。
287,,そして、一行は空の世界の異変を\n止めるため……,于是，一行人为了阻止\n空之世界的异变……
288,,胎動する世界の新世界創造を\n阻止するために更なる深奥へと\n歩みを進めるのだった。,为了阻止\n胎动中的世界创造新世界，\n向着更深处前进。
info,,,scene_arcarum_sandbox_ep7_s10
译者,,,-Roya