id,name,text,trans
0,ゼタ/泽塔,さて、飾りつけも終わったし<br>あとは宴会を待つばかりね。,那么，装饰也做完了，接下来只要等着宴会开始就行了呢。
1,ゼタ/泽塔,え、宴会の準備まで手伝ったのが意外？,诶，我帮忙宴会的准备你觉得很意外？
2,ゼタ/泽塔,あたし、毎年呼んでもらえるのを<br>楽しみにしてるわよ？　こう見えて。 <br>,别看我看起来这样，我每年可是都很期待被叫来哦。
3,ゼタ/泽塔,この団の人達って<br>なんだかんだみんな仲いいじゃない。<br>そういう雰囲気が結構好きだから。,这个团里的人总是这样那样的感情很好。我很喜欢这种氛围呢。
4,ゼタ/泽塔,ひとつの集団が派閥として分かれて<br>対立する事ってあるでしょ？<br>……あたし達のいる組織の事だけど。,一个集团内部不是也会有派系分立的吗？<br>……我们的组织就是那样。
5,ゼタ/泽塔,あんな風にギスギスしてないから<br>この団で過ごす時間は結構好きかな。,因为不像那里一样冷淡，所以我很喜欢在这个团里待着呢。
6,ゼタ/泽塔,……うん、やっぱり安心する。,……嗯，果然很令人安心啊。
info,,,scene_s4_christmas_3024_v4_0_2005_4_3030231000
译者,,,