id,name,text,trans
0,イルザ/伊尔莎,ほう、今年の仮装も\nなかなか決まっているじゃないか。,嘿，你今年的变装也不错嘛。
1,イルザ/伊尔莎,私か？\n少し調べたい事があって、\n敢えて仮装はしていない。,我吗？\n有点事想调查，\n所以特意不变装。
2,イルザ/伊尔莎,詳しくは話せないが、\nどうもこの町によからぬ噂が\n立っていてな、その調査をしている。,详细情况不能告诉你，\n不过这城里有些不太好的传闻，\n我正在调查这个。
3,イルザ/伊尔莎,何、心配しなくとも奴らが\n事を起こす前に私が片づけるさ。,没事，你不用担心。\n我会在他们搞事之前\n全部处理掉的。
4,イルザ/伊尔莎,手伝わせてほしい、か……\n姬塔にはハロウィンを\n楽しんでもらいたかったが、ふむ……,你想帮忙啊……\n虽然我想让姬塔好好享受万圣节，嗯……
5,イルザ/伊尔莎,では私のカラーボールをひとつ預ける。\nもし怪しい奴がいたらこれで\nインク塗れにして私に知らせてくれ。,那么给你一个我的染色球。\n如果发现可疑人物就用这个\n把他染色标记以后通知我。
6,イルザ/伊尔莎,悪戯は大の得意だろう？\n頼んだぞ。,恶作剧是你擅长的事吧？\n拜托你了。
info,,,scene_s4_halloween_3094_v2_0_2004_4_3040177000
译者,,,