id,name,text,trans
0,コルワ,今年の初夢は懐かしい夢だったわ。<br>小さい頃に見た結婚式の夢だった。,今年的初梦是个让人怀念的梦。小时候见到的婚礼的梦。
1,コルワ,前に話したでしょ？<br>私が服のデザイナーになったのは<br>幸せそうな花嫁さんを見たからだって。,之前我跟你提起过吧？我之所以成为服装设计师是因为看到了看上去很幸福的新娘。
2,コルワ,このタイミングで<br>どうして夢に見たのかしら。<br>何かのお告げか、私の心の表われか……,为什么会在这时候做这个梦。是什么启示吗，还是我内心的期望……
3,コルワ,そうね、初心にかえれって<br>釘を刺されたのかもしれないわ。,说不定，是被叮嘱不要忘记初心。
4,コルワ,見方を変えれば、<br>過去を引きずり過ぎずに<br>次に進めって意味かもね？,换个角度去看的话，说不定是不要被过去拖累超前看的意思？
5,コルワ,ふふ、まあ受け取り方次第よね。<br>どっちにしたって、懐かしい夢を見て<br>モチベーションは上がったわ！,呵呵，看用哪种方式去接受了。不过不管是哪个，因为看到了怀念的梦我现在动力充足！
6,コルワ,今年も一年、<br>私の衣装でひとつでも多くの<br>ハッピーエンドを紡がないとね！,今年一年，我也要用我的衣服编织出更多的happy end！
7,コルワ,ところで、<br>姬塔はどんな初夢を見たの？<br>私にも聞かせて頂戴！,话说回来，姬塔做了什么初梦？跟我说说吧！
info,,,scene_s3_newyear_3058_v1_0_2001_3_3040081000