id,name,text,trans
0,ソーン/索恩,姬塔、ハロウィンの仮装は<br>どんな物にするか決まった？,姬塔，万圣节变装要穿什么<br>决定好了吗？
1,ソーン/索恩,実はね、ルリアちゃん達と<br>姬塔に似合いそうな<br>衣装の話をしていたの。,其实啊，跟小露莉亚她们<br>商量了一下<br>适合姬塔的服装。
2,ソーン/索恩,それでね、これなんだけど……,然后呀，就是这个……
4,ソーン/索恩,……え、ちょっと派手すぎる？,……诶？有点太过夸张了？
5,ソーン/索恩,ふふ、なら、ぜひ着てほしいな。<br>これまで考えもしなかった格好を<br>してみるのもたまにはいいと思わない？,呼呼，那么，希望你务必能穿上呢。<br>你不觉得偶尔穿穿<br>从来没有穿过的服装也不错吗？
6,ソーン/索恩,去年は私の衣装を選んでもらったから、<br>今年は私が……どう？<br>ね、いいでしょう？,去年你给我选了服装，<br>所以今年轮到我了……怎么样？<br>呐？可以吧？
info,,,scene_s3_halloween_4002_v1_0_2004_3_3040031000
译者,,,
