id,name,text,trans
0-chapter_name,,第4話 空と星の交わり,
0-synopsis,,シトリとヰロティスの説明後、ミカボシは既に娘の事で頭がいっぱいで、なぜ自分が好戦的だったのかもわからないと語る。しかしグレートウォールの元凶として、バラゴナ達が求めるのなら戦いに応じると話す彼女に、バラゴナは保留の意思伝える。姬塔達は再集結し、星の民の洗脳を解く方法は身体と精神の両方へのショックであると目星をつける。しかし、プロクルスの目標は依然としてわからず、謎は深まるばかりだった。,听完志鸟与伊洛缇斯的说明，米卡波西脑子里想的全是女儿的事，说自己也不清楚之前为何会变得那么好战。但她同时也表明自己作为元凶，愿意接受巴拉格纳等人进行复仇的挑战，但后者却传达了暂且保留这一战的意愿。姬塔等人再次集结，初步判断解除星之民洗脑的方法是同时给予其身体和精神上的冲击。然而普罗克鲁斯的目的仍不明确，他身上的谜团愈发深重了。
1,ミカボシ/米卡波西,ごめん……\nひとりずつ、どういうことか\n教えてもらってもいい？,不好意思……\n你们能一件一件地给我解释一下\n发生了什么事吗？
2,,シトリとヰロティス。\nふたりのシトリは顔を見合わせると、\nまずは少女のシトリが口を開く。,志鸟和伊洛缇斯。\n两位志鸟打量了一下彼此，\n首先由少女志鸟开口。
3,シトリ/志鸟,えっと……\n知らない人が多いから、\nまずは自己紹介かな。,呃……\n在场大部分人我都不认识，\n就先做个自我介绍吧。
4,シトリ/志鸟,私はシトリ。\n母さん……ミカボシに拾われた、\n覇空戦争時代の空の民だよ。,我是志鸟。\n我是被妈妈……米卡波西收养的、\n霸空战争时代的空之民。
5,シトリ/志鸟,母さんが\nグレートウォールに封印される時に、\n私も一緒に眠りにつくことを選んで……,在妈妈被封印进长城的时候，\n我选择和她一同沉睡……
6,シトリ/志鸟,グレートウォールが崩壊したことで、\n記憶も力も封じられた母さんと、\n<span class='scene-font-place'>境界の世界</span>に流れ着いたんだ。,后来长城崩塌，\n我就和被封印了记忆和力量的妈妈\n一起漂流到了<span class='scene-font-place'>境界的世界</span>。
15,シトリ/志鸟,そのあと、<span class='scene-font-place'>境界の世界</span>で\n姬塔さん達に出会って、\n元の世界に戻るために協力して……,在那之后，我在<span class='scene-font-place'>境界的世界</span>\n遇见了姬塔等人，\n并帮助他们回到原来的世界……
16,シトリ/志鸟,ただ、その時、<span class='scene-font-spword'>星の民</span>のロキによって、\n母さんの記憶の封印が解かれて、\n母さんはロキと一緒に消えてしまった。,只是那个时候，在<span class='scene-font-spword'>星之民</span>洛基的干涉下，\n母亲恢复了记忆，\n并和洛基一起消失了。
21,シトリ/志鸟,いつか母さんを取り返すために、\n<span class='scene-font-place'>境界の世界</span>に残った私は、\n修行を積んでたんだけど……,为了有朝一日能带回母亲，\n我留在<span class='scene-font-place'>境界的世界</span>刻苦修行……
22,シトリ/志鸟,ある日突然、<span class='scene-font-place'>境界の世界</span>が消滅して、\n私達が住む星晶獣ヱビスは、\n空の世界に合流したんだ。,然后某一天，<span class='scene-font-place'>境界的世界</span>突然消失了，\n我们居住的星晶兽惠比寿\n融入了空之世界。
23,ヰロティス/伊洛缇斯,そうか……！\n姬塔達が幽世を倒したことで、\n赤き地平が解放されたから……,原来如此……！\n因为姬塔等人打败了幽世，\n赤色地平得以解放……
24,シトリ/志鸟,そういうことらしいね。\n幽世の軍勢が消滅したことで、\n赤き地平は幽世の世界ではなくなった。,似乎是这样。\n由于幽世大军的消亡，\n赤色地平不再是幽世的世界了。
25,シトリ/志鸟,地上が異界ではなくなったことで、\n空の世界との境界も無くなり、\n<span class='scene-font-place'>境界の世界</span>は空に合流した……,地表不再属于异空间，\n与空之世界间的边界也不复存在，\n于是<span class='scene-font-place'>境界的世界</span>融入了空之世界。
26,シトリ/志鸟,それからは、\n「大浮上」の混乱に紛れて、\n村の人達と空で暮らしてたんだ。,在那之后，趁着“大浮上”带来的混乱，\n我和村民们一起在天空中生活。
27,フィルキス/菲尔基丝,赤き地平と幽世のこと以外、\nなに話してんのか\nほとんどわかんないな……,除了赤色地平和幽世以外的事，\n我一点都听不明白……
28,,頷きを返す少女のシトリに対し、\n今度は大人の姿のシトリ、\nヰロティスが話し始める。,在得到少女志鸟的首肯之后，\n成人模样的志鸟——\n伊洛缇斯开口了。
29,ヰロティス/伊洛缇斯,母さんが連れ去られて、\n<span class='scene-font-place'>境界の世界</span>に残ったところまでは、\n私も同じだよ。,直到母亲被带走，\n我留在<span class='scene-font-place'>境界的世界</span>为止的经历，\n我也是一样的。
30,ヰロティス/伊洛缇斯,でも私がいた未来、\n別の空の世界では……,但我所在的未来，\n应该是另一个空之世界……
36,ヰロティス/伊洛缇斯,幽世との戦いで傷ついた\n姬塔達が、\nまた<span class='scene-font-place'>境界の世界</span>に落ちてきたんだ。,在与幽世的战斗中负伤的姬塔等人\n再次降落在了<span class='scene-font-place'>境界的世界</span>。
37,ヰロティス/伊洛缇斯,それで私達は、ヱビスの力を使って、\n幽世の軍勢に抵抗してたんだけど……,然后我们借助惠比寿的力量，\n一起抵抗幽世大军。
45,ヰロティス/伊洛缇斯,幽世は狡猾で……\n不可侵のはずの<span class='scene-font-place'>境界の世界</span>にすら、\n侵攻してきて……,幽世十分狡猾……\n居然侵入了本不可能被侵犯的<span class='scene-font-place'>境界的世界</span>。
50,ヰロティス/伊洛缇斯,最後の希望を繋ぐために、\n世界の狭間に逃げ込んだ私は、\nこの空の世界に辿り着いたんだ。,为了维系最后的希望，\n我逃进了世界的夹缝，\n最后来到了这边的空之世界。
56,ヰロティス/伊洛缇斯,それも、オイゲンすら生まれる前の、\n数十年前の世界で……,那是连欧根都还未出生的，\n几十年前的世界……
57,ヰロティス/伊洛缇斯,それから私は正体を隠して、\n「蒼の解放戦線」の首領、\nヰロティスとして戦いに備えていった。,在那之后我隐藏身份，\n作为“苍蓝解放战线”的首领伊洛缇斯，\n为战斗进行准备。
62,ヰロティス/伊洛缇斯,そうして、この空の世界の\n姬塔達に合流して、\n一緒に幽世と戦って……,然后与这边空之世界的姬塔等人会合，\n一起对抗幽世……
63,ヰロティス/伊洛缇斯,でもやっぱり犠牲は大きくて、\n後悔することばっかりで……,但我们付出了极大的牺牲，\n让我一直悔恨不已……
64,ヰロティス/伊洛缇斯,幽世との戦いの後は、\nこの空の世界を、その……\nあてもなく放浪してたんだ。,在与幽世的决战过后，\n我在这边的空之世界，怎么说……\n漫无目的地流浪了一段时间。
65,フィルキス/菲尔基丝,えーっと……つまり……\nまさかだけど、ふたりは同一人物なの？,嗯……也就是说……\n难不成你俩是同一个人吗？
66,シトリ/志鸟,そうだね……そういうことになるかな。,是呢……应该就是这样。
67,,シトリの肯定に、\nヰロティスもまた頷きを返し\n同意を示す。,面对志鸟的肯定回答，\n伊洛缇斯点头表示同意。
68,シユウ/蚩尤,<span class='scene-font-place'>境界の世界</span>は、\n我々星の民ですら\n干渉が出来ない空間だ。,<span class='scene-font-place'>境界的世界</span>，\n是连我们星之民都无法干涉的特殊空间。
69,シユウ/蚩尤,その<span class='scene-font-place'>境界の世界</span>を介して、\n過去と未来の同一人物が、\n顔を会わせることになるとは……,在这个境界的世界的影响下，\n过去与未来的同一个人\n居然能有相见的那一天……
70,シユウ/蚩尤,非常に稀有な事例です。\n専門分野でなくとも、\nこの上なく興味深いですね。,这是非常罕见的事例。\n虽然这并非我的专业，\n也实在是令人兴致盎然。
71,オクタヴィア/奥克塔维亚,気持ちはわかるんだけど……\nひとまずこの場はどうしたもんかね。,你的心情我理解……\n但现在还是先解决眼前的事吧。
72,ハル/哈尔,…………,
73,,ハルの不安そうな視線を受けて、\n緋色の騎士バラゴナは、\nようやく固く閉じていた口を開く。,感受到哈尔投来的不安视线，\n绯骑士巴拉格纳终于张开了\n他紧闭许久的口。
76,バラゴナ/巴拉格纳,星の民ミカボシ……\n貴方はまだ戦うつもりがありますか？,星之民米卡波西……\n你还有战斗的意愿吗？
79,ミカボシ/米卡波西,……正直、無いかな。\nそれよりいまは、\n娘のことで頭がいっぱいで。,……老实说，没有。\n比起这个，\n现在我心里装的都是女儿的事。
80,ミカボシ/米卡波西,妙に気持ちが落ち着いてる、\nというか……,总觉得心情好像平静下来了……
81,ミカボシ/米卡波西,どうしてさっきまで\nあんなに好戦的だったのか、\n私自身、よくわからないんだよね。,为什么此前我会那么好战，\n我自己也不太明白。
82,ミカボシ/米卡波西,いや、戦うこと自体は\n嫌いじゃないけど、\nこう視野が狭くなっていたというか……,不，战斗本身我是不讨厌的，\n但那时视野好像变得格外狭窄……
83,バラゴナ/巴拉格纳,可能性は言及されていましたね。\n蘇った星の民は、\n洗脳、或いは精神へ干渉されていると。,我们之前想这种可能。\n复活的星之民可能是被洗脑\n或施加了精神干涉。
84,ミカボシ/米卡波西,そういうことなのかな。\n詳しくはわからないけど……,有可能吧。\n具体的我也不是很清楚……
85,ミカボシ/米卡波西,でも、貴方が\n復讐をしたいと言うのなら、\n私は受けて立つよ。,但你如果说要向我复仇，\n我会接受的。
86,ミカボシ/米卡波西,グレートウォールの元凶として、\n私にはその責任があると思うから。,我作为造出长城的元凶，\n应当负起相应的责任。
87,ヰロティス/伊洛缇斯,母さん……,妈妈……
88,バラゴナ/巴拉格纳,ふむ……,嗯……
89,,顎に手を当て、\nたっぷりの時間をかけた上で、\n緋色の騎士はひとつの提案を口にする。,绯甲的骑士把手托在下巴上，\n在思考了好一阵后，\n给出了一个提议：
90,バラゴナ/巴拉格纳,では保留としましょう。,那么这个问题就暂且保留吧。
91,シトリ/志鸟,ほ、保留……？,保、保留……？
92,ミカボシ/米卡波西,……いいの？,……可以吗？
93,バラゴナ/巴拉格纳,目下の問題は貴方ではありません。\n対応すべきは、\nあのプロクルスという男だ。,目前的核心问题不是你。\n当下最要紧的是那个叫普罗克鲁斯的男人。
94,バラゴナ/巴拉格纳,それに貴方の性格上……\nそして娘達がいる以上、\nどこかへ逃げたりはしないでしょう？,而且考虑到你的性格……\n还有女儿们在的情况，\n应该不会自己逃掉吧？
95,シトリ達,…………,
96,ミカボシ/米卡波西,わかった……\nじゃあ、いまは貴方の言葉に甘える。,我明白了……\n现在就暂且承蒙你的好意吧。
97,バラゴナ/巴拉格纳,ハルヴァーダも、\nそれで構いませんか？,哈尔瓦达也没有意见吧？
98,ハル/哈尔,もちろんです！\nミカボシさんは、\n一族の仇かもしれないけど……,当然！\n或许米卡波西小姐\n是我们一族的仇人……
99,ハル/哈尔,でも、これ以上誰も傷つかないのが\n一番だって、僕は思うんです。,但我还是觉得\n不要再让任何人受伤更好。
100,,ハルのその優しい回答に、\n緋色の騎士バラゴナは、\n満足そうな笑みを浮かべるのだった。,面对哈尔给出的温柔回答，\n绯骑士巴拉格纳\n脸上浮现出满意的笑容。
108,,ビューレイスト、ミカボシを、\nそれぞれ洗脳から解放した\n姬塔達。,就这样，姬塔等人分别解除了\n贝莱斯特和米卡波西的洗脑。
109,,プロクルスについて調べる白騎士と\nダリダラを除き、一行は再び\n秩序の騎空団の庁舎に集まっていた。,除去正在调查的白骑士和达里达拉，\n一行人再次在秩序骑空团的办公楼里集结。
110,ビューレイスト/贝莱斯特,洗脳中、でいいのかな。\nとにかく、あの時は\n思考を誘導されている感じだったよ。,就先当那时是被洗脑了吧。\n总之，那个时候我感觉自己的思考被诱导了。
111,ビューレイスト/贝莱斯特,意識には靄がかかっていて、\n決められた目的以外のことを\n考えられないというか……,那时我的意识很朦胧，\n除了被安排给自己的目的之外，\n毫无别的想法……
112,ミカボシ/米卡波西,私も同じかな。\n後は少し怒りっぽいというか……\n戦うことに飢えている感覚があった。,我也一样。\n除此之外还有种愤怒……\n或者说渴望战斗的情感。
113,ミカボシ/米卡波西,何もかもを気にしないようにして、\nとにかく空の民と戦わなきゃ、\n空の世界を滅ぼさなきゃ、って……,其他什么都不用考虑，\n总之先与空之民作战、毁灭空之世界……
114,ビューレイスト/贝莱斯特,それと記憶には、\n改竄や欠落があったね。,而且记忆也有缺失\n和被篡改的部分。
115,ビューレイスト/贝莱斯特,つまるところ、\n完全な洗脳ではないものの、\n都合よく操られていたみたいだ。,总而言之，虽然并非彻底洗脑，\n但确实是被按照某种意图操弄了。
116,シユウ/蚩尤,では元に戻った切っ掛けに、\n何か思い当たることは？,关于你们清醒过来的契机，\n你们有没有什么看法呢？
117,,シユウの問いに、\nビューレイストとミカボシは\nそれぞれ腕を組み思案する。,面对蚩尤的提问，\n贝莱斯特和米卡波西各自抱起手臂，\n开始思索起来。
118,ミカボシ/米卡波西,確証はないけど……\n身体と精神、両方へのショック、かな。,虽然没有明确证据……\n但我想应该是身体和精神两方面的冲击吧。
119,ミカボシ/米卡波西,私が元に戻ったのは、\n一太刀を受けた後、\nシトリ達が駆け付けた時だったし。,我变回来是在挨了一记重击，\n又看到志鸟她们跑来的时候。
120,ビューレイスト/贝莱斯特,私の場合は、甲板に叩きつけられ、\nオルキスの必死な姿を見た時だ……\nどうやら辻褄は合いそうだね。,我是被拽到了甲板上，\n看到欧尔姬丝拼命呼唤的样子……\n看来能说得通呢。
121,シユウ/蚩尤,なるほど……\nオノスケリス、貴方はどうです？,原来如此……\n奥诺斯凯莉丝，你又如何呢？
122,オノスケリス/奥诺斯凯莉丝,……んだ。,……了。
123,シユウ/蚩尤,は？,哈？
124,オノスケリス/奥诺斯凯莉丝,<span class='scene-font-4'>転んだの！</span>\n足元がふらふらして！,<span class='scene-font-4'>我跌倒了！</span>\n因为双腿发软使不上劲！
125,オノスケリス/奥诺斯凯莉丝,それで蒼の少女に助けられたのが、\nたぶん、精神へのショックだと思う。,然后受到了苍之少女的帮助，\n大概这就是精神冲击吧。
126,オノスケリス/奥诺斯凯莉丝,星の民として生きていた頃、\n誰かに助けてもらったの、\n数えるくらいしかなかったし……,毕竟我作为星之民活着的时候，\n被人帮过的次数屈指可数啊……
127,アリア/阿莉亚,その……\n好きなだけイスタバイオンに\n身を寄せていて構わないからな。,那个……\n你可以在伊斯塔拜恩王国\n想待多久待多久。
128,オノスケリス/奥诺斯凯莉丝,うう……\n優しくされると抗えないぃぃ……,呜呜……\n太温柔了，根本无法反抗……
129,,オノスケリスについては\n特に気に留めず、\nシユウは思案しつつ話を続ける。,蚩尤并没有特别留意奥诺斯凯莉丝的情况，\n一边思考一边继续了话题。
130,シユウ/蚩尤,正気に戻す方法については、\n概ね条件が出揃ったようですね。,关于恢复神志的方法，\n大致是有数了。
131,シユウ/蚩尤,これで万が一、アペプやリリトが\n同じ状態で現れたとしても\n対処ができる。,这下要是阿佩普和莉莉特\n以同样的状态现身，\n我们也好有个对付了。
132,ラカム/拉卡姆,となると後は、\nあのプロクルスって野郎の目的か。,那么接下来，\n就是那个普罗克鲁斯的目的了。
133,カタリナ/卡塔莉娜,覇空戦争の再開を\n掲げていたようだが……,他似乎想要重启霸空战争……
134,ビィ/碧,フェニックスみてぇなこと\n企みやがって……,和菲尼克斯是一个打算啊……
135,カタリナ/卡塔莉娜,つまりあの男は、\n覇空戦争を星の民の勝利で\n終わらせたいのか？,也就是说，\n那个男人想让星之民\n取得霸空战争的胜利吗？
136,,カタリナの疑問に\nシユウは眉をひそめて呟く。,面对卡塔莉娜的疑问，\n蚩尤皱着眉头低语道：
137,シユウ/蚩尤,それでは筋が通らない。,那这样就说不通了。
138,アポロニア/阿波罗尼亚,……なるほどな。\n現状はむしろ、\n定石の真逆というわけか。,……原来如此。\n照现状来看，\n反而是与寻常思路完全相反吗。
139,,シユウは黒騎士の言葉に頷き、\nぶつぶつと呟くように\n話を続ける。,对于黑骑士的话语，\n蚩尤点头表示赞同，\n继续嘟囔着说了下去。
140,シユウ/蚩尤,ビューレイストとミカボシは、\nそれぞれ同時に、\n別の空域に姿を現した。,贝莱斯特和米卡波西，\n几乎同时出现在了其他空域。
141,シユウ/蚩尤,目的を指示できる以上、\nこれはプロクルスの計画の一端と\n考えたほうがいい。,既然他们能被赋予目的，\n那我们可以认为这是普罗克鲁斯计划的一环。
142,シユウ/蚩尤,しかしこれでは、\nせっかくの戦力の無駄遣い……,但这种安排，\n是对宝贵战力的浪费……
143,シユウ/蚩尤,むしろ、\n各個撃破してくれ、と言わんばかりの\n動きに見える。,简直就像是特意让我们\n将他们逐个击倒一样。
144,ビィ/碧,仲が悪いから\n一緒に行動させねぇようにする、\nってこともあるんじゃねぇのか？,会不会是知道他们关系不好，\n所以才不让他们一起行动呢？
145,ミカボシ/米卡波西,い、いやまぁ確かに、\n仲良しってわけじゃないけど……,这，怎么说呢，\n我们的关系确实算不上好……
146,シユウ/蚩尤,精神に干渉できる以上、\nそれも考えにくい。\n何より式典には一度に現れている。,既然对手能干涉精神，\n这几乎是不可能的。\n毕竟在典礼上他们也是同时出现的。
147,シユウ/蚩尤,むしろ……\nこう考えれば、全てに説明がつく。,不如说……\n如果这样考虑，\n一切就说得通了。
148,,周囲の視線を集めるように、\nシユウは机を指先で叩きながら\n話をまとめる。,像是要引起众人的注意一般，\n蚩尤用指尖敲着桌面，\n开始整理现有的情报。
149,シユウ/蚩尤,プロクルスという男は、\nビューレイストとミカボシを、\n倒させるつもりだったのではないか。,那个叫普罗克鲁斯的男人，\n会不会是故意让我们打倒\n贝莱斯特和米卡波西的呢。
158,シユウ/蚩尤,最初に集団で大々的に現れたのは、\n存在を示して警戒させるため……,最开始他们一帮人大张旗鼓地现身，\n是为了引起我们的警惕……
164,シユウ/蚩尤,そして個々に戦わせることで、\n各個撃破されることを目論んでいた。,然后让他们分别跟我们作战，\n目的是让他们被击倒。
165,バラゴナ/巴拉格纳,……率直に言って、\nずいぶんとまわりくどいですね。,……我说实话，\n这还真够拐弯抹角的。
166,バラゴナ/巴拉格纳,洗脳することが出来ていたのなら、\nそれぞれに自害を命じれば済む話では？,既然他都能洗脑了，\n那么直接命令他们自杀不就行了？
167,ビューレイスト/贝莱斯特,それは出来ないだろうね……\n靄がかかっていたとはいえ、\n意識自体は残っていた。,这应该是做不到的……\n虽然朦胧，\n但个体意识本身还是存在的。
168,ビューレイスト/贝莱斯特,完全な操り人形ではない以上、\n自害を目的にされても、\n流石に抵抗していたと思うよ。,既然不是单纯的提线木偶，\n就肯定会做出反抗。
169,カタリナ/卡塔莉娜,しかしそうなると、\nいったい何のために、こんなことを……,但是这样想的话，\n他这样做到底是想干什么呢……
170,,カタリナの呟きに対し、\nシユウはお手上げというように\n首をかしげて見せる。,面对卡塔莉娜的低语，\n蚩尤仿佛宣告投降似地歪了歪头。
171,オクタヴィア/奥克塔维亚,とはいえ、だ……\n結局ビューレイストもミカボシも、\nこうして正気に戻せたわけで……,话虽如此……\n但现在贝莱斯特和米卡波西恢复了神志……
172,オクタヴィア/奥克塔维亚,あの男の思う通りには進んでない、\nってことでいいんじゃないかい？,这也算是干扰了\n那个男人计划的正常推进，不是吗？
173,シユウ/蚩尤,……杜撰すぎる。\nどうにも謀略や駆け引きには\n慣れていない印象ですね。,……这也太草率了。\n从目前的印象来看，\n他好像完全不熟悉谋略和战术周旋。
174,,その時ふと、叙任式に沸く街で\n出会った際のプロクルスの様子が\n姬塔の脳裏をよぎる。,就在这时，在因册封典礼沸腾的街上\n见到的普罗克鲁斯的样子，\n在姬塔脑中复苏。
175,,それは確かに、\n不器用そうな青年の姿であり……,那时的他，\n看起来确实是个有些笨拙的青年……
176,,プロクルスという男について、\n謎は深まるばかりだった。,这个名为普罗克鲁斯的男人身上的谜团，\n只是愈发深重了。
info,,,scene_evt260304_cp4_q4_s10
译者,,,雨降星