id,name,text,trans
0,ロボミ,姬塔、相談があります。,姬塔，我有事情先要跟你商量。
1,ロボミ,私は子供達のイタズラに<br>反応を示さないため、<br>イタズラしがいがないと言われました。 <br>,因为我对孩子们的恶作剧没有反应，所以孩子们说对我恶作剧没什么意义。
2,ロボミ,"子供達を笑顔にするには<br>私がどのように反応すればよいか<br>指示をください、姬塔。 ",请指示告诉我，为了让孩子们露出笑容我该如何反应，姬塔。
3,ロボミ,大声を出して驚く……<br>了解しました。次回の行動に反映します。,大声叫出来表示惊讶……<br>了解。会反映到下次行动中。
6,ロボミの声,<span class='scene-font-4'>プァーーーーーーーーーーッ！</span>,<span class='scene-font-4'>哇————————————！</span>
11,ロボミ,逆効果だったようです。<br>行動の修正指示を。,看来是反效果。<br>请对行动作出修正指示。
info,,,scene_s4_halloween_2067_v2_0_2004_4_3040155000
译者,,,