id,name,text,trans
0,シエテ/希耶提,姬塔ちゃん、ホワイトデーの<br>お返しを渡したいんだけど、<br>今少しいいかな？,姬塔酱，我想给你白色情人节的回礼，你现在有时间吗？
1,シエテ/希耶提,おっ、今年はお返しを100万個も<br>貰ったのか？　それはスゴイねー,喔，今年你收到了100万个回礼？真是厉害啊——
2,シエテ/希耶提,そんなモテモテの<br>姬塔ちゃんに<br>俺からもお返しを渡したいと思う。,我也想送那么受欢迎的姬塔酱回礼啊。
3,シエテ/希耶提,いつもの感謝の印として。<br>俺と一緒に危機と戦ってくれる<br>勇士を称えてね。,作为日常的谢意的证明。<br>称赞和我一起与危机战斗的勇士。
4,シエテ/希耶提,って、何その意外そうな顔。<br>これが俺の本音だよ？<br>嘘偽りない真の心だよー？,你那副很意外的表情是什么意思。<br>这是我的真心话啊。<br>是毫无虚假的真心啊——
5,シエテ/希耶提,いつも真面目にしてた方が<br>カッコいいって？<br>あはははー　知ってる知ってる！,你说我平时也正经的话就会很帅？<br>啊哈哈哈，我知道我知道！
6,シエテ/希耶提,でもさー<br>いつもカッコ良くても<br>飽きるじゃない？　ね？,不过啊，<br>一直都很正经的话会厌倦的吧？是吧？
7,シエテ/希耶提,だから、気が向いた時だけ。<br>ホワイトデーの特別大サービス！<br>喜んでくれたー？,所以，心情好的时候我才会正经。<br>这是白色情人节的特别服务！<br>你开心吗？
info,,,scene_s3_white_4007_v1_0_2003_3_3040036000_0
