id,name,text,trans
0,ジークフリート/齐格飞,誕生日、おめでとう。\n姬塔はまた一段と\n立派になったな。,生日快乐。\n姬塔又成长了许多，\n变得更加出色了呢。
1,ジークフリート/齐格飞,姬塔の更なる成長を願い、\n俺からプレゼントを渡したい。\n受け取ってくれるか？,为了祝愿姬塔今后能取得更大的成长，\n我特地准备了一份礼物。\n你愿意收下吗？
2,,ジークフリートから渡された\n包みを開けると、何やら怪しい紋様が\n刺繍されたマントが出てきた。,打开齐格飞递来的包裹，\n里面是一件披风，\n上面绣着一些看起来有些神秘的纹样。
3,ジークフリート/齐格飞,とある島で誕生日に贈られる\n由緒あるマントだそうだ。,这是我在某个岛屿上找到的，\n相传具有悠久传统的生日礼物。
4,ジークフリート/齐格飞,刺繍された紋様の一つ一つに、\n願い事成就や厄災除けなどの\n有難い意味が込められているらしい。,披风上的每一个纹样都蕴含了美好的寓意，\n比如心想事成、驱灾避祸之类的祝福。
5,ジークフリート/齐格飞,実は何かいいことが\nあるんじゃないかと思い、\n俺の分も買ってきてある。,其实，我也有点期待\n会发生什么好事，\n所以也给自己买了一件。
6,ジークフリート/齐格飞,姬塔、今日はともに\nこれを着て過ごしてみないか？,姬塔，我们不如一起穿上它，\n共度今日如何？
info,,,scene_s5_birthday_3022_v1_0_2006_5_3040025000
译者,,,Ekko_Echo