id,name,text,trans
0-chapter_name,,ただの友として,仅作为朋友
0-synopsis,,幽世の侵攻はクレシュタインにも及んでいた。イスタバイオン軍が救援に訪れてなお劣勢であり、父でもある先代の白騎士も重傷を負っていた。さらには防衛線が崩壊、その余波で妹ユリアをも失ってしまう。絶望するシーザーだったが父の言葉を受け再起し、託された希望を胸にイスタバイオンへ逃げ延びる。そして、白騎士として任ぜられるに至ったシーザーは、空の平穏と故郷の奪還を誓うのだった。,幽世的侵略同样波及到了克雷施坦因。即使伊斯塔拜恩的军队前来救援，战况依旧处于劣势，凯撒的父亲先代白骑士也身负重伤。更糟糕的是，防线崩溃，其余波更让他失去了妹妹尤利娅。凯撒一度陷入绝望，但在父亲的话语下重新振作，心怀被被托付的希望，逃往伊斯塔拜恩。最终，被任命为白骑士的凯撒，立誓要守护空之世界的和平，并夺回故乡。
1,,普段は人や兵で賑わう\nクレシュタインの港に、\n人の気配はなく、あるのは炎だけ。,平日里人来人往、\n士兵熙攘的克雷施坦因港口\n此刻不见人影，唯有火焰肆虐。
2,,クレシュタインは大丈夫だという\n私の願いは、あまりにも呆気なく、\n霧散したのです。,我那份希望克雷施坦因\n平安无事的心愿，就这样转瞬间\n化为泡影消散了。
3,使用人/佣人,……シーザー様。\n私はこちらで失礼させていただきたく。,……凯撒大人。\n请允许我在这里告辞。
4,シーザー/凯撒,何言ってるんだ！？\nひとりでどこに──,你说什么！？\n你一个人要去哪里──
5,使用人/佣人,<span class='scene-font-place'>ウィン・セリア</span>に発つ際、\n家族をこちらに残していたもので……\n様子を、見に行きたいのです。,在出发前往<span class='scene-font-place'>维因·塞利亚</span>前，\n我把家人留在了这边……\n我想去，看看他们的情况。
6,シーザー/凯撒,でも、ひとりじゃ……,但是，你一个人的话……
7,使用人/佣人,大丈夫です。腕に覚えはあります。\nシーザー様は城へお急ぎを。\n隠し通路は覚えておいでですね？,没事的。我对自己的身手有把握。\n请凯撒大人赶快前往城堡。\n您还记得秘密通道吧？
8,シーザー/凯撒,……あ、ああ。,……嗯，嗯。
9,使用人/佣人,結構にございます。\n……シーザー様、短い間でしたが、\nあなたにお仕えできて幸せでした。,那就好。\n……凯撒大人，虽然时间不长，\n但能够侍奉您，是我的荣幸。
10,,使用人は恭しく礼をすると、\nそのまま燃え盛る市街地の方へと\n消えていった。,佣人恭敬地行了一礼，\n随后便朝着烈火熊熊的市区方向\n消失而去。
11,,シーザーは歯を食いしばりながら\n背を向け、ユリアを背負ったまま、\n王城への隠し通路を行くのだった。,凯撒咬紧牙关转过身，\n背着尤利娅朝通往王城的\n秘密通道走去。
16,,王城に辿り着いたシーザーは、\n大勢の見慣れぬ兵が詰めている\n光景を見て愕然とした。,抵达王城的凯撒\n看到大批陌生士兵严阵以待的景象，\n不禁愕然。
17,シーザー/凯撒,あ、あなた達は一体……！？,你、你们是什么人……！？
18,謎の兵１,なんだこの子供……どこから来た！？,这孩子怎么回事……从哪里进来的！？
19,謎の兵２,あいつらが化けてるんじゃないか！？\n急いで殺せ！　仲間を呼ばれる前に！,该不会是那些家伙伪装的吧！？\n快杀了他！ 别让他把同伙叫来！
20,シーザー/凯撒,待ってください！！\n僕達は──,请等一下！！\n我们是──
23,？？？,やめないか！！,快住手！！
24,？？？,部下がとんだご無礼を。\nシーザー殿下とお見受けしますが、\nお間違いないでしょうか？,我的部下实在太无礼了。\n我想您应该是凯撒殿下，\n不知是否有错？
25,シーザー/凯撒,あ、ああ。僕が、シーザーだ。\n……あなた達は？,嗯，嗯。我就是凯撒。\n……你们是？
26,？？？,我々はイスタバイオンより、\nクレシュタイン……いいえ、\nエクセ・グランデの救援に参りました。,我们是从伊斯塔拜恩前来\n援助克雷施坦因……不，\n是援助整个艾克塞·格兰德的。
27,シーザー/凯撒,イスタバイオン軍……！！,伊斯塔拜恩军……！！
28,シーザー/凯撒,なら、お願いです！\n<span class='scene-font-place'>ウィン・セリア</span>という島が──,这样的话，求求你们！\n有一个叫<span class='scene-font-place'>维因·塞利亚</span>的岛屿──
29,イスタバイオン軍隊長,……申し訳ありません、殿下。\n敵の攻撃は空域全体に及んでおり、\n我々も要衝の防衛が精いっぱいです。,……非常抱歉，殿下。\n敌人的攻击覆盖了整个空域，\n我们也正在倾尽全力防守要地。
30,イスタバイオン軍隊長,このクレシュタインすら、\n我々が駆けつけておきながら、\n被害は甚大で──,就连克雷施坦因这里，\n即便我们火速赶来，\n损失也极为惨重──
31,シーザー/凯撒,一体何が攻撃を仕掛けているのですか？\nそれに、父上や母上は──,究竟是谁发动的袭击？\n还有，父亲大人和母亲大人呢──
32,イスタバイオン軍隊長,……お父上の元にお連れしましょう。\n道すがらに、戦況の説明をいたします。,……我带您去您父亲那里吧。\n路上我会向您说明战况。
33,イスタバイオン軍隊長,お前達は城の防衛線を絶対死守しろ。\nここが最後の砦だ……！,你们给我死守城堡的防线。\n这里是最后的堡垒了……！
34,イスタバイオン兵１,はっ！,是！
40,シーザー/凯撒,父上……！！,父亲大人……！！
41,シーザーの父親,シー……ザー……？\nなぜ、ここに……,凯……撒……？\n为什么你会在这里……
42,,先代白騎士であるシーザーの父は、\n開戦当初から最前線で戦っていた。\nしかし、あまりに多勢に無勢であり……,凯撒的父亲前任白骑士\n从开战之初就一直在最前线战斗。\n然而，终究是寡不敌众……
43,,イスタバイオンの救援が到着する頃には\n既に手ひどい傷を負い、戦線離脱を\n余儀なくされていた。,等到伊斯塔拜恩的救援抵达时，\n他早已身负重伤，\n不得不退出战线。
44,シーザー/凯撒,<span class='scene-font-place'>ウィン・セリア</span>の人々が\n逃がしてくれたんです……！\nユリアも一緒です！,是<span class='scene-font-place'>维因·塞利亚</span>的人们\n掩护我们逃出来的……！\n尤利娅也和我在一起！
45,ユリア,お父様……けが、してるの？,父亲大人……您受伤了吗？
46,シーザーの父親,ああ、少しな……\n隊長殿、君が子供達を……,嗯，有一点……\n队长阁下，是您把孩子们……
47,イスタバイオン軍隊長,いえ。勇敢にもお子様達だけで、\n港からお戻りに……,不。两位孩子非常勇敢，\n是自己从港口回到了这里……
48,シーザーの父親,そうか……多少はたくましくなったな。\n母も、喜ぶだろう……,是吗……多少变得坚强了些啊。\n你们的母亲也会高兴的吧……
49,ユリア,お父様、お母様は……？,父亲大人，母亲大人呢……？
50,シーザーの父親,民の、避難所にいる……\n戦が終われば、また会える。,在民众的避难所中……\n等战争结束，就能再见面了。
51,ユリア,そうなの……よかった。,是吗……那太好了。
52,シーザー/凯撒,…………,…………
53,,既に市街地、避難所共に全滅したと、\nシーザーは隊長から聞かされていた。\n王族は民と運命を共にしたのだ。,凯撒之前已从队长那里听闻，\n市区和避难所均已覆灭。\n王族与民众已然命运与共。
54,シーザーの父親,……シーザー、ユリア。\nよいか、私の言うことをよく聞け。,……凯撒、尤利娅。\n你们两个，好好听我说。
55,シーザーの父親,もはや、クレシュタインは保たない。\nお前達はイスタバイオン軍と共に\n撤退し──,克雷施坦因已经守不住了。\n你们和伊斯塔拜恩军一起撤退──
58,ユリア,きゃあっ……！！,呀啊……！！
59,イスタバイオン軍隊長,城にまでこれほどの攻撃が……！,竟然连城堡这边\n也遭受到如此猛烈的攻击……！
62,イスタバイオン軍隊長,──シーザー殿下！！\nお逃げ下さい！！,──凯撒殿下！！\n请快逃！！
65,シーザー/凯撒,あっ……,啊……
66,,崩落した天井の一部が、\nシーザー目掛けて降り注がんとした時、\n咄嗟に、側にいたユリアが動いていた。,当崩塌的天花板碎片\n砸向凯撒时，\n他身旁的尤利娅出于本能扑上前。
67,ユリア,お兄様！！,兄长大人！！
76,,ユリアによって突き飛ばされた\nシーザーは間一髪、難を逃れた。\nしかし──,凯撒被尤利娅用力推开，\n于千钧一发之际逃过一劫。\n然而──
77,シーザー/凯撒,ユリア……ユリア……！！,尤利娅……尤利娅……！！
78,,ユリアの小さな身体のその半分は、\n瓦礫の下に押しつぶされていた。,尤利娅娇小的身躯有一半\n被压在了瓦砾之下。
79,シーザーの父親,ユリア……！　今助ける！\n隊長殿！　手を！,尤利娅……！我马上救你！\n队长阁下！ 请帮忙！
80,イスタバイオン軍隊長,はい！　ユリア様、しばしの──,是！ 尤利娅大人，请忍耐一下──
81,ユリア,いい……の……私は……\nおなかもあしも……なにも……\nかんじ……ないの……,不用了……我的……\n肚子和腿……已经……\n完全没有感觉了……
82,シーザーの父親,…………ッ！！,…………！！
83,シーザー/凯撒,なんで、僕のために……,为什么，要为了我……
84,ユリア,わたしは……お兄様と違って、\n頭も、よくないし、強くないから……,我……不像兄长大人那样，\n我不聪明，也不够强大……
85,ユリア,お兄様……立派な王様になって……\n美味しいパンを……\nみんなで……食べ……,兄长大人……请你成为一位出色的国王……\n然后……让大家……\n吃上美味的面包……
88,シーザー/凯撒,あ……あああ…………,啊……啊啊……
89,シーザーの父親,シーザー。私の言ったことは、\n聞いていたな……,凯撒。你听到我说的话了吧……
90,シーザーの父親,クレシュタインを出ろ。\nここに残っても、何も得るものはない。,离开克雷施坦因。\n留在这里没有任何意义。
91,シーザー/凯撒,<span class='scene-font-4'>い……嫌です！</span>\n僕も父上やユリアと──,<span class='scene-font-4'>我……我不要！</span>\n我也要和父亲大人、尤利娅一起──
92,シーザーの父親,お前の命の価値はその程度か！？,你的性命只有这点价值吗！？
93,シーザーの父親,ここで無駄に命を落とすことが、\n本当にお前の命の正しい使い道か！\n今、ユリアにそう言えるのか！？,在此白白丧命，\n就是你这条命真正的用途吗！\n现在，你对尤利娅说得出口吗！？
94,シーザー/凯撒,でも、僕にはもう、\n何も残っていないのです！\n友達も、家族もみんな死んでしまった！,但是，我已经，\n一无所有了啊！\n朋友、家人全都死了！
95,シーザーの父親,いいや、お前にはまだ、\n何よりも重要なものが残っている。,不对，你有一件\n比任何什么都重要的东西。
96,シーザーの父親,この鎧を──白騎士の位を継げるのは、\nもう、お前しかいない。,这副铠甲──能够继承白骑士之位的人，\n如今，只有你了。
97,シーザー/凯撒,だからなんだと言うのですか！！\nそんな鎧で、何が……！,那又怎么样！！\n就凭这副铠甲，又能……！
98,シーザーの父親,この白き鎧は、\n空の平穏を守るための力だ！,这副白色铠甲，\n是能够守护空之世界和平的力量！
99,シーザーの父親,私の力は至らなかった……\nだが、お前ならできる。\n空に、平穏をもたらせる！,我的力量不足……\n但是，你一定可以。\n你能够为空之世界带来和平！
100,シーザーの父親,だからこそ、今は逃げ、生きろ。\n真王陛下ならばきっと、\nお前を正しく導いてくれる……,正因如此，现在你要逃走、活下去。\n真王陛下一定会\n正确地引导你……
101,シーザーの父親,──頼む、お前だけは生きてくれ。,──拜托了，至少你要活下去。
102,シーザー/凯撒,……っ！！,……！！
105,イスタバイオン兵１,隊長！！　防衛線が突破されました！！,队长！！防线被突破了！！
106,イスタバイオン兵２,幽世の奴らが押し寄せてきています！\n撤退を……！！,幽世那群家伙冲进来了！\n请撤退……！！
107,イスタバイオン軍隊長,──シーザー様、\n港への隠し道はご存じなんですね？,──凯撒大人，\n您知道通往港口的密道吧？
108,シーザー/凯撒,は、はい……,是、是的……
109,イスタバイオン軍隊長,私の部下を託します。\n彼らをお救い下さい。,我把我的部下托付给您。\n请您救救他们。
110,シーザー/凯撒,あなたは……！？,您呢……！？
111,イスタバイオン軍隊長,私は時間を稼ぎます。\n……本当に短い間でしたが、\n貴方と出会えたことを光栄に思います。,我来争取时间。\n……虽然相处的时光非常短暂，\n但能与您相遇，我感到无比光荣。
112,シーザー/凯撒,…………っ！,…………！
113,,シーザーは歯を食いしばりながら、\n振り返ることなくその場を後にした。\n程なく、幽世の者達が押し寄せ──,凯撒咬紧牙关，\n头也不回地离开了那里。\n不久，幽世的军团蜂拥而至──
118,シーザーの父親,……シーザーの背を押してくれたこと、\n礼を言う。,……你推了凯撒一把，多谢。
119,イスタバイオン軍隊長,兵の命を預かる者として、\n当然の判断をしただけです。,作为一个肩负手下性命的人，\n我只是做出了理所当然的判断。
120,イスタバイオン軍隊長,……ああ、だけど、アマール。\n約束を守れなくてごめんよ。,……啊啊，不过，阿玛尔。\n对不起，我没能遵守约定。
126,,生かされた私達は命からがら、\nイスタバイオンに到着しました。,我们这些存活的人\n九死一生才总算抵达了伊斯塔拜恩。
127,,その後、私は前王の元で、\n白騎士の後継者となるべく、\n研鑽を積み……,在那之后，我在前任真王身边\n为了成为白骑士的继承人，\n不断磨练自己……
128,,遂に、白騎士の位と鎧を授かりました。\nその時私は誓ったのです。\n空の平穏と故郷の奪還を……,终于，我被授予了白骑士的头衔与铠甲。\n那一刻，我立下了誓言。\n要守护空之世界的和平，并夺回故乡……
129,,あとは……貴方もご存じの通りです。,之后的事……就如您所知了。
info,,,scene_chr978_q3_s10
译者,,,圣代天使