id,name,text,trans
0-chapter_name,,第112章　父の足跡,第112章 父亲的足迹
0-synopsis,,福音の民を退け、改めて境界の民に姬塔の父親が境界を抜け出した方法を聞く姬塔達。シトリによれば、「神火」と呼ばれる火山の噴火を利用し、その爆風で空の世界まで戻るという危険な手段をとったのだという。一行も同じく「神火」を利用して空の世界に戻ろうと決意し、境界の民も、姬塔の父親への恩返しにと協力を約束してくれるのだった。,击退福音之民后，姬塔她们再次向境界之民询问姬塔的父亲是如何离开境界的。根据志鸟所说，他利用被称为“神火”的火山喷发，借着爆风回到了空之世界。众人也决定同样利用“神火”回到空之世界，境界之民因受恩于姬塔的父亲，约定协助众人。
4,福音の民,はぁ……はぁ……,哈啊……哈啊……
5,ラカム/拉卡姆,どうする、まだ続けるか？,怎么样，还要继续打吗？
6,福音の民,くそ……<br>さすがは<span class='scene-font-spword'>“特異点”</span>の一味<br>といったところか……,可恶……不愧是“特异点”一行……
7,福音の民,覚えておけ……<br>貴様らの旅は必ず世界の破滅を招く。,给我记住……<br>你们的旅行必然会导致世界的破灭。
8,福音の民,その時になって、<br>せいぜい後悔しないことだな。,到那时候可别后悔。
9,,<span class='scene-font-katari'>そう捨て台詞を残すと、</span><br><span class='scene-font-katari'>福音の民達は、</span><br><span class='scene-font-katari'>一同の前から去っていくのだった。</span>,留下这些话后，<br>福音之民们便从众人面前离去。
10,ビィ/碧,ふぃ～……<br>なんだったんだよ、あれ。<br>何がどうなってんだ？,哈……那到底是什么意思？
11,シトリ,ありがとう。<br>君達には助けられた。,谢谢。还好有你们帮忙。
12,ミカ,すっごい強いんだね！<br>やっぱり、<br>おじさんの子供なんだぁ……！,你们很厉害！<br>果然是大叔的孩子呢……！
13,カタリナ/卡塔莉娜,襲撃の直後ですまないが……<br>いま、私達には<br>貴殿らに聞きたいことが山ほどある。,很抱歉，虽然刚经历过袭击……<br>但现在我们有太多事想问你们。
14,ロゼッタ/萝赛塔,話を聞かせて頂戴。<br>この島のこと、あの人のこと、<br>ビィ君とルリアちゃんのことも。,能说给我们听听吗，<br>这个岛的事，那个人的事，<br>还有碧和露莉亚的事。
15,,<span class='scene-font-katari'>真剣な様子の姬塔達に対し、</span><br><span class='scene-font-katari'>境界の民達もまた、</span><br><span class='scene-font-katari'>真剣な様子で頷きを返す。</span>,看着严肃的姬塔她们，<br>境界之民们同样严肃地点头回应道。
21,境界の民,──さて、<br>どこまで話したんだったかな。,那么，刚才说到哪里了来着？
22,ビィ/碧,結局、親父さんはどこに居るんだよ？<br>ここにはもう居ねぇ、<br>って言ってたけどよぅ……,说到底，老爹现在在哪里？<br>虽然刚才还说不在这里……
23,境界の民,それは、結論から言えば、<br>私達にもわからない。,从结论上讲，<br>我们也不知道。
24,シトリ,私達は、あの人を送り出した。<br>送り出してしまったんだ……,我们，已经将他送走了。<br>已经送走了……
24-sel1_txt,,<span class='scene-font-katari'>どういうこと？</span>,怎么回事？
25,,<span class='scene-font-katari'>姬塔の言葉に、</span><br><span class='scene-font-katari'>シトリは意を決した様子で話し始める。</span>,听了姬塔的话后，<br>志鸟下定决心开始讲述。
26,シトリ,ここに流れ着いた以上、<br>元の世界に戻るのは無理だ、<br>って、話したよね。,我刚才说过，<br>一旦漂流至此，<br>是绝对无法回到本来的世界的。
27,シトリ,でも、実はひとつだけ、<br>元の世界に戻る方法があるんだ。<br>……絶望的なのは変わらないけど。,但实际有一个方法可以回到原来的世界。<br> ……虽然那个方法会令人感到绝望。
28,シトリ,その絶望に挑んだのが、<br>君のお父さんだったんだ。,而挑战那个绝望的，<br>正是你的父亲。
29,,<span class='scene-font-katari'>シトリはおもむろに、</span><br><span class='scene-font-katari'>窓の外を指差す。</span>,志鸟缓缓地指着窗外。
30,シトリ,あの火山。見える？,那座火山。看得到吗？
36,,<span class='scene-font-katari'>シトリの指差す先には、</span><br><span class='scene-font-katari'>煮え滾る溶岩を湛えた</span><br><span class='scene-font-katari'>巨大な火山があった。</span>,志鸟手指的方向，<br>有一座翻滚着岩浆的火山。
42,イオ/伊欧,あの火山……活火山よね？<br><span class='scene-font-place'>バルツ</span>の火山よりは小さいけど、<br>いまにも噴火しそう……,那座火山……是活火山吗？<br>虽然比瓦尔兹的火山小，<br>但现在也像随时要喷发一样……
43,シトリ,あの火山の噴火を、<br>私達は「神火」って呼んでる。,我们把那座火山的喷发称为“神火”。
44,シトリ,それで、元の世界に戻るためには、<br>あの火山の噴火……<br>「神火」を使うんだ。,然后，要回到原来的世界，<br>要利用那座火山的喷发……也就是利用“神火”。
45,カタリナ/卡塔莉娜,火山の噴火を……使う？<br>いったいどういうことなんだ？,利用……火山喷发？<br>到底怎么回事？
46,,<span class='scene-font-katari'>困惑するカタリナに対し、</span><br><span class='scene-font-katari'>ラカムはさっと顔を青褪めさせる。</span>,相对一脸困惑的卡塔利娜，<br>拉卡姆脸色发青。
47,ラカム/拉卡姆,おいおいおいおい……<br>待てまてまて……,喂喂喂喂……<br>等下等下等下……
48,ラカム/拉卡姆,嘘だろ？,开玩笑的吧？
49,イオ/伊欧,え、え？　なになに？<br>なんでそんなおっかない顔してるのよ。,额，在说什么？<br>为什么一脸可怕的表情？
50,ラカム/拉卡姆,当たり前だ。<br>操舵士として、<br>これが笑ってられるか、ってんだ……,当然啊。<br>作为一名驾驶员，<br>这还怎么笑得出来……
51,ラカム/拉卡姆,あんた達の言う、<br>元の世界に戻る方法ってのは、<br>噴火の爆風を使うことなんだろ？,你们说的回到原来世界的方法，<br>是利用火山喷发的爆风吧？
52,ラカム/拉卡姆,そりゃ確かに<br>空に戻れるだけの<br>威力はあるだろうけどよ……,虽然那确实有足以让我们回到天空的威力……
53,ラカム/拉卡姆,戻れるにしてもちと強引すぎねぇか？<br>本当の話なんだろうな？,但也太勉强了吧？<br>这是真的吗？
54,境界の民,それだけじゃない。<br>「神火」には<br>星晶獣ヱビスの力が宿っていてね。,不仅仅如此。<br>“神火”中包含有星晶兽惠比寿的力量。
55,境界の民,ヱビスが司るものは福音。<br>幸運の訪れ……<br>それは運命の流れとも言い換えられる。,惠比寿掌管福音。<br>幸运的到来……也能被解释成命运的流动。
56,境界の民,その福音の力は<br>あらゆる境界を越えて作用する。,那股福音之力有穿越一切境界的力量。
57,境界の民,だから、<br>星晶獣ヱビスが起こす「神火」には、<br>境界を越える力があるんだ。,因此，星晶兽惠比寿引发的“神火”<br>有穿越境界的力量。
58,ラカム/拉卡姆,説明されたところで、<br>噴火の力を使うなんざ、<br>とんでもねぇ方法だぞ……,按照你们的说明的话，<br>要利用火山喷发的力量，可真是不得了的方法啊……
59,ロゼッタ/萝赛塔,でもそれなら……<br>あの人は、その「神火」に乗って、<br>ここを脱出したっていうのかしら？,所以说……<br>那个人就是乘着“神火”从这里脱离的吗？
60,シトリ,…………,…………
61,,<span class='scene-font-katari'>ロゼッタの問いに、</span><br><span class='scene-font-katari'>シトリはおずおずと頷きを返す。</span>,对于萝塞塔的疑问，志鸟点了点头。
62,ミカ,すごかったよ！<br>どかーん、って！,很厉害呢！<br>哗地一下！
63,ビィ/碧,マジかよ……<br>親父さん、<br>とんでもねぇことするな。,真的假的啊……<br>老爹真是干了不得了的事。
64,ロゼッタ/萝赛塔,ふふ……そうね。<br>相変わらずだわ、あの人は。,呵呵……就是呢。<br>那个人还是老样子。
65,境界の民,申し訳ない……<br>本当に、彼の子供である君には、<br>なんて謝ったらいいか……,对不起……<br>我真不知道该向身为他孩子的你，<br>怎么道歉才好……
65-sel1_txt,,<span class='scene-font-katari'>どうして謝るの？</span>,为什么要道歉？
66,,<span class='scene-font-katari'>姬塔の問いに対し、</span><br><span class='scene-font-katari'>境界の民は、気まずそうに訳を話す。</span>,对于姬塔的疑问，<br>境界之民尴尬地说道。
67,境界の民,確かに「神火」には、<br>この境界を脱出する力がある。,虽然“神火”确实有脱离境界的力量。
68,境界の民,しかし、それだけだ。<br>それ以上は、何も保証しない。,但是仅此而已。<br>除此之外，我们无法做任何保证。
69,シトリ,想像して。<br>この境界は空の世界よりも<br>かなり下なんだ。,想象一下。<br>这个境界远低于空之世界。
70,シトリ,そこから、突き上げる力に乗って、<br>空の世界へ行けばどうなるか。,从这里乘着上升之力前往空之世界会怎么样。
71,イオ/伊欧,どうなるって……<br>普通に空の上に出て終わりじゃないの？,会怎么样……<br>不就是到达天空中吗？
72,カタリナ/卡塔莉娜,いや、そうか……<br>イオの言う通りでもあるが、<br>それは運が良かった場合に限るな。,不，也对……虽然伊欧说的也对，<br>但那仅仅是运气好的情况。
73,カタリナ/卡塔莉娜,最悪の場合、<br>島の底や他の騎空艇に<br>下から激突することになる……,最糟糕的情况下，<br>撞到浮岛或者其他骑空艇的底部…….
74,オイゲン/欧根,それだけじゃあねぇ。<br>瘴流域に放り投げられちまうってのも、<br>考えられるなぁ、おい……,不仅如此。<br>要是被喷到瘴流域，光是想想就……
75,ルリア/露莉亚,じゃ、じゃあ……<br>空の世界に戻れたとしても、<br>運が悪ければ……,那，那么……<br>运气好的话才能回到空之世界，<br>如果运气不好的话……
76,,<span class='scene-font-katari'>シトリはやるせない様子で目を伏せる。</span>,志鸟无法释怀地闭上眼。
77,シトリ,私達には<br>あの人の無謀を止められなかった……,我们没有阻止那个人的鲁莽……
78,シトリ,それどころか、心のどこかで、<br>あの人を応援してた。,相反，甚至在心中为他加油。
79,シトリ,この人ならきっと、どんな無茶でも<br>やり遂げてくれるんじゃないか、<br>って……,那个人的话，<br>不管是怎样的困境都能克服……
80,,<span class='scene-font-katari'>最悪の悲劇を想定し、</span><br><span class='scene-font-katari'>誰もが口を噤んでしまうが……</span>,然而一想到最坏的情况，<br>谁都无法说出话……
80-sel1_txt,,<span class='scene-font-katari'>大丈夫</span>,没关系。
81,シトリ,えっ……？,呃...？
82,シトリ,で、でも、ここを脱出した後、<br>あの人がどうなったかなんて、誰も……,但、但是，离开这里之后，<br>谁都不知道那个人怎样了……
82-sel1_txt,,<span class='scene-font-katari'>手紙をもらった</span>,我收到了一封信
83,シトリ,手紙……？,一封信……？
84,ビィ/碧,そっか！　そうだぜ！<br>あの手紙のことだよな！,哦对！就是那样！<br>是那封信吧！
85,ロゼッタ/萝赛塔,ひとつ確認させて頂戴。<br>あの人は、姬塔さんのことを<br>なんて言っていたかしら？,首先让我确认一下。<br>他是怎么说姬塔的事的？
86,ミカ,置いてきちゃった、って言ってた。<br>すごく悲しそうだった……<br>でも、行かなきゃいけなかった、って。,说是把她丢下了。<br>看起来很伤心……但是，<br>不得不去，他是这么说的。
87,シトリ,そう。<br>まだ幼い我が子を、<br>故郷に残してきた、って……,是啊。把自己年幼的孩子留在故乡……
88,,<span class='scene-font-katari'>姬塔は</span><br><span class='scene-font-katari'>自身の旅立ちの切っ掛けになった、</span><br><span class='scene-font-katari'>父からの手紙について話す。</span>,姬塔向大家说明了<br>收到父亲的信以后，<br>下定决心踏上旅程的事。
89,シトリ,<span class='scene-font-spword'>星の島イスタルシア</span>からの……手紙。,来自星之岛伊斯塔尔西亚的……<br>一封信。
90,ミカ,すごい……！<br>おじさん、本当にたどり着いたんだ！,好厉害...！<br>大叔真的到了啊！
91,境界の民,あの人は、<br>無事に空に戻れたんですね……<br>それどころか、星の世界にまで……,他平安回到天空了啊……<br>不止这样，甚至还到了星之世界……
92,ラカム/拉卡姆,しかし、聞けば聞くほど、<br>姬塔の親父さんは<br>凄まじい奴だな……,不过真是越听越觉得<br>姬塔的老爹是个可怕的家伙……
93,カタリナ/卡塔莉娜,この分だと、<br>まだまだ私達の知らない<br>逸話が出てきそうだが……,按照这个节奏的话，<br>似乎还会有不少我们不知道的轶事啊……
93-sel1_txt,,<span class='scene-font-katari'>負けてられない</span>,可不能输
93-sel2_txt,,<span class='scene-font-katari'>すぐに追いつく</span>,马上就追上你
94,ルリア/露莉亚,ですね！<br>それに姬塔なら、<br>きっと大丈夫です！,就是呢！<br>而且是姬塔的话，<br>肯定没问题的！
95,オイゲン/欧根,となりゃあ、<br>足踏みしてるわけにゃいかねぇな。,那么可不能原地踏步了呢。
96,,<span class='scene-font-katari'>姬塔は、</span><br><span class='scene-font-katari'>シトリを含む境界の民達を</span><br><span class='scene-font-katari'>真っ直ぐに見据え、告げる。</span>,姬塔看向包括志鸟在内所有境界之民，对他们说。
96-sel1_txt,,<span class='scene-font-katari'>協力してほしい</span>,希望能协助我们
97,シトリ,「神火」を使う気なんだね。,是打算利用“神火”吧。
98,シトリ,あの人は無事だったみたいだけど、<br>それでも、<br>危険な賭けであることは変わらない。,虽然他似乎没事，<br>但这仍然是一个危险的赌注。
99,シトリ,それに、あの人が無事だったからって、<br>君達も無事に戻れる保証は無い。,而且，他的平安<br>并不代表你们也能平安返回。
100,シトリ,それでも……君達は行くの？,就算这样……<br>你们还是要去吗？
101,,<span class='scene-font-katari'>シトリの問いに対し、</span><br><span class='scene-font-katari'>姬塔は意思を確認するように、</span><br><span class='scene-font-katari'>騎空団の面々を見やる。</span>,对于志鸟的提问，<br>姬塔仿佛为了确认骑空团众人的意志一般，<br>扫过众人的脸。
102,ロゼッタ/萝赛塔,アタシは……そうね。,我的话……<br>是呢。
103,ロゼッタ/萝赛塔,姬塔さんなら、<br>もっとドキドキさせてくれるって<br>信じてるわ。,姬塔的话，<br>相信能让我更加兴奋。
104,イオ/伊欧,正直、いままでだって何度も、<br>危ない目には遭ってきたし……,说起来，<br>一直以来也遭遇过很多次危险了……
105,イオ/伊欧,方法があるなら、<br>やってみない理由なんて<br>ないんじゃない？,既然有方法，<br>就没有不去尝试的理由吧。
106,オイゲン/欧根,まぁ、騎空士なんてのは、<br>常に危険と隣り合わせだ。,没办法，<br>骑空士总是常伴危险的。
107,オイゲン/欧根,だったら面白れぇほうに<br>舵を切るしかねぇよなぁ、おい！,既然这样，<br>只能带着乐趣去操舵吧！
108,ラカム/拉卡姆,俺は操舵士だぞ。<br>こんなもん、聞くまでもねぇだろ。,我可是驾驶员。<br>这种事，不用问也知道了吧。
109,ラカム/拉卡姆,ここじゃ騎空艇は飛ばせねぇ。<br>んなもん俺にとっちゃ、<br>死んじまってるのと同じだ。,这里骑空艇飞不起来，<br>对我来说和死了没区别。
110,ラカム/拉卡姆,だったら、命を懸けてでも、<br>グランサイファーが飛べる空に<br>戻るしかねぇだろ。,既然这样，<br>拼上性命也要回到让格兰赛法回到天空之中。
111,ラカム/拉卡姆,……まぁ、<br>艇に無理させない方法で戻れりゃ、<br>言うことねぇんだけどな。,……虽然这么说，<br>如果是个不用让飞艇遭受风险的方法就更好了。
112,カタリナ/卡塔莉娜,私は……<br>ルリアと君と、共に行くと決めている。<br>その決意はもう、揺らぐことは無い。,我……已经决定要和你还有露莉亚一起旅行了。<br>这个决心不论如何都不会动摇。
113,カタリナ/卡塔莉娜,だから後は、<br>君達の判断に任せよう。,所以，<br>剩下的就交给你们来决定。
114,,<span class='scene-font-katari'>カタリナの言葉に応じるように、</span><br><span class='scene-font-katari'>ルリアはゆっくりと</span><br><span class='scene-font-katari'>姬塔に告げる。</span>,就像是为了回应卡塔丽娜的话语一般，<br>露莉亚缓缓地对姬塔说。
115,ルリア/露莉亚,姬塔は、<br>最初から言ってましたよね。<br><span class='scene-font-spword'>星の島イスタルシア</span>に行く、って。,姬塔一开始就说了吧，<br>要去星之岛伊斯塔尔西亚。
116,ルリア/露莉亚,それってきっと憧れだけじゃなくて、<br>お父さんが待っていてくれるから、<br>なんですよね……？,那一定不仅仅是憧憬，<br>父亲也在那里等着你，是吧……？
117,ルリア/露莉亚,私はお父さんも<br>お母さんもわからないけど……,我虽然不知道什么是父亲和母亲……
118,ルリア/露莉亚,でも、どこに居るのかわかったら、<br>きっと会いに行くと思うんです。,但要是知道他们在哪里的话，<br>肯定会想去见他们的。
119,ルリア/露莉亚,いままで色んな旅をしてきて、<br>色んな島や空に行って……,至今为止到各个岛屿以及空域<br>进行了这么多的旅行……
120,ルリア/露莉亚,それでいま、ようやく、少し、<br>姬塔のお父さんに近づけて……,才能，<br>稍微接近姬塔的父亲一点……
121,,<span class='scene-font-katari'>強い意志を伝えるように、</span><br><span class='scene-font-katari'>ルリアは真っ直ぐに</span><br><span class='scene-font-katari'>姬塔を見つめる。</span>,就像为了传达自己强烈的决意一般，<br>露莉亚笔直地盯着姬塔。
122,ルリア/露莉亚,だから私……<br>姬塔には、<br>絶対に諦めてほしくないです。,所以我……<br>希望姬塔绝对不要放弃。
122-sel1_txt,,<span class='scene-font-katari'>一緒に行こう</span>,一起去吧
123,ルリア/露莉亚,はいっ！,好的！
124,ビィ/碧,へへっ……<br>親父さんが<span class='scene-font-spword'>星の島</span>で待ってんだ。<br>こんなところじゃ止まれねーよな！,嘿嘿……老爹在星之岛等着呢，<br>怎么能在这种地方停下！
125,,<span class='scene-font-katari'>姬塔は、</span><br><span class='scene-font-katari'>自分達騎空団の決断を</span><br><span class='scene-font-katari'>シトリ達に告げる。</span>,姬塔将骑空团的决定<br>告诉了志鸟。
126,シトリ,そう……<br>じゃあ、もう止める理由は無いね。,是嘛……<br>那么就没有阻止你们的理由了。
127,ミカ,えぇ～……<br>せっかく来てくれたのに……,诶……好不容易来了……
128,シトリ,だめだよ、ミカ。<br>ワガママ言っちゃ。,不行哦，米卡。<br>不能任性。
129,境界の民,君達の覚悟がそこまでのものなら、<br>私達も力を貸そう。,既然你们的有如此这般的觉悟，<br>那么我们也会鼎力相助。
130,境界の民,何より、<br>君達には恩返しをさせてほしい。,最重要的是，<br>希望能够报答你们。
131,ルリア/露莉亚,えっ、わ、私達は別に何も……,呃，我们，并没有做什么……
132,境界の民,ああ、いや、違うんだ……<br>正しくは、君のお父さんに受けた恩を<br>返させてほしい。,哦，不对，并不是……<br>正确的说应该是，<br>把从你父亲那里收到的恩情，报答给你。
133,境界の民,いまは<span class='scene-font-spword'>星の島</span>に居るのなら、<br>直接、恩を返すのは、<br>難しそうだからね。,如果他现在真的在星之岛的话，<br>要直接报恩很难呢。
133-sel1_txt,,<span class='scene-font-katari'>ありがとう</span>,谢谢
133-sel2_txt,,<span class='scene-font-katari'>助かります</span>,帮大忙了
134,境界の民,当然のことだ。<br>何しろ私達は、君のお父さんから、<br>かけがえのないものをもらった。,这是理所当然的。<br>毕竟，我们从你父亲那里获得了无法替代的东西。
135,イオ/伊欧,かけがえのないもの？,无法替代的东西？
136,境界の民,希望だ、生きるためのね。,活下去的希望。
137,境界の民,君達もそうだと思うが、<br>私達は皆、死を覚悟した末に、<br>偶然ここに流れ着いたんだ。,我想你们也是这样的，<br>我们所有人都是抱着死的觉悟，<br>偶然漂流至此。
138,境界の民,死んだ、と思ったが生きていた。<br>しかし、元の世界に戻れないのだから、<br>生きているとも言い難い。,以为自己死了却还活着。<br>但是因为回不到原本的世界，<br>很难说是真正地活着。
139,境界の民,そんな半端な状況ゆえに、<br>私達はいまの自分達に<br>理由と意味を与えた。,在这种不明不白的情况下，<br>我们给了现在的自己理由和意义。
140,,<span class='scene-font-katari'>自嘲するように、</span><br><span class='scene-font-katari'>境界の民は苦々しげに語る。</span>,境界之民自嘲似的痛苦地说道。
141,境界の民,ここを襲った連中が居ただろう。<br>私達も昔は彼らと一緒だった。,刚才袭击这里的家伙，<br>我们以前也和他们一样。
142,境界の民,進めないのではなく、進まないのだと、<br>変わることを諦め、<br>いまを肯定することに執着した。,并非无法前进，而是不去前进，<br>放弃了改变，执着于现在。
143,境界の民,そんな日々を壊してくれたのが、<br>君のお父さんなんだ。,而打破那些日子的就是你的父亲。
144,,<span class='scene-font-katari'>輝かしい思い出を語るように、</span><br><span class='scene-font-katari'>境界の民は続ける。</span>,就像讲述美好的回忆般，<br>境界之民继续说着。
145,境界の民,あの人に頼まれて、<br>「神火」の研究を始めてね。,在他的请求下，<br>我们开始研究“神火”。
146,境界の民,無為に過ごしていた日々が、<br>忙しい毎日に変わった。<br>あとはあっという間さ。,原本碌碌无为的日子，<br>逐渐变得忙碌了起来。
147,境界の民,何か急ぐ理由があったようでね。<br>お礼を言う暇も無かった。,他好像非常慌忙，<br>我们都没有向他道谢的时间。
148,境界の民,まぁ……<br>礼を言われるようなことだとは、<br>彼は思ってなかったかもしれないが。,嗯……可能对他来说，<br>自己并没有做过什么需要被人道谢的事。
149,,<span class='scene-font-katari'>境界の民はそう締めくくり、</span><br><span class='scene-font-katari'>改めて姬塔へと向き直る。</span>,境界之民这样总结道，<br>并且再次面向姬塔。
150,境界の民,すまない。<br>長くなってしまったね……,抱歉。<br>说的有些长了……
150-sel1_txt,,<span class='scene-font-katari'>話が聞けて良かった</span>,很高兴能听到这件事
151,ビィ/碧,だな。オイラ達、<br>親父さんが旅で何してたかなんて、<br>あんまり知らねーもんな。,就是啊，<br>老爹究竟进行了怎样的旅行，<br>我们都不太清楚。
