id,name,text,trans
0-chapter_name,,第118章　憧憬からの問い,憧憬的问询
0-synopsis,,ヴァルフリートは、かつて姬塔の父親とヴァルフリート達が乗っていた艇の動力部を使えばグランサイファーを直せることを告げ、姬塔の父親に課せられた使命と、ビィの正体、そして、いかにしてルリアが空の世界へやってきたのかを語る。父親と対立する可能性があるとしても、このまま旅を続ける意思があるのかと問われた姬塔は、その決意を言葉にするのだった。,瓦尔弗里德说，只要把曾经和姬塔的父亲一同乘坐的飞空艇的动力部件来给格兰塞法换上就能修好了。除此之外，还说明了姬塔的父亲被赋予的使命，以及碧的正体，以及露莉亚究竟是如何来到空的。就算在这之后与父亲对立的可能性很高，但姬塔却依然米诶有动摇要继续进行旅行的决心，并将之化为决意，说道。
1,ヴァルフリート,君の父のかつての戦友……<br>ヴァルフリートだ。<br>リーシャ共々よろしく頼む。,我是你父亲过去的战友……瓦尔弗里德。<br>和莉夏一起，请多指教了。
2,,<span class='scene-font-katari'>姿を現した碧の騎士、</span><br><span class='scene-font-katari'>秩序の騎空団総団長は、</span><br><span class='scene-font-katari'>紳士的な様子で己の名を名乗る。</span>,现出身姿的碧之骑士，<br>同时也是秩序骑空团的总团长，<br>十分绅士地报上了自己的姓名。
3,,<span class='scene-font-katari'>続けて彼が行ったのは、</span><br><span class='scene-font-katari'>姬塔達に対する謝罪だった。</span>,然而接下来，<br>他却向姬塔等人谢罪了。
4,ヴァルフリート,先の<span class='scene-font-place'>ガロンゾ</span>ではすまなかった。<br>あの場には居たが、<br>加勢をすることが出来なかったのだ。,刚才在噶隆索发生的事，<br>真的非常抱歉。明明是那种情况，<br>我却没法出来帮忙。
5,ヴァルフリート,今回の騒動について、<br>秩序の騎空団は静観を貫くよう、<br>真王から命令が出ている。,有关这次的骚动，<br>根据秩序骑空团在后方观察的情况看来，<br>应该是真王命令的。
6,リーシャ/莉夏,今回、秩序の騎空団が<br>彼らを野放しにしていたのも、<br>そういうわけなんです。,这次，秩序骑空团之所以放任他们不管，<br>也正是因此。
7,ヴァルフリート,真王の調査を続けるために、<br>まだ目をつけられるわけには<br>いかなくてね。,如果想要继续调查真王的话，<br>可不能就这样打草惊蛇了。
8,ヴァルフリート,せめてもの助けになれば、と、<br>ドランク達を、<br>こちらの空域まで連れてきたのだが……,想着多多少少要帮点忙，<br>于是我们就把德朗克他们从<br>那边空域带了回来。
8-sel1_txt,,<span class='scene-font-katari'>助かりました</span>,真是帮大忙了
9,カタリナ/卡塔莉娜,そうだな……<br>あのタイミングで彼らの加勢が無ければ<br>今頃どうなっていたことか……,也是……如果那会儿没有他们的帮忙，<br>现在又会是什么情况呢……
10,,<span class='scene-font-katari'>姬塔達の答えに、</span><br><span class='scene-font-katari'>ヴァルフリートはどこか嬉しそうに</span><br><span class='scene-font-katari'>目を細める。</span>,听了姬塔等人的回答后，<br>瓦尔弗里德像是很开心似的眯起了眼睛。
11,ロゼッタ/萝赛塔,その口振りからすると、<br>神聖エルステ帝国の背後に<br>真王がいるのは間違いないのね？,从你的话里听来，<br>在神圣埃尔斯特帝国背后的，<br>果然就是真王吗？
12,ヴァルフリート,そうだ。<br>詳しい目的は、<br>まだわからないが……,没错。<br>虽然我们还不清楚他的目的……
13,ヴァルフリート,しかし、この先、<br>君達にも干渉してくるであろうことは<br>間違いない。,但是不管怎么说，<br>你们也会进行干涉的。
14,ヴァルフリート,そこで今日は、<br>戦友だった君の父に代わり、<br>君達の旅路に餞別を贈らせてほしい。,所以今天，我作为你父亲的战友，<br>希望送你们一件东西，<br>作为旅途的饯别之礼。
15,ラカム/拉卡姆,餞別だと……？,饯别……？
16,,<span class='scene-font-katari'>ラカムの言葉に頷くと、</span><br><span class='scene-font-katari'>ヴァルフリートは一行の傍らの</span><br><span class='scene-font-katari'>グランサイファーを見上げる。</span>,听了拉卡姆的话后，<br>瓦尔弗里德点了点头，<br>并且看着一边的格兰塞法。
17,ヴァルフリート,実は<span class='scene-font-place'>ガロンゾ</span>には、<br>かつて姬塔の父と我々が<br>旅に使った騎空艇が眠っている。,其实在噶隆索，<br>沉睡着一艘曾经我和姬塔父亲用来旅行的骑空艇。
18,ヴァルフリート,そしてその艇は、<br>このグランサイファーの、<br>兄弟艇だったはずだ。,那艘飞空艇，<br>是格兰塞法的兄弟艇。
19,ラカム/拉卡姆,グランサイファーの……！？<br>あったのか！？　そんなのが。,格兰塞法的……！？<br>居然，有这种东西吗……！？
20,ノア/诺亚,無い、とは言わなかったはずだよ。,我可从来没否定过哟。
21,,<span class='scene-font-katari'>ノアは秘密を明かすよう、</span><br><span class='scene-font-katari'>恭しく語り始める。</span>,既然秘密已经被人点破，<br>诺亚干脆恭敬地说了起来。
22,ノア/诺亚,それはかつて、<br><span class='scene-font-spword'>空の果て</span>までたどり着いた、<br>伝説の艇だ……,那是一艘，曾经到达过空之尽头的，<br>传说中的骑空艇。
23,ノア/诺亚,しかし、いまでは傷つき、<br>すでに翼を失っている。,但是，由于受到了上海，<br>他失去了双翼。
24,ノア/诺亚,しかしそれでも、<br>その心臓……動力部はまだ動く。<br>それは、この僕が保証しよう。,庆幸的是，他的心脏……也就是动力部还能使用。<br>这点，我可以保证。
25,,<span class='scene-font-katari'>自信を持った様子で、</span><br><span class='scene-font-katari'>誇らしげに、ノアはそう告げる。</span>,诺亚非常自信地、<br>自豪地说道。
26,ノア/诺亚,グランサイファーの動力部は、<br>確かにもう、直す手立ては無い。,格兰塞法的动力部确实，<br>已经没有修理的办法了。
27,ノア/诺亚,しかし、動力部そのものを移植すれば、<br>グランサイファーは<br>再び空へ飛立つことが出来る。,但是，只要把动力部本身进行移植的话，<br>格兰塞法就能再次飞上天空。
28,ノア/诺亚,他の艇の動力部なんて、<br>普通は使えないのだけれど……,本来其他飞空艇的动力部，<br>是没法这么简单就被使用的……
29,ノア/诺亚,同型の兄弟艇なら、<br>それは不可能じゃないんだ。,正因为是同型号的兄弟艇，<br>就不再是不可能的了。
30,,<span class='scene-font-katari'>そのノアの言葉に、</span><br><span class='scene-font-katari'>一行は大きく安堵のため息をつく。</span>,诺亚的话，<br>让一行人大大的松了口气。
30-sel1_txt,,<span class='scene-font-katari'>良かった……</span>,太好了……
30-sel2_txt,,<span class='scene-font-katari'>本当に良かった……</span>,真的太好了……
31,ビィ/碧,そういうことなら、<br>早く言ってくれよ……,既然有这种事，那就早点说啊……
32,ビィ/碧,オイラ、グランサイファーとは、<br>もうここでお別れなのかと<br>思っちまったぜ……,俺，还以为……<br>要和格兰塞法说再见了呀……
33,ノア/诺亚,意地悪するつもりは<br>なかったのだけれど……<br>少し、伝え方が回りくどかったかな。,虽然我没有恶趣味的意思……<br>只是讲述的方法，<br>稍微绕了点圈子罢了。
34,ラカム/拉卡姆,ったく……,真是的……
35,,<span class='scene-font-katari'>ラカムは肩をすくめると、</span><br><span class='scene-font-katari'>感謝を込めてヴァルフリートに</span><br><span class='scene-font-katari'>頭を下げる。</span>,拉卡姆耸了耸肩，<br>满怀谢意地对着瓦尔弗里德低下了头。
36,ラカム/拉卡姆,助かったぜ……<br>いや、俺にとっちゃ救世主だ。,帮大忙了……<br>不，你就是我的救世主。
37,ラカム/拉卡姆,俺にはもう、<br>グランサイファーを置いてくことは、<br>考えられねぇからな。,我也，<br>以为要就这么把格兰塞法扔在这儿了。
38,ヴァルフリート,そこまで想ってもらえているとは、<br>艇造りの星晶獣として、<br>ノアも鼻が高いだろう。,你居然说到这种程度，<br>造船的星晶兽诺亚，<br>可是要把鼻子翘上天咯。
39,ヴァルフリート,それに、<br>旅を終え眠りについていた艇が、<br>君達の役に立つのなら、私も嬉しい。,而且，能用结束了旅程而陷入沉睡的骑空艇<br>帮上你们的忙，我也很开心。
40,,<span class='scene-font-katari'>しかし、不意に視線を鋭くし、</span><br><span class='scene-font-katari'>ヴァルフリートは問いかける。</span>,但是，瓦尔弗里德的视线突然变得尖锐，<br>调转了话题。
41,ヴァルフリート,だが……餞別を贈る前に、<br>私は姬塔に<br>問わねばならない。,但是，在作为饯别礼送给你们之前，<br>我有个问题非问你不可。
42,ヴァルフリート,そして、そのためにはまず、<br>君は知る必要がある。<br>君の父の、その旅路についてだ。,可是首先，你有必须要知道的事。<br>有关你父亲的，这段旅途。
43,ビィ/碧,親父さんの旅……？<br>教えてくれるのか……？,老爹的绿图……？<br>你要告诉我们吗……？
44,ヴァルフリート,その時が来た、ということだ。,时机已到……罢了。
45,,<span class='scene-font-katari'>そう前置きするとヴァルフリートは、</span><br><span class='scene-font-katari'>過去を懐かしむように、</span><br><span class='scene-font-katari'>語り始める。</span>,说完这些后，<br>瓦尔弗里德就像是在怀念过去似的，<br>开始讲述。
46,ヴァルフリート,君の父……<br>かつて我々を率いていた男は、<br>一つの<span class='scene-font-spword'>“使命”</span>を受け、旅をしていた。,你的父亲，<br>曾经率领着我们的男人，<br>是因为接受了某个“使命”，才开始旅行的。
47,ヴァルフリート,その使命を与えたのは、<br>何を隠そう、<br>この空の世界の<span class='scene-font-spword'>“神”</span>そのものでね。,赋予他这份使命的人，<br>是隐藏着什么的，<br>类似这个空之世界“神”的存在。
48,ヴァルフリート,ゆえに、奴は<span class='scene-font-spword'>“神の使徒”</span>として、<br>絶対的な力を持っていた。,也就是说，作为“神之使徒”的他，<br>拥有绝对的力量。
49,イオ/伊欧,ちょ、ちょっと待って……<br>なんかもう、<br>いきなり付いていけないんだけど……,等、等等……<br>怎么回事……<br>我有点跟不上你了……
50,イオ/伊欧,姬塔のお父さんって、<br>そんなにとんでもない人だったの？,姬塔的父亲，<br>居然是这么了不得的人物吗？
51,ヴァルフリート,あの男自身は、<br>とても神の使徒とは思えないような、<br>大雑把な性格をしていたがね。,虽然那个男人拥有完全不像神之使徒的，<br>粗枝大叶的性格。
52,,<span class='scene-font-katari'>ヴァルフリートは、</span><br><span class='scene-font-katari'>かつての戦友の様子を、</span><br><span class='scene-font-katari'>楽しげに語る。</span>,说起过去的战友，<br>瓦尔弗里德似乎非常乐在其中。
57,ヴァルフリート,あの男が受けた使命というのは、<br>空の世界に散った<span class='scene-font-spword'>星の欠片</span>を集めろ、<br>というものだった。,那个男人所接受的使命是，<br>搜集在这片空之世界分散的星之欠片。
58,ヴァルフリート,<span class='scene-font-spword'>星の欠片</span>とは即ち、<br>空の世界に点在する星晶獣、<br>その力を意味する。,星之欠片对于空之世界来说，<br>也就是分散到四处的星晶兽的力量。
63,ヴァルフリート,星晶獣から星の力を奪い、<br>星晶獣とされる前のカタチに還元する、<br>それが奴の使命だった。,从星晶兽那夺走星之力，<br>让星晶兽变回原来的形态，<br>这就是他的使命。
64,ヴァルフリート,そのために、<br>巫女を通して遣わされたのが、<br>そのビィだと聞いている。,为了这个，通过巫女被派到他身边的，<br>听说就是碧。
65,ビィ/碧,っ！？　オ、オイラが……？,诶！？俺。俺吗……？
66,,<span class='scene-font-katari'>不意に話を向けられ驚くビィに対し、</span><br><span class='scene-font-katari'>カタリナは合点がいった様子で</span><br><span class='scene-font-katari'>声を上げる。</span>,和惊讶的碧相对，卡塔丽娜像是明白了什么似的点了点头。
67,カタリナ/卡塔莉娜,そうか……記憶と共に封印されていた、<br>ビィ君のあの力には、<br>そういう理由があったのだな。,这样啊……和记忆一起封印的碧的力量，<br>就是因为这个理由啊。
68,,<span class='scene-font-katari'>カタリナの推論に頷きを返し、</span><br><span class='scene-font-katari'>今度はロゼッタが口を開く。</span>,像是回答卡塔丽娜的推论一般，<br>罗塞塔点着头，说道。
69,ロゼッタ/萝赛塔,ここからはアタシが話すわ。,从这里由我来说明。
70,ロゼッタ/萝赛塔,ううん……<br>きっと星晶獣であるアタシが<br>話さなければならないの。,嗯……这必需由身为星晶兽的我<br>来进行说明不可。
71,,<span class='scene-font-katari'>そう告げると、</span><br><span class='scene-font-katari'>ロゼッタは意を決した様子で、</span><br><span class='scene-font-katari'>閉ざしていた過去を語り始める。</span>,说完这些后，<br>罗塞塔就像是下定了什么决心一般，<br>闭上眼睛，讲述起了过去。
72,ロゼッタ/萝赛塔,星晶獣にとって、<br>星の力を奪われることは、<br>ほとんど死に等しいわ。,对于星晶兽来说，<br>被夺走星之力，也就等于死了。
73,ロゼッタ/萝赛塔,だからこそ、<br>彼に反発する星晶獣も居たし、<br>彼を<span class='scene-font-spword'>“星晶獣殺し”</span>と呼ぶ者もいた。,正因如此，他在反抗他的星晶兽那里，<br>被称作“星晶兽杀手”。
74,ロゼッタ/萝赛塔,けれど……<br>それは真実じゃなかった。,但是……这并不是真实。
75,ロゼッタ/萝赛塔,彼は消えることを拒んだ者から、<br>無理に星の力を<br>奪ったりはしなかったわ。,他并没有从不愿消失的星晶兽哪里，<br>强行夺走星之力。
76,ロゼッタ/萝赛塔,彼はあくまで星晶獣を助けるために、<br>戦い続けていたの。,他反而为了帮助星晶兽们，<br>持续进行着战斗。
77,ロゼッタ/萝赛塔,星晶獣にも色々いるわ……<br>姿と力を得てしまったことで、<br>苦しんでいる子もたくさんいた。,星晶兽也有很多……<br>因为得到了形态和力量，<br>而痛苦着的孩子存在。
78,ロゼッタ/萝赛塔,そういう子を助けるために、<br>貴方のお父さんは<br>ビィ君の力を使ったわ。,为了帮助这种孩子，<br>你的父亲，使用了碧的力量。
79,ロゼッタ/萝赛塔,身体を得てしまった神や伝説を<br>星の呪縛から解き放ち、<br>カタチ無き神、信仰へ還す旅路……,那些得到了身体的神与传说，<br>从星之咒缚中解放出来，<br>并向着无形之神、信仰返回的旅程……
80,ロゼッタ/萝赛塔,それこそが、<br>アタシ達が共にしたあの人の旅よ。,这就是，和我们一起渡过的，<br>那个男人的旅程。
81,,<span class='scene-font-katari'>話を区切るように、</span><br><span class='scene-font-katari'>ロゼッタは一度、呼吸を置き、</span><br><span class='scene-font-katari'>今度はノアが話を引き継ぐ。</span>,就像是为了分开话题一般，<br>罗塞塔喘了口气后，<br>诺亚接着说道。
82,ノア/诺亚,旅の途中、<br>僕はラカムとの約束を守るため、<br>艇を降りて<span class='scene-font-place'>ガロンゾ</span>に留まり……,在旅行途中，我为了遵守与拉卡姆的约定，<br>从艇上下来了。
83,ロゼッタ/萝赛塔,アタシも事情があって、<br>途中でユグドラシルの元へ戻ったの。,我也因为一些事情，<br>途中反悔了尤格多拉希尔的身边。
84,ヴァルフリート,長い旅だったからな……<br>旅の終わりを共にした者は、<br>決して多くはなかった。,因为是很长的旅途……<br>陪伴着他知道旅途结束的人，<br>绝不算多。
85,ヴァルフリート,そうして旅を終えた我々は、<br>ある特別な存在を連れ帰ったのだ。,然后结束了旅程的我们，<br>带回了某位特别的存在。
86,ヴァルフリート,それこそが蒼の少女……<br>つまりルリア、君だ。,那就是苍之少女……<br>也就是你，露莉亚。
87,ルリア/露莉亚,…………,…………
88,ヴァルフリート,我々は連れ帰ったルリアを、<br>このファータ・グランデ空域に隠した。,我们带回露莉亚后，<br>把她藏在法塔格兰迪空域。
89,ヴァルフリート,その後、私は妻子の元へ戻り、<br>奴は自分の子供と共に、<br><span class='scene-font-place'>ザンクティンゼル</span>へ帰っていった。,在那之后，我回到了妻子身边，<br>他也和自己的孩子一起回到了ザンクティンゼル（起始之地）。
90,ヴァルフリート,後は私が語るまでもない。<br>君達自身が知っての通りだ。,之后就不用我说了。<br>就如你们想的那样。
91,ヴァルフリート,これで、彼の旅路については、<br>理解してもらえたかな？,这样一来，<br>你能明白他的旅程了吗？
92,ビィ/碧,いや、理解も何も……,不是，理解还是别的……
93,ルリア/露莉亚,私は……<br>私はそんなふうにして、<br>この空に来たんですね。,我……<br>原来我是这样，来到这片空域的啊。
94,,<span class='scene-font-katari'>呆然としながらも、</span><br><span class='scene-font-katari'>ルリアは己を確かめるように、</span><br><span class='scene-font-katari'>姬塔の手を強く握る。</span>,露莉亚呆呆地，<br>就像是在确认自己的存在一般，<br>紧紧地抓着姬塔的手。
95,ヴァルフリート,君達の縁は、<br>君達が思うよりも深い……<br>それは運命とも言うべきだろう。,你们的缘分，远比你们想的要什……<br>这就是命运吧。
96,オイゲン/欧根,あー、しかし、なんだ……<br>なんだって、<br>この話をいましたんだ？,啊，但是，那个……<br>为什么，现在要把这件事告诉我们呢？
97,ヴァルフリート,先に話した通り、<br>姬塔のお父さんは、<br>空の世界の神から使命を受けていた。,刚才我说了，<br>姬塔的父亲受到了<br>空之世界的神的使命。
98,ヴァルフリート,強大な力を持っていたが、<br>それは空の世界の神によるものだ。,因为拥有了强大的力量，<br>就像是这个空之世界的神一般的存在。
99,ヴァルフリート,いまの君のような、<br>空と星が並び立つ<span class='scene-font-spword'>“特異点”</span>ではない。,并不是像你们这样，<br>横跨在空与星之间的“特异点”。
100,,<span class='scene-font-katari'>ヴァルフリートはひとつ咳払いをし、</span><br><span class='scene-font-katari'>姬塔を見つめる。</span>,瓦尔弗里德咳了一声后，<br>看向姬塔。
101,ヴァルフリート,前置きが長くなってしまったな。<br>そろそろ本題に入ろう。,前面的故事太长了，<br>应该切入正题了。
102,ヴァルフリート,率直に言って、<br>あの男は「特異点」を<br>発生させまいとしていた。,坦白地说，<br>那个男人并不想让“特异点”产生。
103,ヴァルフリート,だからこそ、<br>ビィは<span class='scene-font-place'>ザンクティンゼル</span>に残し、<br>ルリアは別の場所に眠らせていたのだ。,正因如此，<br>他才把碧留在ザンクティンゼル（起始之地），<br>而且让露莉亚在另一处沉睡。
104,ヴァルフリート,いま、君が「特異点」となったのは、<br>運命のいたずらとしか言いようがない。,如今你成为了“特异点”这件事，<br>就像是命运开的玩笑一般。
105,ヴァルフリート,「特異点」である君を、<br>あの男がどう受け止めるか……<br>それは私にもわからない。,作为“特异点”的你，那个男人又会如何阻止呢……<br>关于这点我也不知道。
106,ヴァルフリート,その上で、<br>私は君に改めて問おう。,综上所述，<br>我有一个问题要问你。
107,ヴァルフリート,それでも君には、<br><span class='scene-font-spword'>星の島</span>へと至る<br>旅を続ける覚悟はあるかな？,就算这样，<br>你也有继续前往星之岛的觉悟吗？
108,ルリア/露莉亚,っ……,唔……
109,,<span class='scene-font-katari'>「</span><span class='scene-font-spword'>星の島　イスタルシア</span><span class='scene-font-katari'>で待つ」</span>,“我在星之岛伊斯塔尔西亚等你”
110,,<span class='scene-font-katari'>旅の始まりとなった、その言葉が、</span><br><span class='scene-font-katari'>姬塔の脳裏によぎる。</span>,旅途开始时见到的话语，<br>浮现在了姬塔的脑海里。
111,,<span class='scene-font-katari'>しかし、ヴァルフリートが語ったことは</span><br><span class='scene-font-katari'>姬塔の根幹を揺るがすのに</span><br><span class='scene-font-katari'>十分な内容だった。</span>,但是瓦尔弗里德所说的话，<br>足以震撼这块基石。<br>
111-sel1_txt,,<span class='scene-font-katari'>…………</span>,…………
112,ヴァルフリート,君はお父さんによく似ている。<br>それを彼も喜ぶだろう。,你和你的父亲很像。<br>他一定也很高兴吧。
113,ヴァルフリート,しかし、君が「特異点」であるならば、<br>彼と対立する可能性もある。,但是，你既然是“特异点”，<br>那么就存在和他对立的可能性。
114,ヴァルフリート,いまのままでは、<br><span class='scene-font-spword'>星の島</span>で待つのは、<br>温かな再会だけとは限らないのだ。,如今在星之岛等待的再会，<br>可能已经不是充满温情的再会了。
115,ヴァルフリート,それでも君は、<br>「特異点」として彼に会いに行くのか。,就算这样，<br>作为“特异点”的你，<br>也要去见他吗？
116,ヴァルフリート,その意思を、<br>いまここで私に聞かせてほしい。,我想知道，<br>现在的你的想法。
117,ビィ/碧,…………,…………
118,ルリア/露莉亚,…………,…………
119,,<span class='scene-font-katari'>ヴァルフリートの問いは、</span><br><span class='scene-font-katari'>標を失ってもなお、</span><br><span class='scene-font-katari'>旅を続けるかを問うものだった。</span>,瓦尔弗里德的问题，<br>就好像在问即使失去目标，<br>你也要继续旅行么一样。
120,,<span class='scene-font-katari'>残酷な問いに対し、</span><br><span class='scene-font-katari'>姬塔は、</span><br><span class='scene-font-katari'>己が旅を続ける理由を見つめ直す。</span>,面对残酷的问题，<br>姬塔重新审视起了一直以来继续旅行的理由。
120-sel1_txt,,<span class='scene-font-katari'>僕は──</span>,我——
123,,<span class='scene-font-katari'>こうして姬塔は、</span><br><span class='scene-font-katari'>己の旅路に対する最大の決意を、</span><br><span class='scene-font-katari'>言葉として表すのだった。</span>,就这样，<br>姬塔用语言表达出了，<br>对旅途的最大决心。
info,,,scene_cp118_q4_s10
译者,,,rei