id,name,text,trans
0-chapter_name,,応えろ、相棒,回应我吧，搭档
0-synopsis,,胎動する世界の新世界創造を止めるべく、空に浮かぶ球体へ突入した姬塔達。極彩色の世界の中には胎動する世界がおり、姬塔達を新世界創造に至る最後の試練として認める。胎動する世界は一行を倒すことで新世界を真に完成させる、と告げ姿を消し、一行は最深部を目指して足を進めるのだった。,为了阻止胎动中的世界创造新世界，姬塔一行踏入了漂浮在空中的球体内部。在那片极彩交织的世界中，胎动中的世界现身，并承认姬塔一行是通往新世界创造的最终试炼。它宣称，击败他们将是新世界得以真正完成的关键。随即，胎动中的世界消失了，姬塔一行开始向最深处迈进。
2,,胎動する世界との決着をつけるべく、\n姬塔達は空に浮かぶ\n球体の内側へと足を踏み入れた。,为与胎动中的世界一决胜负，\n姬塔等人\n踏入了球体的内侧。
3,ビィ/碧,うわ……\nなんだここ……,呜哇……\n这是什么地方……
4,ルリア/露莉亚,色んな色が混じり合って、\n目が回ります……,各种颜色混合在一起，\n眼睛都要花了……
5,,極彩色が乱雑に混じり合う景色に、\n脳内が掻き混ぜられるような不快感を\n覚え、顔を顰める姬塔。,在五彩斑斓、杂乱交错的景色中，\n姬塔感受到了仿佛在脑内搅拌一般的不适，\n不由得皱起了眉头。
6,ロベリア/罗贝利亚,脳みそをかき回された時……\nいや、胃袋を溶かされた時……\nそれらに近い感覚だね、これは。,就像是脑浆被搅拌……\n不，像胃袋被溶化……\n时的感觉一样呢。
7,ビィ/碧,うぅ……なんかすげぇ\n気持ち悪くなってきたぜ……\nお前の例えのせいでよ……,呃……本来我已经够恶心了，\n你这么一说更不舒服了……
8,ルリア/露莉亚,ロベリアさんは、\n大丈夫なんですか……？,罗贝利亚先生，\n你没事吗……？
9,ロベリア/罗贝利亚,ウィ。慣れたもんさ。とはいえ、\nキミ達よりもマシかもな。タワーが\nワールドの力を取り込んだからかな？,Oui（没事）.已经习惯了。\n不过，我可能比你们感觉好一些。\n也许是因为塔吸收了世界的力量吧？
10,ルリア/露莉亚,あれ……？\nロベリアさん、雰囲気が変わりました？\n服も違いますし……,咦……？\n罗贝利亚先生，感觉气质变了？\n服装也不一样了……
11,ロベリア/罗贝利亚,お洒落だろ？\nタワーっぽくて、\n気に入ってるんだ。,时髦吧？\n有点像塔的风格，\n我挺喜欢的。
12,ロベリア/罗贝利亚,タワー曰く、この服が\nオレの心の形……だそうだよ。,塔说，这身装扮\n是我内心的形态……这样的。
13,ロベリア/罗贝利亚,まぁ詳しいことはわからないけど、\nこの格好でいると不思議と\n心が幸福に満たされるんだ……,虽然我不太清楚细节，\n但穿着这身衣服，我的内心\n就不可思议地充满了幸福感……
14,ロベリア/罗贝利亚,この世界から追い出された時は\n元に戻っていたことを考えると……\nここにいる時だけ影響を受けるようだ。,回想一下，之前从这个世界中被驱逐出去时，\n我恢复了原来的样子……\n看来只有在这里才会受到影响。
15,ビィ/碧,胎動する世界の力を取り込んだとか\n言ってたけど、その影響ってことか？\n大丈夫なのかよ？　なにか不調とか……,你说吸收了胎动的世界的力量，\n是因为这个原因吗？\n真的没事吗？　有什么不适吗……
16,ロベリア/罗贝利亚,くはっ……おいおい。\n言っただろう、慣れたもんさって。\n絶好調なぐらいさ。,库哈……喂喂。\n我不是说了吗，已经习惯了。\n状态好得很呢。
17,ロベリア/罗贝利亚,例え不調が起きたとしても、\n幾万の幸福の音を経験したオレにとって\n全ての苦痛や不調は些細なものさ。,即便有什么不适，\n对经历过无数幸福之声的我来说，\n一切痛苦和不适都微不足道。
18,ロベリア/罗贝利亚,だから安心して背中を預けてくれ。\nオレとタワーが……\n必ずワールドを壊してやるからさ。,所以放心地把背后交给我们吧。\n我和塔……\n一定会摧毁世界。
19,ロベリア/罗贝利亚,さぁ、お喋りはここまでだ。\n行こうか。ワールドを\n幸福の音に変えに、な。,好了，闲聊到此为止。\n出发吧，\n将世界化为幸福之声、吧。
20,,気を引き締め直し、改めて\n姬塔達が極彩色の世界の\n中心部へと足を進めたその時だった。,姬塔一行人重新振作，\n继续向这五彩斑斓的世界中心部分进发，\n就在这时。
24,胎動する世界/胎动中的世界,──またお前達か。,──又是你们啊。
25,ビィ/碧,お前は……！\nやい！　この前はしてやられたけど、\n今度はそう簡単にいかねぇぞ！,你是……！\n喂！上次放过了你，\n这次可没那么容易了！
26,胎動する世界/胎动中的世界,もはやこれ以上何を望む？\nオレはお前達に用は無い。\nお前達に構っている時間など……,你们还想要什么？\n你们于我而言已经无用了。\n没时间跟你们纠缠……
27,胎動する世界/胎动中的世界,いや、そうか……そういうことか。\nお前達こそが、新世界創造に至る\n最後の試練というわけだな？,不，等等……是这么回事啊。\n你们是、通向新世界创造的最终试炼，\n是吧？
28,ロベリア/罗贝利亚,好きに解釈しなよ。\nオレとタワーはただ壊し損ねた\n幸福の音を集めにきただけさ。,随便你怎么解释。\n我和塔只是来收集\n那些之前未能毁灭的幸福之声而已。
29,ロベリア/罗贝利亚,ワールド……\n今度こそ聴かせてくれよ。\nキミが壊れる幸福の音を……,世界……\n这次可要让我们听到啊。\n听到你毁灭时的幸福之声……
30,胎動する世界/胎动中的世界,試練を経てこそ、\nその誕生に価値が与えられる。\nそして試練とは……越えるためにある。,只有经过试炼，\n诞生才有意义。\n而试炼……正是为了超越。
31,胎動する世界/胎动中的世界,いいだろう、歓迎しよう。\nお前達という最後の犠牲を以て、\nオレの新世界は真の完成を見る。,很好、我欢迎你们。\n以你们作为最后的牺牲，\n我的新世界将迎来真正的完成。
34,,それだけ言い残し、\n胎動する世界は極彩色の中に\n溶けるようにして姿を消した。,说完这些话后，胎动中的世界\n便仿佛融入那五彩缤纷的世界之中那样，\n消失了。
34-sel1_txt,,行こう,走吧
36,,頷き合った姬塔達は、\n胎動する世界が待つ最深部を目指し\n足を進めるのだった。,姬塔一行互相点头，\n向着胎动的世界所等待的\n最深处前进。
info,,,scene_ult_chr490_ep1_q4_s10
译者,,,Ekko_Echo