id,name,text,trans
0,アルベール/阿尔贝尔,その……君がいま、,那个……你现在<br>抱きかかえているもの全部、,怀里抱着的这些东西<br>ホワイトデーの贈り物なのか？,全都是白色情人节的礼物吗？
1,アルベール/阿尔贝尔,さすが姬塔、恐れ入る。,不愧是姬塔、佩服佩服。
2,アルベール/阿尔贝尔,バレンタインの時の君のように、,本打算像情人节时的你一样<br>俺も贈り物を朝一番に,让我的礼物也在早上第一个<br>届けようと思ったのだが……,送到你手中……
3,アルベール/阿尔贝尔,夜明けまで準備していた為に,一直准备到天亮<br>うっかり寝過ごしてしまってな……,不小心就睡过头了……
4,アルベール/阿尔贝尔,なぁ姬塔。,喂姬塔<br>日頃の感謝や……,巧克力里倾注了我对你平日的感谢……<br>君への色々な気持ちを込めてみたんだ。,和很多心意
5,アルベール/阿尔贝尔,大荷物のところ申し訳ないが、,抱歉在你手里抱着这么多东西的时候说这个<br>俺からの贈り物をそこに,可以让我的礼物<br>加えてもらえないだろうか？,也加入其中吗？
info,,,scene_s5_white_3039_v1_0_2003_5_3040045000_0
译者,铂睿