id,name,text,trans
0-chapter_name,,瞬雷の騎士,瞬雷的骑士
0-synopsis,,魔物の不意打ちを受け、崖下に落ちた姬塔は、雷光の如く現れたアルベールによって救出される。アルベールは一行にお礼を告げられるも、ルリアの力を見て表情を険しくし、刃を向ける。ルリアの話を聞き、誤解を解いたアルベールは、星晶獣に魂を売った友を探していると告げる。それならば一緒に探そうとルリアが提案すると、アルベールは戸惑いつつも承諾し、一行の仲間に加わるのだった。,意外受到魔物攻击而险些掉下悬崖的姬塔，被雷光般出现的阿尔贝尔所救。阿尔贝尔与他见到露莉亚的力量后，表情严肃了起来，对姬塔他们拔剑相向。听了露莉亚的话解开了误会的阿尔贝尔，告诉姬塔他们他正在寻找将灵魂出卖给星晶兽的友人。露莉亚提议帮他一起寻找，虽然阿尔贝尔有些疑惑，但还是加入了他们。
0,,<span class='scene-font-katari'>断崖絶壁の山道が続く天険の地。</span><br><span class='scene-font-katari'>ある時、その難所を越えようとする</span><br><span class='scene-font-katari'>旅人を襲う、魔物の噂を聞いた一行。</span>,断崖绝壁上的山路延伸到天险之地。姬塔一行人听说这里有着袭击旅人的魔物的传闻。
1,,<span class='scene-font-katari'>麓の村の村人から、</span><br><span class='scene-font-katari'>その魔物の討伐依頼を受けた一行は、</span><br><span class='scene-font-katari'>険しい山道を登る。</span>,他们接受了山脚的村民讨伐魔物的委托，登上险峻的山路。
2,ビィ/碧,しかし、スゲェ急な山道だな……<br>こんなキツイ道で魔物も出るなら<br>わざわざ通らなきゃいいのになぁ……,可这山路还真是陡啊，这么难走的路上要是还有魔物，就不用专门走这条路了吧……
3,ルリア/露莉亚,でも……この山を越えたら……<br>隣の国へ……近道になるんですよね……<br>ねぇ……姬塔？,但是，翻过这座山，就是去邻国的捷径了吧……是吧、姬塔？
4,,<span class='scene-font-katari'>ルリアの言葉に頷く姬塔。</span><br><span class='scene-font-katari'>姬塔は、息の上がった</span><br><span class='scene-font-katari'>ルリアを心配している。</span>,姬塔听了露莉亚的话点点头。他有点担心上气不接下气的露莉亚。
5,,<span class='scene-font-katari'>姬塔がルリアに</span><br><span class='scene-font-katari'>手を差し伸べようとした瞬間。</span>,姬塔向露莉亚伸出手的那个瞬间——
6,,<span class='scene-font-katari'>突然、一行の前を</span><br><span class='scene-font-katari'>魔物の影が過る。</span>,突然，魔物的影子从他们面前掠过。
7,ルリア/露莉亚,きゃあっ！？,呀啊！？
8,,<span class='scene-font-katari'>魔物の急襲から</span><br><span class='scene-font-katari'>咄嗟にルリアを庇った弾みで</span><br><span class='scene-font-katari'>崖下に落ちる姬塔。</span>,从魔物的突袭下为保护露莉亚而掉下悬崖的姬塔，
9,,<span class='scene-font-katari'>だが、間一髪のところで、</span><br><span class='scene-font-katari'>崖の縁を掴む。</span>,在千钧一发之际抓住了悬崖边缘。
10,ビィ/碧,だ！　大丈夫かぁ！？　,没、没事吧！？　
11,,<span class='scene-font-katari'>空中で身を翻した魔物が、</span><br><span class='scene-font-katari'>姬塔に再び襲いかかる。 </span>,在空中调转过来的魔物，再次向姬塔袭来。
12,ルリア/露莉亚,危ない！,危险！
13,,<span class='scene-font-katari'>ルリアの悲鳴、</span><br><span class='scene-font-katari'>目の前に疾る稲妻。</span>,随着露莉亚的悲鸣声，眼前闪过一道疾驰的闪电。
14,,<span class='scene-font-katari'>迸る雷撃に、思わず顔を背けるルリア。</span><br><span class='scene-font-katari'>ルリアが恐る恐る視線を戻すと、眼前の</span><br><span class='scene-font-katari'>魔物は跡形も無く消し飛んでいた。</span>,在强烈的雷光下，露莉亚不由得转过脸，当她战战兢兢地将视线转回去后，发现魔物已经消失得无影无踪。
15,？？？,……怪我は無いか？,……没有受伤吧？
16,,<span class='scene-font-katari'>そう言って、姬塔の</span><br><span class='scene-font-katari'>手を取り引っ張り上げる男。</span>,他这么说着，拉住姬塔的手把她救了起来。
17,ルリア/露莉亚,あ、あの……助けて頂いて、<br>ありがとうございます！,那、那个，非常感谢你救了我们！
18,ビィ/碧,な、なんだぁ！？<br>この兄ちゃん、稲妻みてぇに<br>急に現れたぞ……,怎、怎么回事！？这位小哥就像闪电一样突然出现……
19,アルベール/阿尔贝尔,フッ……<br>俺の名はアルベール。,呼……我的名字是阿尔贝尔。
20,アルベール/阿尔贝尔,それより……<br>子供がこんな所で何をしている？,话说回来……小孩子在这种地方做什么？
21,ビィ/碧,オイラ達は、この山の通行人を襲う<br>魔物の親玉を倒しに来たんだ！,我们是为打倒这座山上袭击行人的魔物首领而来的！
22,アルベール/阿尔贝尔,なに……<br>……お前達だけで、か？,什么……只有你们几个、吗？
23,ルリア/露莉亚,はい！<br>こう見えて、私達騎空士なんです！,是的！别看我们这样，我们可是骑空士哦！
24,ビィ/碧,そうそう！<br>魔物退治はお手のもんよ！,没错没错！我们很擅长魔物退冶的！
25,アルベール/阿尔贝尔,……だが……今し方、<br>危険な目に遭っていたではないか？,但是啊，刚刚你们不是遇到了危险吗？
26,ビィ/碧,……なっ！？<br>い、今のはたまたま、<br>不意打ちをくらっただけで……,啊！？刚刚只是偶然被偷袭罢了……
27,アルベール/阿尔贝尔,相手は魔物だぞ？<br>命を取るか取られるか……<br>不意打ちもあって当然。,对手可是魔物啊？无论杀死魔物或者被魔物杀死，双方都是性命攸关，会有偷袭这种事也是理所当然的。
28,アルベール/阿尔贝尔,悪いことは言わない……<br>力の無いお前達は、<br>このまま帰った方がいい。,很抱歉这么说，但是你们力量不足，最好就这样折返吧。
29,ルリア/露莉亚,で、でも……<br>麓の村の人達が困ってるんです！<br>このまま放っておけません！,但、但是，山脚下的村民可是很困扰的，我们不能就这样放着不管！
30,アルベール/阿尔贝尔,…………,…………
31,,<span class='scene-font-katari'>姬塔は、</span><br><span class='scene-font-katari'>アルベールの瞳を力強く見返す。</span>,姬塔认真地注视着阿尔贝尔的眼睛。
32,アルベール/阿尔贝尔,やれやれ……<br>そんな目で見つめられては、<br>返す言葉も無いな……,哎呀哎呀……你这么看着我，我都没法回话啊。
33,アルベール/阿尔贝尔,……仕方ない。先を急ぐが、<br>このまま放っても置けない……<br>俺も魔物退治に協力しよう。,……真没办法。虽然有些急事，但也不能这么放任你们……我也来协助打倒魔物吧。
34,ビィ/碧,えっ……い、いいのか！？<br>雷の兄ちゃんが来てくれたら<br>大助かりだぜ！,诶，可以吗！？要是使役雷的小哥也能一起来可是帮大忙了！
35,アルベール/阿尔贝尔,……雷の兄ちゃんではない。<br>アルベールだ。,……不是什么使役雷的小哥，是阿尔贝尔。
36,ルリア/露莉亚,はい！<br>よろしくお願いします！<br>アルベールさん！,好的！请多指教，阿尔贝尔！
39,,<span class='scene-font-katari'>アルベールの協力を得て</span><br><span class='scene-font-katari'>山道を進む一行。</span>,取得了阿尔贝尔的协助后，一行人在山道上继续前进。
40,,<span class='scene-font-katari'>道中に現れる魔物の群れを</span><br><span class='scene-font-katari'>物ともしないアルベールに</span><br><span class='scene-font-katari'>感嘆の声を上げるビィ。</span>,路上出现的魔物完全不是阿尔贝尔的对手，碧不由得啧啧称奇。
41,ビィ/碧,アルベールって……<br>すっげぇ強えぇんだな！,阿尔贝尔你，也太强了吧！
42,アルベール/阿尔贝尔,それほどでもない。,也没有吧。
43,ビィ/碧,いやいやいや……<br>オイラ本当に感動してるんだぜ！,不不不，我真的感到相当震撼啊！
44,アルベール/阿尔贝尔,フッ……ありがとう。<br>素直に受け取っておこうか。,呼……谢谢。我就坦率地接受了。
45,ビィ/碧,その謙虚な態度も憎いねぇー！<br>なぁ！　ルリアもそう思うよなぁ？,这种率直的态度也很好呢！呐！露莉亚也这么认为吧！
46,ルリア/露莉亚,えっ、あっ……<br>あ……はい……キャッ！？,诶、啊……啊，是的……呀啊！
47,,<span class='scene-font-katari'>ビィの発言に</span><br><span class='scene-font-katari'>動揺を隠せないルリアは、</span><br><span class='scene-font-katari'>思わず石に躓いてしまう。</span>,对碧的发言有些动摇的露莉亚，被石头绊倒了。
48,アルベール/阿尔贝尔,危ない……,小心……！
49,,<span class='scene-font-katari'>姬塔が手を差し伸べるよりも</span><br><span class='scene-font-katari'>早く、ルリアを優しく</span><br><span class='scene-font-katari'>抱き留めるアルベール。</span>,阿尔贝尔比姬塔伸出援手的速度还快，温柔地抱住了露莉亚。
50,ルリア/露莉亚,あ……<br>ありがとうございます……,啊……非常感谢！
51,,<span class='scene-font-katari'>その様子を見ている姬塔は、</span><br><span class='scene-font-katari'>心臓が早鐘を打つのを感じていた。</span>,看到这幅光景的姬塔感到心跳加速了。
52,ビィ/碧,どうしたルリア？<br>山登りが足に堪えたか？,怎么了露莉亚？
53,ルリア/露莉亚,い、いえ！　私は大丈夫です！<br>さぁ、姬塔！<br>行きましょう！,不、不！我没关系的！姬塔，我们继续走吧！
54,アルベール/阿尔贝尔,待て……ルリア。,等下……露莉亚。
55,ルリア/露莉亚,えっ！？<br>な、なんですか！？,诶！怎、怎么了吗？
56,天険の主,<span class='scene-font-5'>グルルルル！</span>,咕噜噜噜——！
57,ルリア/露莉亚,キャアッ！？,呀啊！？
58,アルベール/阿尔贝尔,ルリア……下がってろ。<br>コイツは先程までの雑魚とは違う。,露莉亚，退后。这一只和之前的杂鱼不一样。
59,ルリア/露莉亚,……は、はい！,好、好的！
60,アルベール/阿尔贝尔,姬塔……<br>どうやらこの魔物が、<br>この山の主で間違いないようだぞ……,姬塔，看来这就是这座山的山之主了。
61,ルリア/露莉亚,姬塔！<br>アルベールさん！<br>私も援護します！,姬塔！阿尔贝尔！我来掩护你们！
62,,<span class='scene-font-katari'>そう言って、</span><br><span class='scene-font-katari'>星晶獣の力を解放するルリア。</span>,说着，露莉亚释放出星晶兽的力量。
63,アルベール/阿尔贝尔,……なっ！？<br>それは……星晶獣……,……什！那是、星晶兽……
64,ビィ/碧,おい！　アルベール！<br>何よそ見してるんだ！<br>魔物が来るぞ！,喂！阿尔贝尔！你在看什么，魔物攻过来了哦！
65,アルベール/阿尔贝尔,……ああ。,……啊啊。
68,,<span class='scene-font-katari'>アルベールの協力もあり、</span><br><span class='scene-font-katari'>天険の主を倒した一行。</span>,一行人在阿尔贝尔的协助下打倒了天险之主。
69,,<span class='scene-font-katari'>だが、何故か浮かない顔をしている</span><br><span class='scene-font-katari'>様子のアルベールは、ルリアに対して</span><br><span class='scene-font-katari'>突然、剣を向けるのだった。</span>,但是，不知为何阿尔贝尔面露难色，拔剑指向了露莉亚。
70,ビィ/碧,おいおい……アルベール。<br>急にどうしたんだよ？,喂喂，阿尔贝尔，你突然怎么了？
71,アルベール/阿尔贝尔,……ルリア。<br>君のその力は……何だ？,露莉亚。你那份力量，是什么？
72,,<span class='scene-font-katari'>突然、辺りが急に薄暗くなり、</span><br><span class='scene-font-katari'>上空には暗雲が立ち込める。</span>,突然，四周快速昏暗下来，头顶的天空乌云密布。
73,,<span class='scene-font-katari'>いつしか暗雲からは</span><br><span class='scene-font-katari'>稲妻が光り、雷鳴が轟き始める。</span>,在乌云中翻滚着道道闪电，雷声也开始轰鸣。
74,アルベール/阿尔贝尔,お前は……<br>どこでその星晶の力を……<br>手に入れた？,你……从哪里获得这份星晶之力的？
75,ルリア/露莉亚,えっ！？<br>わ、私は……あの……,诶！我、我……那个……
76,アルベール/阿尔贝尔,お前も……<br>星晶に魂を売った……<br>化け物なのか？,你也是……把灵魂卖给星晶兽的怪物吗？
77,ビィ/碧,んだとぉ！？<br>黙って聞いてりゃ一方的に<br>イチャモンつけやがって……,什么啊！一直一言不发的单方面地找茬……
78,,<span class='scene-font-katari'>アルベールの異変を感じ取った</span><br><span class='scene-font-katari'>姬塔は、じりじりと</span><br><span class='scene-font-katari'>間合いを詰めていく。</span>,感受到阿尔贝尔态度的改变，姬塔逐渐逼近了他。
79,ルリア/露莉亚,姬塔！　<br>ビィさん！<br>ま、待ってください！,姬塔！碧！等等！
80,アルベール/阿尔贝尔,無駄だ。<br>……お前らでは俺には勝てん。<br>いいから黙って問いかけに答えろ……,没有用的，你们无法战胜我，回答我的问题。
81,,<span class='scene-font-katari'>ルリアに切っ先を向けたまま、</span><br><span class='scene-font-katari'>冷徹な態度を崩さないアルベール。</span>,阿尔贝尔以剑尖指着露莉亚，态度冷静而丝毫不乱。
82,,<span class='scene-font-katari'>ルリアはアルベールを見据えたまま、</span><br><span class='scene-font-katari'>毅然とした態度で答える。</span>,露莉亚直视阿尔贝尔，毅然地回答。
83,ルリア/露莉亚,ごめんなさい。<br>私のこの力が何なのか……<br>私がなぜ星晶獣の力を使えるのか……,对不起……我的这份力量是什么、我为什么能使用星晶兽的力量、
84,ルリア/露莉亚,私にも、良くわからないんです。<br>でも、一つだけはっきりわかっている<br>こともあって……それは……,我自己也没法说清楚，但是有一件事我可以肯定，那就是
85,ルリア/露莉亚,私は……私のこの力を……<br>誰かの為に使いたいっていうことです！<br>上手く説明できないんですけど……,我会为了他人而使用这种力量，虽然不能好好地说明，
86,ルリア/露莉亚,困っている人の為に力を使って……<br>それで……この世界が、少しでも<br>良くなればって、そう思ってるんです！,但是我会用我的力量去帮助那些需要帮助的人。这样，哪怕是一点，这个世界也能变得更好些。我是这么认为的！
87,,<span class='scene-font-katari'>ルリアの思いの丈を黙って聞いていた</span><br><span class='scene-font-katari'>アルベールは、その言葉から何かを</span><br><span class='scene-font-katari'>感じ取った様子で、静かに剣を収める。</span>,
88,,<span class='scene-font-katari'>すると、頭上に立ち込めていた</span><br><span class='scene-font-katari'>暗雲もどこかへ消え去るのだった。</span>,阿尔贝尔安静地听完露莉亚的想法，他从这些话语中感受到露莉亚的决心，静静地把剑收了起来。同时，头顶密布的阴云也消散了。
89,アルベール/阿尔贝尔,怖がらせてすまなかった。<br>……ルリアの言葉に、<br>偽りは無いようだな。,很抱歉吓到你了，露莉亚的话确实没有虚假的成分。
90,ビィ/碧,バカヤロー！　ったりめぇだ！<br>ルリアをなんだと思ってんだ！,混蛋！当然了！你怎么想露莉亚的啊！
91,アルベール/阿尔贝尔,申し訳ない……<br>今までの非礼を許してくれ。,非常抱歉……原谅我刚刚的失礼。
92,,<span class='scene-font-katari'>そう言って深々と頭を下げ</span><br><span class='scene-font-katari'>非礼を詫びるアルベールは、</span><br><span class='scene-font-katari'>自らの旅の目的を語り始める。</span>,这么说着的阿尔贝尔深深地低下头，诉说了自己旅行的目的。
93,アルベール/阿尔贝尔,実は……俺は元々<br>祖国の騎士団で<br>団長をやっていたんだ……,其实……我本来是我祖国的骑士团团长……
94,アルベール/阿尔贝尔,だがある時、その騎士団の仲間が<br>“星の零涙”の力にのまれて、<br>異形の者と化した……,但是那时，骑士团的同伴被“星之零泪”的力量所吞噬，化为了异形的怪物……
95,ルリア/露莉亚,“星の零涙”……,“星之零泪”……
96,アルベール/阿尔贝尔,ああ……“星の零涙”と呼ばれる<br>星晶片の中に、人に寄生する星晶獣が<br>封じ込められていたらしい……,啊啊 <br>被称为“星之零泪”的星晶片中，封印着会寄生在人类身上的星晶兽。
97,アルベール/阿尔贝尔,俺は……<br>その星晶獣の力に取り憑かれた<br>仲間の足取りを追っているんだ……,我就是在追寻着那个被星晶兽之力附身的同伴的脚步。
98,ビィ/碧,そうだったのか……<br>だからルリアの星晶獣の力に<br>あんなに反応したんだな……,原来是这样……所以才会对露莉亚的星晶兽之力有那种反应啊……
99,ルリア/露莉亚,それで……<br>アルベールさんの仲間は、<br>見つかりそうなんですか？,那么，阿尔贝尔现在找到那个同伴了吗？
100,アルベール/阿尔贝尔,いや……それらしい<br>魔物の噂を追ってはいるんだが、<br>一向に足取りが掴めそうにない……,不，虽然在追寻着各种魔物的传闻，但是一点线索都没有抓到。
101,ルリア/露莉亚,……だったら！<br>私がその仲間探しを<br>手伝ってあげますよ！,那么，让我们帮忙寻找你的同伴吧！
102,アルベール/阿尔贝尔,なっ！？,什！？
103,ルリア/露莉亚,実は……私には星晶獣の力を<br>感じ取る能力があるんです……,其实，我拥有能感知星晶兽的能力。
104,ルリア/露莉亚,だから……アルベールさんが<br>一人で探すよりも、きっと……<br>効率がいいと思いますよ？,所以，我觉得比起阿尔贝尔一个人找，我们一起肯定会更有效率的！
105,アルベール/阿尔贝尔,……ほ、本当か！？<br>お前達に剣を向けた俺を……<br>仲間に迎え入れると言うのか？,真、真的吗！？要将对你们以剑相向的我迎为伙伴吗？
106,ビィ/碧,ルリアはああ言ってるけど……<br>どうする？　姬塔？,露莉亚这么说，你觉得呢，姬塔？
106-sel1_txt,,<span class='scene-font-katari'>ルリアがそう言うなら</span>,如果露莉亚这么说的话
106-sel2_txt,,<span class='scene-font-katari'>嫌だけど……</span>,虽然不愿意……
107,アルベール/阿尔贝尔,ありがとう……姬塔。<br>お前は器が大きいんだな……,谢谢，姬塔。你还真是心胸宽广啊
108,アルベール/阿尔贝尔,そっ……そうだな。<br>やはり……俺は一人で旅を<br>続けるとしよう……,这、这样。果然……我还是一个人继续旅行吧。
109,ルリア/露莉亚,ど、どうしたんです？<br>そんなイジワル言って……<br>姬塔らしくないですよ？,怎、怎么了，说出这种伤人的话，这可不像你啊。
110,ビィ/碧,うーん……<br>さっきの一件もあったし……,嗯……
111,ビィ/碧,姬塔はルリアのことを、<br>心配してるんじゃねぇか？,姬塔你是担心露莉亚吧？
112,ルリア/露莉亚,えっ……<br>そ、そうなんですか！<br>姬塔……,诶！？<br>是这个原因吗，姬塔？
113,,<span class='scene-font-katari'>ルリアの言葉を受けて</span><br><span class='scene-font-katari'>深く頷く姬塔。</span>,<span class='scene-font-katari'>ルリアの言葉を受けて</span><br><span class='scene-font-katari'>深く頷く姬塔。</span>
114,ルリア/露莉亚,で、でもっ！　アルベールさんは<br>今ので分かってくれたみたいですし……,但是！　
115,アルベール/阿尔贝尔,ルリア……,露莉亚……
116,ルリア/露莉亚,もう大丈夫ですよ！<br>ねっ……姬塔？,已经没事了哦！呐……姬塔？
117,,<span class='scene-font-katari'>そう言って姬塔のことを</span><br><span class='scene-font-katari'>必死に説得するルリアであった。</span>,
118,,<span class='scene-font-katari'>こうして……</span><br><span class='scene-font-katari'>晴れて姬塔一行の</span><br><span class='scene-font-katari'>仲間に加わったアルベール。</span>,
119,ビィ/碧,まぁ……よくよく考えたら<br>アルベールはオイラ達の魔物退治を<br>手伝ってくれたんだしな……,嘛，
120,ルリア/露莉亚,そうです！<br>アルベールさんは、<br>とってもいい人だと思います！,是的！我认为阿尔贝尔是个非常好的人！
121,アルベール/阿尔贝尔,ふっ……<br>俺が……いい人、か……,呼……我是……好人……吗？
122,ビィ/碧,……ん？　<br>どうしたんだ？,……嗯？　<br>怎么了吗？
123,アルベール/阿尔贝尔,いや……なんでもない……<br>ただの独り言だ。,不……没什么……只是自言自语罢了。
124,アルベール/阿尔贝尔,俺が仲間になったからには、<br>命を賭してお前達を守ろう。,俺が仲間になったからには、<br>命を賭してお前達を守ろう。
125,アルベール/阿尔贝尔,これからもよろしく頼むぞ……<br>姬塔。,今后就拜托了，姬塔。
126,,<span class='scene-font-katari'>こうして、一行の仲間に</span><br><span class='scene-font-katari'>加わったアルベール。</span>,就这样，阿尔贝尔加入姬塔一行，成为了同伴。
127,,<span class='scene-font-katari'>果たして、</span><br><span class='scene-font-katari'>彼の探し求める仲間は</span><br><span class='scene-font-katari'>見つかるのだろうか。</span>,到底能找到他所寻求的同伴吗？
info,,,scene_fate_chr141_ep1