id,name,text,trans
0-chapter_name,,第6話 この手紙が届くころには,第六章 此信送达之时
0-synopsis,,織部との喧嘩の後、一週間の自宅待機になった蒼人。あの子の誤解は解けただろうかとやきもきしながら、あの子への想いを見つめ直す。その３日後届いたあの子からの手紙には、誤解が解けた旨と、あの子が九州の離島に引っ越す事が書かれていた。手紙が届いたその日の終電で東京を発つ旨を知った蒼人は、衝動的に家を飛び出すのだった。,
11,ビー,…………,…………
12,蒼人,織部と教室で殴り合った後。\n僕は傷の療養も兼ねて、\n一週間の自宅待機になった。,我和织部在教室里打了一架之后，\n我为了治疗伤口，在家里休养了一个星期。
13,蒼人,織部は出席停止処分になり、\n不破は再び登校しなくなったらしい。,织部受到了停课处分，\n不破好像也不再来学校了。
14,蒼人,とはいえ、元々学校に来る日の方が\n少なかった彼らだ。その程度の\n処分など、痛くも痒くもないだろう。,话虽如此，他们来学校的日子本来就不多。\n这种程度的处分对他们而言，大概无关痛痒吧。
15,蒼人,……はぁ。,哈……
17,蒼人,……手紙、\nちゃんと読んでくれたかな。\n誤解が解けてるといいんだけど。,她好好读过信了吗……？\n希望我们之间的误会能够消失。
18,蒼人,結局未来が手紙を送ったのかも\n聞けてないし……\nもどかしいなぁ。,结果我连未来有没有给她寄信都不知道……真郁闷。
19,蒼人,「未来と恋人になった」という\n誤解を解くために急いで書いた\n手紙だけど、その内容は覚えていない。,我为了消除“与未来成为恋人”的误会，匆忙之下写了一封信寄给她，内容都有些记不清了。
20,蒼人,とにかく早く書かなきゃと\n気持ちばかりが焦って、ろくに\n見直さないまま送ってしまった。,我一心只想着赶紧写好，所以内容还没修改好就寄出去了。
21,蒼人,……こういう時、電話が出来たら\nすぐに確認できたのに。,这种时候……，明明打个电话就能确认了。
22,蒼人,でも、番号知ってたらそもそも\n手紙でやり取りなんかしないか……,但是，要是我知道电话号码，\n也用不着和她写信沟通了……
23,蒼人,仮にあの子の電話番号を\n知っていたとして。\n果たして僕はあの子と話せただろうか。,可是就算我知道那个女孩的电话号码，\n真的能以平常心和她交流吗？
24,蒼人,……自信ないな。\n手紙みたいに言葉は選べないし、\n隠し事もきっとすぐバレちゃう。,提不起信心啊……\n没法像写信一样选择措辞，\n心中秘密很快就会被发现。
25,蒼人,あの子は、普段は\nのんびりしてるのに\n他人の心には敏感だったから。,那个女孩平时平易近人，但对别人的内心想法很敏感。
26,ビー,…………,…………
27,蒼人,ビーもやっぱりそう思う？\n……そうだよね。\n僕は結局、臆病なんだ。,碧你也这么认为吗？\n……是啊，毕竟我是个懦夫。
28,蒼人,あの子に本当の気持ちが\n伝わるのが怖くて。\nまた離れて行くのが怖くて。,我害怕让她知道我的真实感受，\n害怕她再次离开我。
29,蒼人,だから、何も言わずズルズルと\n引きずり続けてる。,所以才什么都不说，一直拖到现在。
30,ビー,…………,…………
31,蒼人,はは、未来が聞いたら\n呆れられそう。\nまだそんなことで悩んでるのって。,哈哈，未来要是听到我这些话，肯定会大吃一惊，还会说没想到我在为这种事烦恼之类的……
32,蒼人,……ねぇ、ビー\n僕ね、あの子のことが\nすごく大事で、無くしたくないんだ。,……呐，碧。\n那个女孩对我而言非常重要，我不想再弄丢了。
33,蒼人,ビーも、未来も、櫂も、叔母さんも。\n皆大切で、大好きな人達だけど、\nあの子は特別で。,碧、未来、櫂、阿姨，大家都很重要，我也很喜欢你们。\n但是，那个女孩是特别的。
34,蒼人,だから、余計に怖いんだと思う。\nあの子が僕の前から\n消えてしまうことが。,所以，我就更害怕她会从我的面前消失。
35,ビー,…………,…………
36,蒼人,人って、好きになるのは難しいけど\n嫌いになるのは簡単だろ？,喜欢上一个人很难，但讨厌一个人很容易不是吗？
37,蒼人,どんなに自分が好きでも、\n相手も同じくらい好きだと\n思っているとは限らない。,不管自己有多喜欢对方，也不代表对方会同样喜欢你。
38,蒼人,だから僕は、大切な人に\n自分の気持ちを伝えるのが\n怖いって思うんだ。,所以我害怕将真实感受\n告诉我所在乎的人。
39,蒼人,少しでも間違えば、\n簡単に人は人を嫌いに\nなってしまうから。,稍有差错，人们就会讨厌另一个人。
40,蒼人,……それでなくても、簡単に\n離れ離れになっちゃうんだから。\n余計なことはしたくないだろ。,……即使没有产生敌意，人们也会轻而易举地分开，也不愿为了挽回关系多此一举吧。
41,ビー,…………,…………
42,蒼人,……なんて。\nいつもビーには変なことを\n聞かせてごめんね。,……我在说什么啊。\n对不起，碧，总让你听这些奇怪的话。
43,蒼人,気にすんな、と言うように\n片足を上げて見せるビーに、\n僕は思わず笑ってしまう。,它抬起一只脚，像是在说“别介意”一样，我忍不住笑了。
44,蒼人,学校にも行けず、あの子に\n連絡することも出来ず。,没法去学校，也没法和那个女孩联系。
45,蒼人,時が経つのをただ待つしかない僕は、\n焦燥感を抱えながら目を閉じた。,时间缓缓流逝，我只能独自等待，焦躁感使我闭上双眼。
52,蒼人,あっつ……,好热啊……
53,蒼人,あの時の喧嘩の傷もすっかり治り、\n３日も引き籠っていれば\nいい加減飽きてしまうもので。,上次打架造成的伤口已经痊愈，我无所事事地在家呆了三天就坐不住了。
54,蒼人,丁度いつも使っていた便箋が\n無くなりかけていたことに気付いて、\n僕はこっそり買い出しに出かけていた。,我发现平时用的信纸刚好快用完了，就偷偷溜出去买东西。
57,蒼人,わっ！　叔母さん、ポスト\n見てなかったんだ。それにしても\nすごいチラシの数だな……,哇！阿姨有好一阵子没看邮箱了吧？\n传单塞得可真多……
58,蒼人,地面に散らばった紙を拾い上げていた\n僕は、その中に見慣れた色を見つけて\n手を止める。,我捡起散落在地上的纸，在其中看到了熟悉的颜色，突然停下了手。
59,蒼人,快晴の空を切り取った、\nあの子が使っている封筒。,如同晴空的一隅剪影，是那个女孩使用的信封。
60,蒼人,僕はそれを拾い上げると、\n慌てて家の中に駆けこんだ。,我将它捡起，慌忙跑进屋里。
64,丸文字の手紙,拝啓\nもうすぐ夏休みですね。,拜启\n马上就要放暑假了呢。
65,丸文字の手紙,お手紙、読みました。\n未来もお手紙に書いてましたが、\nなんだか大変だったみたいですね。,你的信，我已经读过了。\n未来也给我写信了。\n看来你最近似乎过得很艰难呢……
66,丸文字の手紙,思い返してみれば突然だったし、\nよくよく読んだらちょっといつもの\n未来とは違う部分もありました。,回想起来，当时消息来得太突然，我根本来不及思考。仔细重读一遍之后，才发现有些地方和平时的未来说话方式不一样。
67,丸文字の手紙,私も、早とちりして\nあんな手紙を書いちゃって\nごめんなさい。,我匆忙之下写了那封信，真对不起。
68,蒼人,……良かった。\n誤解、ちゃんと解けたみたいだ。,……太好了。\n误会好像解开了。
69,蒼人,恐る恐る開いた便箋に\n書かれていた内容に、\n僕はほっと胸を撫で下ろす。,小心翼翼地打开信纸，信中的内容让我松了一口气。
70,蒼人,これで万事解決──そう思った直後、\n僕の安堵を裏切るような言葉が\nひとつ行を開けた後に並んでいた。,终于万事大吉了——\n就在我这么想的时候，从下一行开始排列的话语\n将我刚刚升起的安心感击溃。
71,丸文字の手紙,あなたに伝えなきゃって\n思ってたことがあるんです。\nずっと言えなくてごめんなさい。,我有件事想告诉你。\n之前一直没机会说，真是抱歉。
72,丸文字の手紙,実は、お父さんの会社の都合で\n九州の方に引っ越すことに\nなりました。,其实，因为爸爸的公司员工调动，我家要搬到九州了。
73,丸文字の手紙,小呂島っていう小さな離島で、\n１日に１，２本しかフェリーが無い\nすごくのどかな場所です。,小吕岛是个僻静的小离岛，一天只有一两班渡轮通航。
74,丸文字の手紙,だから、引っ越す前……\n夏休みに、一度だけでも\n会えたらって思ってたんですけど……,所以在搬家之前……\n我一直盼望暑假能再见你一面。
75,丸文字の手紙,今は、会おうと思えば頑張って\n会いに行ける距離ですけど、\n今度はそうはいきませんから。,现在我们之间的距离还是足够跨越的程度，所以我觉得争取一把就可以见面，可是这次不行了。
76,丸文字の手紙,また遠くに行くんだって知って\n悲しかったけど、そんな時にふたりが\n恋人になったって話を聞いて……,听说你们要去远方度假，我很难过。\n不过同时我还听说你们成为了恋人……
77,丸文字の手紙,私、すごく嬉しかったんです。\nもちろんびっくりもしましたけど、\nそれ以上にほっとしたと言うか。,我真的很高兴。\n当然了，我也很惊讶，\n不过比起这些，我更松了一口气。
78,丸文字の手紙,私が遠くに行くことになっても、\nきっと、ふたりなら幸せになれる。,即使我以后远去千里，你们也一定会幸福的。
79,丸文字の手紙,ふたりが笑って過ごせるなら、\n私も幸せになれるから。,如果你们两人能欢笑着生活下去，我也会感到很幸福。
80,丸文字の手紙,私は、ふたりが大好きです。\nだから、ふたりが一緒で、幸せなら\n私も悲しくなんてならないって。,我最喜欢你们两个人了。\n所以，你们两人能手牵着手，获得幸福的话，我也不会难过的。
81,丸文字の手紙,でも……遠くへ行って。\nずっと会えなくて、もしも\nふたりが私を忘れてしまったら。,但是……我要远行了。\n一直无法与你们相见的话，万一你们把我忘记……
82,丸文字の手紙,それは……\n少しだけ、寂しいな。,那就……\n稍微有点，寂寞了啊。
83,丸文字の手紙,なんて、変なことを書いちゃって\nごめんなさい。でも、最後ですから。\n大目に見てくれると嬉しいな。,开玩笑的。对不起，写了些奇怪的东西。\n不过，毕竟这是最后一次给你写信了呢，希望你能原谅我。
84,丸文字の手紙,引っ越しの予定も早まっちゃったので、\n７月14日の終電で東京を経つ予定です。,因为搬家的计划提前，所以我打算乘坐7月14号经过东京的末班车。
85,丸文字の手紙,それじゃあ、お元気で。\n遠く離れた場所でも、\nあなたのことを想っています。,那么，祝你健康。\n即使远远相隔，我依然会思念着你。
86,蒼人,引っ越し……九州？\nどうして、そんな大事なこと……,搬到……九州？\n为什么，这么重要的事……
87,蒼人,きっとあの子は、最後の最後まで\n悩んでいたのだと思う。,我想那个女孩，一定直到最后一刻都还在烦恼。
88,蒼人,遠く離れ離れになってしまう未来は\n変えられなくても、せめて直接\n会って話したいと。そう思って。,即使无法改变与我们分离的未来，至少也要面对面谈谈，她一定是这么想的吧。
89,蒼人,でも、僕がそれを拒絶し、\nそこに織部が送った\n嘘のメールが届いたことで。,但是，我拒绝了她，然后她收到了织部发给她的假邮件。
90,蒼人,あの子は完全に諦めてしまった。\n僕に、僕達に会うことを。,于是那个女孩终于完全放弃了，\n与我、与我们再会的心愿。
91,蒼人,７月14日って……\n<span class='scene-font-4'>今日じゃないか！</span>,7月14日……\n<span class='scene-font-4'>不就是今天吗？！</span>
92,蒼人,カレンダーが示す日付は、\nまさに手紙に書かれていた\n日付そのもので。,日历上显示的日期，正是信上所写的日期。
93,蒼人,僕は手紙を握りしめたまま、\nほとんど衝動的に家を飛び出した。,我将信在手中握紧，一时冲动之下冲出家门。
95,蒼人,あの子が諦めてしまったものを、\n見て見ぬふりするのは嫌だ。,我讨厌对那个女孩放弃的心愿视而不见。
96,蒼人,あの時と同じように、\n別れの挨拶も出来ないまま\n離れ離れになるのは嫌だ。,我讨厌像当时一样，连道别都来不及就分开。
97,蒼人,かつての僕が犯した過ちを\n繰り返したくはない。\nただ、その一心で。,我不想重复曾经犯下的错误。\n我只想，遵从真心。
info,,,scene_evt220729_cp6_q1_s10
译者,,,冷月啮石