id,en,jp,trans
0-chapter_name,,第6話 明日天気になぁれ,第6话 愿明天是晴天
0-synopsis,,ダン伯父さんに言われ姬塔達が向かったのは、鉱山組合に所属している島々だった。ダン伯父さんは鉱山組合の中でも武器防具ギルドと事を構えたくない一派を探して味方につけようとするが、行く先々で追い払われてしまう。しかし逃げ出したい気持ちを抑え、ダン伯父さんは島を巡り説得を続けるのだった。,被丹要求以后，姬塔一行人前往所属于矿山行会的岛屿。丹想找到矿山行会中不想与武器防具行会起争端的一派让他们成为伙伴，然而每到一个地方都被赶了出来。但丹压下想要逃走的想法，继续访问各岛进行说服工作。
7,,<span class='scene-font-katari'>ダン伯父さんの頼みで、</span><br><span class='scene-font-katari'>彼を目的の島へ連れていくことにした</span><br><span class='scene-font-katari'>姬塔達。</span>,按照丹的请求，姬塔等人带他前往目的地的岛屿。
8,,<span class='scene-font-katari'>空図で示された場所は、</span><br><span class='scene-font-katari'>鉱山を擁する島だった。</span>,空图上所示的地方是一个拥有矿山的岛屿。
9,,この辺りの島で、<br>鉱山があるってことは<br>鉱山組合に所属してる島だよな。,这附近的岛，又有矿山，也就是说那岛是所属于矿山行会的岛吧。
10,,言わば、敵陣じゃねぇか。<br>伯父さん、何しに来たんだろうな？,换句话说这不就是敌营吗。大叔到底是来干什么的啊？
11,,事務所で話してくる、<br>って言ってましたけど……<br>心配ですね……,虽然他说他去事务所找人谈谈……我好担心啊……
12,,だよなぁ、なにせ合金工房に<br>乱暴者を差し向けるような奴も<br>いるわけだし……,是啊，毕竟有那种派粗暴的人到合金工坊来的人啊……
13,,あっ！<br>ダン伯父さん、戻ってきましたよ！,啊！丹大叔回来了！
15,,おぅ、待たせたなぁ。,哟，让你们久等了。
16,,<span class='scene-font-4'>きゃー！？</span><br>お、伯父さん、<br>その頬どうしたんですか！？,呀！？叔叔，你的脸是怎么回事！？
17,,真っ青になって腫れて……<br>すぐ冷やさないと！,有乌青又发肿……得赶快冷敷一下！
18,,おー、これくらい大丈夫だ。<br>親父に殴られたらこんくらいじゃ<br>済まなかったし慣れてるわ。,啊，这种程度不要紧的。被老爸打的话伤不会那么轻，而且我也习惯这种小伤了。
19,,慣れてるじゃねぇだろ！？<br>何してきたんだよ、<br>オイラ達も一緒に行けば良かったぜ！,说什么已经习惯了啊！？你到底去做了什么，早知道会这样那时候应该一起跟去的！
20,,あー、いや。<br>それじゃあダメなんだわ。<br>伯父さんが丸腰、てのが大事なのよ。,啊，不，那样不行。大叔我手无寸铁，这个事实是很重要的。
21,,ええっと……どういうことだぁ？,那个……这是什么意思？
22,,オイラ達、護衛なんだぜ！<br>ちゃんと説明してくれよな！,我们可是护卫啊！你会好好说明给我们听的吧！
23,,いちいち説明が足んねーの、<br>伯父さんの悪いとこだぜ！<br>巻き込みたくねぇってのは解るけど……,凡事都缺少说明可是叔叔你的缺点啊！我理解你不想把我们卷进来的想法，但是……
24,,すまねぇ、暗い顔させるつもりじゃ……<br>あのな、伯父さん、鉱山組合の組合員に<br>合金工房に一口乗らねぇか話したのよ。,抱歉啊，我并不想让你们的心情变差的……那个啊，叔叔我是去找矿山行会的成员，问他们要不要参与合金工房的事了。
25,,……えっ！？,……咦！？
26,,合金工房って、<br>鉱山組合との交渉のために<br>作ったんですよね？,合金工房，是为了与矿山行会进行交涉才准备建的吧？
27,,あぁ、そりゃそうなんだけどよ。<br>例えば新しい合金の配合を<br>発見できたとするだろ？,是啊，话是这么说的。不过啊，打个比方，我们发现了新的合金的配方对吧？
28,,それはよぅ、鉱山組合にとっちゃ<br>新しいビジネスチャンスなんだよな。,那个对矿山行会来说，也是新的商机吧。
29,,そのチャンスをよぅ、<br>ギルドの出資の合金工房が<br>作ってくれるって、得じゃねぇか？,这种机会，由行会出资的合金工房来制造，对矿山行会来说是好处吧？
30,,あ……そういえばそうですね！<br>伯父さんの言う通りです！,啊……说起来是这样的！就像叔叔说的这样！
31,,鉱山組合の怖い奴らがさ、<br>合金工房を襲ったのも、その辺り<br>解ってるからこそな気がすんだわ。,矿山行会的那些可怕的人会来袭击合金工房，我觉得也是知道这方面的情况才干的。
32,,たぶん、鉱山組合の中の別の一派が<br>ギルドと仲良くなって<br>立場が崩されるのが嫌なんだよ。,我猜，他们大概不希望矿山行会里另外一派跟行会搞好关系以后自己的立场变糟吧。
33,,ふむふむ……<br>鉱山組合の連中も<br>一致団結してるわけじゃねぇんだな。,原来如此……矿山行会的人也不是团结一致的啊。
34,,そうそう、それそれ。<br>まあ儲けも絡むからよぅ、<br>仲良しこよしではないわな。,没错没错，就是那样。赚钱也是各种利益纠葛，并不是大家关系都很好的。
35,,鉱山組合、って一口に言っても<br>色んな奴があるし<br>色んな事情があるわけだろ。,虽然用矿山行会来概括了，但是里面有各种各样的人，也有各种各样的情况吧。
36,,全員が全員、<br>武器防具の工房のギルドと<br>ことを構えたいわけじゃねぇと思う。,我觉得他们并不是所有人都想跟武器防具工坊行会起争执的。
37,,商売のことを考えりゃ、<br>とっとと和解したいって考えるのも<br>絶対いるはずなんだ。,考虑到做生意的事，我觉得肯定有人有想要赶快和解的想法。
38,,でもま、伯父さんコネもないし<br>誰が仲良くしてくれる組合員か<br>さっぱり解らねぇんだよな。,但是啊，叔叔我又没什么门路，完全不知道谁是会跟我们搞好关系的成员。
39,,……だから、<br>直接聞きに来たのか！？,……所以你就直接来问了吗！？
40,,へへ……当たり。<br>でもここの鉱山主には<br>怒られちまったわ。,嘿嘿……你说对了。不过我被这里的矿山主骂了。
41,,鉱山組合の中を<br>ひっかき回すな、てさ。,他说，不要搅乱矿山行会里的关系。
42,,というわけだからよ、姬塔。<br>悪ィが次の島に連れてってくれ！<br>当たりを引かねぇとな。,事情就是这样，姬塔。不好意思啊请你把我带到下一个岛！我一定要找到对的人。
43,,<span class='scene-font-katari'>姬塔に頭を下げると、</span><br><span class='scene-font-katari'>ダン伯父さんは騎空艇へ乗り込む。</span>,向姬塔低头请求后，丹乘上了骑空艇。
44,,あっ！　ダン伯父さん、<br>それは解りましたけど<br>手当はしなきゃダメですーっ！！,啊！丹叔叔，事情我们都知道了！但是得先帮你疗伤啊！
45,,<span class='scene-font-katari'>姬塔達は</span><br><span class='scene-font-katari'>伯父さんを案じつつ、</span><br><span class='scene-font-katari'>彼の行動を見守り島々を巡った。</span>,姬塔一行一边担心大叔，一边在关注着他的行动，周游各岛。
51,,……あんたの話は解ったよ。<br>だが、俺にも立場ってもんがある。,……你说的我理解了。但是我也有我的立场。
52,,悪いが、帰ってくれ。<br>急進派のアタマにゃ義理もある。<br>勝手にギルドとは交渉できねぇ。,不好意思，请你回去。激进派的头领有恩于我，我不能擅自和行会交涉。
58,,頼む、帰ってくれ……<br>うちみたいな小さいとこが<br>急進派に逆らったらどうなるか……,拜托你，回去吧……像我这样的小作坊如果反抗激进派的话不知道会有什么后果……
64,,はぁ……<br>なかなか上手くは転ばねぇなぁ……,哈……事情进行的非常不顺利啊……
65,,……帰りてぇ……,……我想回家……
66,,……けど……,……但是……
69,,伯父さん！<br>次の島にそろそろ着くぜ！,叔叔！马上就要到达下一个岛屿了！
70,,おぅ、そうかぁ！<br>降りる準備するわ！,哦，是吗！我马上准备下船！
71,,<span class='scene-font-kokoro'>（……踏ん張らなきゃあ、なぁ……）</span>,（……必须，坚持下去啊……）
info,,1,scene_evt180930_cp6_q1_s10
