id,name,text,trans
0,アーミラ/阿米拉,姬塔、誕生日おめでとう。,姬塔，生日快乐。
1,アーミラ/阿米拉,今年も、姬塔にケーキを<br>買ってきた。,今年我也给姬塔买了蛋糕。
2,アーミラ/阿米拉,甘くて、美味しくて……<br>大きいやつを、買ってきた。,甜甜的，好吃的……<br>我买了大的回来。
3,アーミラ/阿米拉,姬塔は私と一緒に<br>食べてくれるから。<br>大きい方がいいと思って。,我觉得如果姬塔跟我一起吃的话，<br>大一点的比较好。
4,アーミラ/阿米拉,……はっ、いけない。,……哈，不好。
5,アーミラ/阿米拉,カタリナが、準備ができたから<br>君を呼んでこいって言ってたんだ。,卡塔莉娜说东西都准备好了要把你叫过去。
6,アーミラ/阿米拉,早く行こう！<br>ケーキだけじゃなくて、<br>ご馳走もたくさんある。,快走吧！<br>不光有蛋糕，还有其他好吃的。
7,アーミラ/阿米拉,一緒にたくさん食べて、<br>いっぱいお祝いしよう！,一起大吃一顿，<br>大肆庆祝吧！
info,,,scene_s4_birthday_2055_v2_0_2006_4_3040051000