id,name,text,trans
180,,マコラのビンタがアニラの頬を張り、\n景気のいい音が周辺に響いた。,玛蔻拉的巴掌扇在阿妮拉脸上，响亮的动静在周边回荡。
181,アニラ/阿妮拉,マコラよ！　痛いんじゃが！？\nこういう時は先に理由を聞くのが\n筋ではないかのう！,玛蔻拉啊！很痛耶！？这种时候不应该先问问理由吗！
182,マコラ/玛蔻拉,いや、急に殴れなんて言われたから\nアニラがおかしくなったのかと思って\nこりゃ殴って正気に戻そうかなって……,不，你突然提出这么奇怪的要求，我还以为你疯了呢，所以就想着干脆把你揍回正常人……
183,アニラ/阿妮拉,むぐぅ……\n結局、同じことじゃが……,唔……结果还不是一样……
184,クビラ/库碧拉,見て、みんな！\nビカラちゃんが……！,大家快看！小碧卡拉她……！
185,ビィ/碧,おお！,哦哦！
194,,並んで寝かされていたビカラが\n淡い光に包まれて\nひとつに融合したかと思うと……,并排躺着的两个碧卡拉被淡淡的光芒包围，仿佛要融为一体……
197,ビカラ/碧卡拉,あ、あれ……？\nあたし、なにしてたんでしたっけ？,啊，咦……？我刚才在做什么来着？
198,クビラ/库碧拉,ビカラちゃん、無事なんだね！,碧卡拉，你没事了！
199,ビカラ/碧卡拉,え？\nあ、はい……！,诶？啊，是的……！
200,アニラ/阿妮拉,やはりそうじゃったか……\nビカラの分裂は我のせいじゃ。,果然如此啊……碧卡拉的分裂是我的错。
201,マコラ/玛蔻拉,どういうことだい？,这是怎么回事？
202,アニラ/阿妮拉,魔物化したビカラが攻撃を受けた時、\nずいぶん心配してしまってのう……,变成魔物的碧卡拉受到攻击时，我真的非常担心啊……
205,アニラ/阿妮拉,我によく見せてほしいのう……\nどこも痛くはないか？,希望你能让我好好看看……有没有哪里痛呢？
208,アニラ/阿妮拉,つまり我がビカラに怪我がないか\nちゃんと確かめたかったから\nビカラは分裂したのじゃろうな。,也就是说，是因为我想仔细检查碧卡拉是否受伤，她才会分裂的吧。
209,アニラ/阿妮拉,やれやれ……\nネズ耳ありとなしがそれぞれいれば\n確かにビカラを確かめ放題かもしれぬ。,哎呀哎呀……如果有耳朵的和没耳朵的两个都在，就确实可以尽情确认比卡拉的情况了。
210,マコラ/玛蔻拉,は～なるほどねェ。\nそれでアタイがアニラを殴って\n知らず煩悩を払ったというわけかァ。,哈~原来如此啊。所以揍阿妮拉相当于无意间消除了烦恼啊。
211,ビィ/碧,わかんねぇ……\nビカラを心配することが\nなんで煩悩になんだよ……,真不明白……为什么担心碧卡拉反而会变成烦恼啊……
212,アニラ/阿妮拉,心配しすぎることも煩悩の一種じゃ。\nあるいは「大丈夫」と答えたビカラを\n疑ってしまう心……それも煩悩じゃ。,过度担心也是一种烦恼。或者怀疑回答 “没问题” 的碧卡拉的心……这也是一种烦恼。
213,アンチラ/安琪拉,そうそう！\n煩悩ってボクが以前教えた\n「貪・瞋・癡」だけじゃないんだよ！,没错没错！烦恼不只是我以前告诉大家的 “贪、瞋、痴” 那么简单！
214,ルリア/露莉亚,あ、三毒ですね！\n覚えてます！,啊，是三毒呢！我记得！
215,アンチラ/安琪拉,ビッキィとビカラちゃんは\n三毒以外の煩悩の影響を\n受けちゃったみたいだね。,碧奇和小碧卡拉似乎受到了三毒以外的烦恼的影响呢。
216,アニラ/阿妮拉,「叶いすぎる願い」か……\n実に厄介じゃのう。\nまさに暴走じゃな。,“过度实现的愿望”啊……真是麻烦呢。简直跟失控了一样。
217,ビカラ/碧卡拉,そ、そうだったんですね……\nアニラさん、すみませんでした……\n心配かけちゃったみたいで……,原、原来是这样啊……阿妮拉，对不起……好像让你担心了……
218,アニラ/阿妮拉,くふふふ……なにを申す。\n此度の現象は我のせいじゃ。,呵呵呵呵……你在说什么啊。造成这次情况的责任在我。
219,アニラ/阿妮拉,マコラにも感謝じゃな。,也要感谢玛蔻拉啊。
220,マコラ/玛蔻拉,アタイはビンタしただけサ。\nちょ～っと強めだったみたいで、\n申し訳なかったねェ……,我只是打了你一巴掌而已。而且好像有点太用力了，真是抱歉啊……
221,バサラ/巴萨拉,待て。,等等。
222,マコラ/玛蔻拉,ん？\nなんだい？　バサラ様。,嗯？怎么了，巴萨拉大人？
223,バサラ/巴萨拉,卯神が羊神の煩悩を払った瞬間、\n周辺にあった幻もわずかに揺らいだ。\n卯神の抗煩力が発揮されたからだろう。,卯神驱散羊神烦恼的瞬间，周围的幻象也微微晃动了一下。这大概是因为卯神的抗烦恼能力发挥了作用。
224,バサラ/巴萨拉,まるで波紋のようにそれは広がった。\nおかげで隠れている者に気づけた。,力量就像涟漪一样扩散开来。多亏如此，我注意到了隐藏的人。
225,アンチラ/安琪拉,え？\n隠れている者、ですか？\nそれに、幻って……,咦？有人藏起来了吗？而且，说到幻象……
226,バサラ/巴萨拉,俺も気づいていなかった。\n本物の景色と同化させていたらしい。\nその向こう側に隠れていたんだ。,我之前也没有察觉到。似乎是与真实的景色同化了。有个人就藏在对面。
227,バサラ/巴萨拉,そこだ。,就是那里。
230,,バサラの刀が一閃し、\n真横に空を斬った。,巴萨拉刀光一闪，斩向正侧面的空中。
231,,空振り……かと思いきや、\n空間に裂け目ができ、\nその向こうに人影が見えた。,正当众人以为挥空了的瞬间，那个空间就出现了一道裂缝，在裂缝的另一端可以看到一个人影。
234,？？？,くっ……！,呃……！
235,アンチラ/安琪拉,<span class='scene-font-4'>えぇ！？</span>\nど、どちら様ですか？,咦！？请、请问您是哪位？
236,,十二神将も姬塔達も、\nその顔に見覚えはなかったが、\n反応する者はいた。,十二神将和姬塔等人都对那张脸没有印象，但还是有人做出了反应。
237,ラオラオ,ガウ！？,嗷呜！？
238,ドーマウス/多瑁斯,でし！？,咦！？
239,一兎・二兎・三兎・四兎/一兔・二兔・三兔・四兔,むむぅ！？,唔唔！？
240,,そしてバサラ本人も……,而巴萨拉本人也……
241,バサラ/巴萨拉,なんだと……\nそ、その顔は……,什么……这、这张脸……
242,ヴァジラ/瓦姬拉,バサラ兄、どうしたんだ？,巴萨拉哥，你怎么了？
243,フアン/黄,ラオもどうした？,姥也是，怎么了？
244,パイ/白,様子がおかしいよ。,样子很奇怪啊。
245,マコラ/玛蔻拉,ウサギちゃん達、どうしたってんだい？,小兔子们，出什么事了？
246,ラオラオ,ドーマウス、犬神、ウサギ達！\nこの顔は間違いないガウ！,多瑁斯、犬神、兔子们！这张脸绝对没错嗷呜！
247,ドーマウス/多瑁斯,でもどういうことでし……？\nなんでここにいるでしか？,但这是怎么回事……？她为什么会在这里？
248,三兎/三兔,なんでだろう……怖い……\n意味わかんないよぉ……,为什么呢……好可怕……完全搞不懂……
249,バサラ/巴萨拉,なぜ生きている……？,你为什么还活着……？
250,ビカラ/碧卡拉,あ、あれ……？\nいま気づきましたけど、\nひょっとして森で見た……？,咦、咦……？我才注意到，难不成我们在森林里见到的就是……？
251,アートマン/阿特曼,やれやれ……\n見られているとは思っていたけど、\nもう乗り込んできていたとはね。,哎呀哎呀……我就知道我们已经被发现了，但没想到你已经过来了呢。
252,アートマン/阿特曼,みんなに紹介しよう。\n彼女はサンカラ。,向大家介绍一下。她是桑卡拉。
253,アートマン/阿特曼,覇空戦争時代、惜しくも\n十二神将になれなかった戦士だ。,是在霸空战争时代，遗憾地未能成为十二神将的战士。
254,ビカラ/碧卡拉,な、なれなかった？,没、没能成为？
255,,アートマンの言葉を聞き、\n姬塔達は首をひねる。,听到阿特曼的话，姬塔等人疑惑地歪了歪头。
256,サンカラ/桑卡拉,…………！,…………！
257,,一方のサンカラという少女は\n憎々しげに十二神将をにらむのだった。,另一边，名叫桑卡拉的少女则憎恨地瞪着十二神将。
info,,,scene_evt250226_cp5_q4_s10
译者,,,雨降星