id,name,text,trans
0,カロ/卡洛,今年もまた、君の\n誕生日がやってきたね！\nおめでとう！,又到了今年的你生日！\n恭喜！
1,カロ/卡洛,艇の皆も張り切っているね。\n君を祝うための大きなケーキが、\n食堂にいくつも並んでるよ！,团员们都很兴奋呢。\n食堂里摆着好几个为你庆祝用的大蛋糕。
2,カロ/卡洛,もちろん、僕も\n張り切った仲間のひとりさ。\nケーキのプレートに絵を描いたんだ。,当然，我也是其中的一员。\n我绘制了蛋糕表面的图案。
3,カロ/卡洛,チョコレートでグランサイファーの姿を\n描いたんだよ。君が日々を過ごす、\n大事な居場所だからね。,用巧克力画了格兰塞法号。\n因为你生活在这里，\n它是你重要的归属之地。
4,カロ/卡洛,今年もこの温かな艇で、\n楽しい１年を過ごしてほしい……\nそういう願いを込めて描いたんだ。,希望今年你也能在这艘温暖的船上，\n度过愉快的一年……\n我怀着这样的心愿画下了这个图案。
5,カロ/卡洛,ふふっ、早く見たいって？\nそう言ってくれて嬉しいよ。,呵呵，想要早点看到？\n你这么说我真高兴。
6,カロ/卡洛,それじゃあ、食堂へ行こうか！,那么，我们去食堂吧！
info,,,scene_s2_birthday_3224_v1_0_2006_2_3040460000
译者,,,psyche