id,name,text,trans
0-chapter_name,,第5章　新・海の島,
0-synopsis,,姬塔達の到着した<span class='scene-font-place'>レゾルティル</span>は、大浮上による水没と再建が進んでいる独特の街並みだった。フィルキスはそこで同じ顔を持つ少女ウェルキスと再会する。同じく姬塔達も、ミィキスと名乗る、フィルキスそっくりの少女と邂逅。彼女達が魔族に対抗するために生み出されたクローン退魔師であり、多くの姉妹を失ってきた過去が明るみになるのだった。,姬塔等人抵达的雷索尔提曾被大浮上导致的水位上升淹没，并在在重建中形成了独特的风格。在这里，菲尔基丝与与自己有着同样面孔的维尔基丝重逢了。而与此同时，另一边的姬塔等人也与一位自称米基丝的、酷似菲尔基丝的少女邂逅。她们表明自己是为与魔族对抗而被培育出的克隆人退魔师，并在过去的战斗中失去了诸多姐妹。
9,ルリア/露莉亚,はわわ～！\nここが中心街ですか！,哈哇哇~！\n这里就是中央街啊！
10,フォス/法斯,あれが海～？,那就是大海~？
11,ルリア/露莉亚,みたいですね！\n私達にとっても初めて来た海です！,应该是！\n这片海我们也是第一次来！
12,ナルメア/娜尔梅亚,海に着いたっていうから<span class='scene-font-place'>アウギュステ</span>に\n来たのかと思っちゃったけど、\n本当に違う海なのね……！,听碧说到海边了的时候，\n我还是以为是到<span class='scene-font-place'>奥古斯提</span>来了，\n没想到是一片完全不同的大海……！
13,ビィ/碧,違う海ってことはよぉ……\n守畏禍もカツウォヌスもいねぇのか？\nゾンビ騒ぎもスモウォーも？,既然是片不同的海……\n那么应该没有守畏祸和鲣鱼吧？\n也不会发生僵尸骚动和相扑大战吧？
14,ビィ/碧,ごくり……遊び放題じゃねぇか……,唔唔……那岂不是可以好好玩上一场了……
15,フィルキス/菲尔基丝,なにとなにが、なんて？,你说什么和什么怎么了？
16,ビィ/碧,まぁここもまだ油断はならねえ。\nとにかく海を甘く見るなってことだぜ。\n……オイラは忠告したからな？,反正这里也还大意不得。\n千万不能小瞧了大海的威力啊。\n……可别怪俺没提醒过你哦？
17,フィルキス/菲尔基丝,お、おう……,哦、哦……
18,シス/希斯,なぜこんなところに……\n泳ぐような気候ではないと\n俺には思えるが……,为什么要来海边呢……\n我觉得现在并不是适合下水的季节……
19,ビィ/碧,海水浴するには少し涼しいけど、\nそう言うなって。\n買い出しもあるんだからよ。,对洗海澡来说是凉了点，\n但也别泼冷水嘛。\n俺们还有采购的的任务在身呢。
20,ラカム/拉卡姆,おい、水路を見ろよ……！\nよく見りゃ街が水没してるぞ。,喂，你们快看水路……！\n仔细一看，这座城是被水淹了啊。
23,,目を凝らすと、\n眼下の水中に\n建物の下部が見えた。,众人定睛一看，\n只见建筑物的基部泡在水面之下。
24,ダリダラ/达里达拉,もともとこの島の中心には\nデカい塩湖があったそうなんだが、\n大浮上の影響で水かさが増したんだと。,这座岛的中心原本是个巨大的盐湖，\n在大浮上的影响下，\n它的水量增加了。
25,ダリダラ/达里达拉,低地はこの通り水没した。\nつまりいま俺達がいるのは、\nかつての街の空中だな。,低地就这样被水淹没了。\n也就是说，我们现在处在旧城镇的空中。
26,ラカム/拉卡姆,へぇ……\n新たな水位に合わせて\n通路や街を造ったってわけか。,嚯……\n现在的道路和建筑\n是根据新的水位造的啊。
27,シス/希斯,災難だな。\n本来の街並みが失われるとは。,真是一场灾难。\n原来的城镇就这样被毁掉了。
28,ナルメア/娜尔梅亚,だけど、これも素敵な雰囲気だよ。\nとってもおしゃれ。\nそれに人もたくさんいるみたい。,不过，现在这种氛围也很不错，\n感觉别有一番风味。\n而且居民也有很多。
29,ダリダラ/达里达拉,ここは元から観光地だからな。\nクレシュタインの王家の\nバカンスにも使われてたらしい。,这里本就是个观光圣地，\n也是克雷施坦因王家的度假场所。
30,ビィ/碧,とっとと買い出しを済ませて\n遊ぼうぜ！\n手分けしてやらねえとな。,赶紧把物资搞定然后去玩吧！\n俺们分头行动吧。
31,フィルキス/菲尔基丝,よっせ。,嘿咻。
32,ビィ/碧,おい、フィルキス。\nお前、ひとりで行くつもりか？,喂，菲尔基丝。\n你要一个人去吗？
33,フィルキス/菲尔基丝,だって手分けするんでしょ？\nアンドリーニャに乗っていれば\n迷子にはならないだろうし。,不是说要分头行动吗？\n我乘着安多琳娜又不会迷路。
36,,姬塔は次の言葉を待ったが、\nフィルキスはそのまま去ってしまった。,姬塔想等她继续说下去，\n但菲尔基丝却头也不回地离开了。
37,ルリア/露莉亚,あらら……行っちゃいました。,哎呀呀……自己走掉了呢。
38,ビィ/碧,勝手なヤツだなぁ。\nそりゃ目立つだろうから\nすぐに見つけられそうだけど……,真是个任性的家伙。\n不过她那么显眼，\n肯定很快就能找到的，
39,ナルメア/娜尔梅亚,フィルキスちゃん、\nまだちょっと私達と\n距離があるのかな……？,菲尔基丝和我们之间\n是不是还存在一些隔阂呢……？
40,ビィ/碧,基本的にマイペースな性格だから\n気にかけてほしいって言われてんだよ。\nシーザーから姬塔にな。,凯撒也说过她很我行我素，\n拜托姬塔多留心着点呢。
41,ビィ/碧,でもあんまり自分のことを\nしゃべらないとも言ってたっけ。,不过凯撒也说过\n她不怎么爱讲自己的身世呢。
42,ルリア/露莉亚,フィルキスちゃんは自分のことを\n魔族と戦う退魔師の家系って\n話していましたよね。,菲尔基丝说过，\n她来自与魔族作战的退魔师家族。
43,ルリア/露莉亚,それってどういうものなんでしょうか。,这个家族是怎样的呢。
44,カタリナ/卡塔莉娜,それも彼女の口から聞きたいものだな。\nいずれにせよ、フィルキスは\n私達にとって初めての地の民の仲間だ。,我也想听她介绍一下。\n无论如何，菲尔基丝都是\n我们的第一个地之民同伴。
45,カタリナ/卡塔莉娜,本人がしたいようにさせながら、\nいまは注意深く見守ってあげよう。,现在我们就遵从她的意愿，多加留心，\n在远处守望着她吧。
46,ナルメア/娜尔梅亚,自分達の住んでいたところとは\nまったく違う世界に来たんだもんね。\n不安は尽きないんじゃないかな……,一下子被抛进一个\n跟自己的出生地截然不同的世界里，\n肯定非常不安吧……
47,フォス/法斯,あむあむあむあむ……,啊呜啊呜啊呜啊呜……
48,シス/希斯,ひっ……！\nま、また俺の耳を！？,咿……！\n又、又啃我耳朵！？
49,フォス/法斯,ね～お菓子も買って～？\n早く～,喂~也买买点心嘛~？\n快一点~
50,シス/希斯,わ、わかったからやめろ……！\n俺の耳を食べるなぁ！\nやめてくれぇ……！,听、听到了所以快松口……！\n别啃我的耳朵了！\n松口啊……
51,ビィ/碧,こいつもこいつでマイペースだったな。,一个两个的都很我行我素呢。
52,カタリナ/卡塔莉娜,私達も行こうか。\n全員、迷ったらここに戻ること。\n集合場所にしよう。,我们也开始行动吧。\n各位，要是迷路了就回现在的地方来，\n我们在这里集合。
58,フィルキス/菲尔基丝,へ～\n<span class='scene-font-place'>ウィン・セリア</span>よりも\n地の民がけっこういるね。,哇~\n这里的地之民比<span class='scene-font-place'>维因·塞利亚</span>的还要多。
59,,アンドリーニャに乗ったまま、\nフィルキスはにぎわう街と人々を\n興味深そうに眺めていた。,菲尔基丝乘着安多琳娜，\n饶有兴趣地打量着\n热闹的街道和人群。
60,フィルキス/菲尔基丝,このヘンなニオイ、\nこれが海の匂いなのかな。,好怪的气味，\n这就是大海的味道吗。
61,？？？,フィルキス！,菲尔基丝！
62,フィルキス/菲尔基丝,……ッ！？,……唔！？
66,,自分を呼ぶ声の方を振り向くと、\nフィルキスは息をのんだ。,菲尔基丝朝呼唤声传来的方向看去，\n不禁倒抽一口凉气。
67,フィルキス/菲尔基丝,どうしてここに……？,你怎么会在这里……？
68,？？？,それはこっちの台詞だ！,那是我的台词！
69,？？？,それにお前、ここでもまだ\nマギシェルなんかに乗って……\n相変わらずだな。,说起来你到了这里\n也还是乘着魔导机甲啊……\n你真是一点没变。
70,フィルキス/菲尔基丝,…………,
76,ビィ/碧,お？\nあそこにいるのフィルキスじゃねぇか。,哦？\n那里站着的不是菲尔基丝嘛。
82,,雑踏の先に、\nビィがいち早く\n見知った顔を見つけた。,碧最先在熙攘的人群中\n发现了熟悉的面孔。
83,フォス/法斯,フィルキス、こっちにいるのなんで～？,菲尔基丝，居然在这边啊~
84,ルリア/露莉亚,なにかあったんでしょうか？\nフィルキスちゃん、\nさっきは反対方向に行きましたけど。,是出了什么事吗？\n菲尔基丝刚才明明是冲反方向去了。
85,ビィ/碧,おーい、フィルキス～！,喂~菲尔基丝~！
86,？？？,え？,诶？
87,ルリア/露莉亚,あれ？\nなんだか……,咦？好像……
87-sel1_txt,,フィルキス！,菲尔基丝！
87-sel2_txt,,フィルキス？,菲尔基丝？
89,ビィ/碧,おう、お前こっちに来てたんだな。\nその辺、ぐるっと１周したのか？,原来你到这边来了啊，\n是整整绕了一圈吗？
91,ビィ/碧,んん？\nフィルキス……だよな？,嗯嗯？\n你是菲尔基丝……对吧？
94,,フィルキスと同じ顔の女性は\n姬塔達に向かって\nずんずんと距離を詰めてきた。,与菲尔基丝有着同样面孔的女性\n一下子冲到了姬塔等人面前。
95,？？？,いまフィルキスって言いました？\nあなた達、この顔に覚えがあるの！？,你刚才说菲尔基丝？\n你们几个认得这张脸吗！？
96,ルリア/露莉亚,フィルキスちゃんじゃ……ない？,你不是……菲尔基丝？
97,,その少女は答える前に、\n胸に手を当てて大きく息を吐いた。,面前的少女在做出回答之前，\n将手按在胸口，\n长出一口气。
98,？？？,あ～！\nよかったぁ……！,啊~！\n太好了……！
99,？？？,フィルキスは生きてるのね？\nしかも、この島に来ているの？,菲尔基丝还活着对吧？\n而且就在这座岛上！
100,？？？,あなた達はどなた？\nフィルキスとどういう関係ですか？,你们是什么人？\n跟菲尔基丝是什么关系？
101,ビィ/碧,い、いや……\nそりゃオイラ達が\n聞きてぇところだけど……,呃，那啥……\n俺们还想问你呢……
102,ミィキス,私はミィキス・アーモン。\nフィルキスのクローン姉妹。\n姉ということになってるわ。,我叫米基丝·亚蒙。\n是菲尔基丝的克隆人姐妹，\n也就是她的姐姐。
103,ビィ/碧,姉？　アーモン？\nいや、クローンって……,姐姐？亚蒙？\n不，首先克隆人是……
104,ミィキス,アーモン家のことは聞いてない？,你们没听说过亚蒙家吗？
105,ルリア/露莉亚,フィルキスちゃんが……クローン？,菲尔基丝是……克隆人？
111,フィルキス/菲尔基丝,まさかこんなすぐに\n再会するなんて……,没想到重逢来得这么快……
112,フィルキス/菲尔基丝,やっぱり空の世界は狭いな……\n島しか住めるところがないから、\nそんな気はしてたんだけど……,果然空之世界很狭窄啊……\n毕竟只能居住在岛屿上，\n我早就有此预感了……
113,？？？,今日までどこでなにをしていた？,在此之前你都上哪晃悠去了？
114,フィルキス/菲尔基丝,どう生きようがあたしの勝手じゃん……\nウェルキスには関係ないし……,要怎么生活都是我自己说了算吧……\n和维尔基丝你无关……
115,ウェルキス,そんな勝手があるものか！,怎么可能都由着你的性子来！
116,ウェルキス,私達が生まれた理由と、\n惨劇を忘れたわけじゃあるまい！,我们诞生的理由，\n还有那些惨剧，都绝不该被忘记！
117,フィルキス/菲尔基丝,…………,
118,ルリア/露莉亚,フィルキスちゃん！,菲尔基丝！
119,フィルキス/菲尔基丝,姬塔……\nえ、ミィキスも一緒なの……？,姬塔……\n咦，米基丝也在……？
120,ミィキス,久しぶり、フィルキス！\n無事でよかったわ！,好久不见，菲尔基丝！\n你没事真是太好了！
121,ウェルキス,同行者がいるのか。\n地の民を狙って悪事を働く者がいる。\n彼らはどうなんだ？,是你的旅伴吗。\n有许多人对地之民图谋不轨，\n他们又如何呢？
122,フィルキス/菲尔基丝,やめてよ。\n姬塔達はそんなんじゃない。,别这样说。\n他们不是那种人。
123,ビィ/碧,<span class='scene-font-4'>うお！</span>\nあそこにもフィルキスと同じ顔が……,<span class='scene-font-4'>哇哦！</span>\n那里还有人跟菲尔基丝长一张脸……
124,ウェルキス,空の民と一緒に行動とはな。\nむしろお前には都合がよかったか？\nこの大浮上は。,没想到你会选择和空之民同行。\n不如说这才遂了你的意吧？\n托这场大浮上的福。
125,フィルキス/菲尔基丝,…………,
126,ウェルキス,<span class='scene-font-4'>なんとか言え！</span>\n黙っていたらわからないだろう！,<span class='scene-font-4'>你说话啊！</span>\n跟个闷葫芦一样\n谁能知道你在想什么！
127,フィルキス/菲尔基丝,…………ッ！,…………唔！
131,ビィ/碧,お、おい……フィルキス！,喂、喂……菲尔基丝！
132,,姬塔達は追おうとしたが、\n同じ顔をしたもうひとりの少女が\nその前に立ちはだかった。,姬塔等人试图追上她，\n却被另一位与菲尔基丝有着相同面孔的少女\n拦住了去路。
133,ウェルキス,追わなくていい。\nどうせどこへも行けないのだ。\n島とは、そういうものなのだろう？,不用追。\n反正她哪儿都去不了。\n毕竟这里是岛屿，对吧？
134,ビィ/碧,お、お前……\nいや、お前ら、いったい何者なんだ？\n三姉妹だったなんて……,你……\n不，你们到底是什么人？\n是三姐妹吗……
135,ウェルキス,三姉妹じゃない。,不是三姐妹。
136,ウェルキス,二十一姉妹だ。,而是二十一姐妹。
137,ビィ/碧,なんだって！？,你说啥！？
138,ルリア/露莉亚,に、にじゅういち……？\nみんな、フィルキスちゃんと\n顔がそっくりなんですか？,二、二十一……？\n大家都跟菲尔基丝长得一样吗？
139,ミィキス,そうよ～\n私達は見分けがつくけど、\n他人からは難しいみたいね。,是哦~\n我们自己是能分清，\n不过对他人来说好像有些难度呢。
140,,フィルキスと似た少女が\n他にも18人いることを考え、\n姬塔は気が遠くなる。,得知与菲尔基丝面貌相似的少女还有18个，\n姬塔感到一阵眩晕。
141,ミィキス,地の世界の機械文明は、\n空の世界よりもいくらか進んでいたわ。,地之世界的机械文明\n要比空之世界先进得多。
142,ミィキス,それが魔法と組み合わさり、\n一部の退魔師の家系に\nクローンを生んだの。,部分退魔师家族\n将其与魔法结合，\n培育出了克隆人。
143,ウェルキス,私達は魔族と戦うために\n人工子宮でデザインされた退魔師だ。,我们是在人造子宫中培育出的退魔师，\n专为与魔族作战而生。
144,ルリア/露莉亚,魔族……,魔族……
145,ビィ/碧,た、確かにオイラ達も戦ったけどよ……,俺、俺们确实也跟魔族打过……
146,ウェルキス,<span class='scene-font-4'>魔族と会ったのか！？</span>\nどうやって戦った？,<span class='scene-font-4'>你们见过魔族！？</span>\n是怎么打的？
147,ルリア/露莉亚,どうやって、ですか？\nえぇっと……\nみんなで力を合わせて、あとは……,怎么打的？\n呃……就是大家齐心协力，然后……
150,フォス/法斯,フォスのおかげだよね～！,都是多亏了法斯哦~！
151,,ルリアの背後から飛び出して弧を描き、\n胸の中に落ち着いた小さな影に、\nふたりが目を見開いた。,一个小小的影子从露莉亚背后飞出，\n划出一道抛物线落在了露莉亚的怀里。\n面前的两人看到它，一齐瞪大了双眼。
152,ウェルキス,元耀霊！？,元耀灵！？
153,ミィキス,ウソ……元耀霊が目の前に……\n空の世界に来ていたなんて……,真的假的……元耀灵就在眼前……\n它们居然也来到了空之世界……
154,ビィ/碧,フィルキスもそうだったけど、\nやっぱり元耀霊って\n地の民に驚かれるものなんだな。,之前菲尔基丝的反应也和你们一样，\n看来元耀灵对地之民来说真的非同寻常啊。
155,ビィ/碧,お前、ひょっとして偉いのか？,难道说你还是个大人物？
156,フォス/法斯,え？\nフォス……えらい？,咦？法斯……大人物？
157,フォス/法斯,ひかえおろ～！,预备~起！
158,ビィ/碧,偉そうにしろとは言ってねぇ。,不是让你摆架子的意思！
159,フォス/法斯,じゃあフォスは褒めてほしいな～,那么法斯想要夸夸~
160,ルリア/露莉亚,いい子いい子です！\n<span class='scene-font-place'>ウィン・セリア</span>でも\n頑張ってくれましたもんね！,真棒真棒！\n在<span class='scene-font-place'>维因·塞利亚</span>的时候多亏了你！
161,フォス/法斯,えへへっ！,诶嘿嘿！
162,ウェルキス,元耀霊をこんな間近で見るなんて……,竟能如此近距离地接触元耀灵……
163,ミィキス,不思議ね……\n魔族を倒すと\nすぐに姿を消しちゃうのに……,好神奇……\n明明之前一打败魔族\n就会消失的……
164,ウェルキス,疲労困憊の私達を置いて、\nまるで風のように消えてしまうのが\n常だからな…,它们通常都是\n抛下疲惫不堪的我们随风而逝……
165,ミィキス,あの小さな身体で、\nよく凶悪な魔族を祓えるものだわ。\nいつもそう思ってた。,那样小的身体\n居然能够祛除穷凶极恶的魔族，\n我一直觉得很不可思议。
166,ビィ/碧,なぁ、ちょっとわからねぇんだけど、\n魔族ってそこまでのヤツか？\n正体はこんくらいの玉だったぜ？,那个，我有点不太明白，\n魔族有那么夸张吗？\n它的本体不过是这么大点的球而已啊？
167,,ポート・ブリーズとウィン・セリアで\n起きた事件の概要を、\n姬塔はふたりに説明してみた。,姬塔向两人讲述了\n在微风港和维因·塞利亚发生的事件。
168,ウェルキス,やはり空の民への啓発活動が\n必要なようだな。,看来还是得对空之民\n开展启发教育活动啊。
169,ミィキス,そうね……\n魔族の存在と危うさ、対策、\nその他諸々をね。,是啊……\n必须得让他们了解魔族的存在和危险性、\n对付它们的方法等诸多事宜。
170,ビィ/碧,な、なんだよ……\nなんか間違ってるのか？,怎、怎么了……\n俺说的有什么不对吗？
171,ウェルキス,端的に言うと、\nお前達が見たのは、\n第１形態と第２形態だけだ。,简而言之，\n你们之前见到的不过是\n第一和第二形态的魔族。
172,ウェルキス,もちろんそれも十分な脅威だが、\nまだ本領は発揮できていない。\nせいぜい魔蝕対象の力を借りるだけだ。,当然这两个阶段已经足以构成威胁了，\n但还不能发挥其真正的实力。\n基本都是在借用魔蚀对象的力量。
173,ビィ/碧,いや、それはそれで\nけっこう大変だったんだぜ……,真的假的，\n光是这样就已经很棘手了……
174,ルリア/露莉亚,はい……\nノトスさんが乗っ取られて\n街が大変なことになってしまって……,是的……\n诺托斯小姐被附身的时候\n情况真的很危急……
175,ウェルキス,地の世界で猛威を振るう魔族は、\n基本的に第３形態だ。,在地之世界张扬跋扈的魔族，\n基本都是第三形态的。
176,ビィ/碧,第１とか第３とか……\nオイラ達にもわかるように\n言ってくれよ。,什么第一第三的……\n能不能简明易懂地给俺们解释一下啊。
177,ウェルキス,第３形態は極めて強い。\nそこへ至った魔族を倒すには\n膨大な犠牲がつきまとうほどに。,第三形态非常强大。\n要打败到了这种地步的魔族，\n需要付出极大的牺牲。
178,ウェルキス,私達のようなクローンが\nなぜ存在するかというと、\n魔族に対抗するために必要だからだ。,我们这些克隆人，\n就是为了打倒这些魔族而存的。
179,ウェルキス,魔族を専門として戦う戦士は\n多ければ多いほどいいからな。,毕竟专攻魔族的战士越多越好。
180,ミィキス,私達はアーモン家の第77世代。\n昔から魔族との戦いの\n最前線に立ってきたの。,我们是亚蒙家的第77代，\n我们一族自古以来\n就冲在与魔族作战的第一线。
181,ビィ/碧,な、77世代って……！\nしかも他に18人もいるんだろ？,7、77代……！\n而且像你们这样的还有18人？
182,ウェルキス,他の18人は死んだ。\n魔族に殺されたんだ。,其他18人都死了。\n死在了与魔族的战斗中。
info,,,scene_pt02_cp005_q2_s10
译者,,,雨降星