id,name,text,trans
0-chapter_name,,第2話 承環,第2话 承环
0-synopsis,,ピィジウとウルキは情報を共有しに一行のもとへ帰還する。状況を打破する方法として太上老君による歴史改変を告げるが、コクは反対する。しかしピィジウに説得され、コクは一行と共に赤き地平へ向かうことに決めるのだった。,啤酒和乌露琪回到其他人身边共享情报。他们告知了借助太上老君改变历史的方案，打算以此打破僵局，但蔻刻表示反对。不过，在啤酒的劝说下，蔻刻决定与众人一同前往赤色地平。
1,コク,却下だぁぁぁぁっ！！,我反对啊啊啊啊！！
2,,ウルキとピィジウは龍央の孤島から\n帰還すると、先祖の記憶から得た情報を\n一行に共有する。,乌露琪和啤酒从龙央的孤岛归来，将从祖先记忆中获得的情报与其余人共享。
3,,その結果、スェンを殺せば事態が\n解決する可能性があるものの\nピィジウとコクも消えると知り──,众人得知，虽然杀死司文就有可能解决事态，但啤酒与蔻刻也会随之消失──
4,コク,<span class='scene-font-4'>なぜこのコク様がぁ！！</span>\n劣等種のために消えねばならんのだ！,<span class='scene-font-4'>凭什么蔻刻大人我！！</span>\n非得为了劣等种消失不可！
5,,コクは激しく拒否し、\n暴れはじめていた。,蔻刻强烈反对，闹了起来。
6,コク,消えるならクソ鬣！\n貴様だけにしろっ！！,想消失的话，死长毛，你自己消失就够了！！
7,コク,なぜ当然のごとく\n我を道連れにする！！,为何如此理所当然地想把我也拖下水！！
8,コク,そもそも我が誕生した時も……！\n力を奪いやがって……！！,说起来我诞生的时候也是……！\n就是你夺走了我的力量……！！
9,ピィジウ,当然。己と汝は\n一蓮托生の災害よ。共に繋がった\n存在故、共に消えるべし。,当然。你我乃是同生共死的灾害。\n既然命运相连，自当一同消失。
10,コク,貴様と一蓮托生など、断じて認めん！,谁要和你同生共死，我绝不承认！
11,ピィジウ,すまないな。\nコクよ。,抱歉了啊，蔻刻。
12,コク,変えぬと言うのなら、今ここで……！,若你执意不改，那就在这里……！
15,チチリ,<span class='scene-font-4'>ちょ、ちょちょちょ！？</span>\n落ち着いて！,<span class='scene-font-4'>等、等一下！？</span>\n冷静点！
16,アミ,暴れるだけ無駄だ。\nピィジウを殺したら、\nボク達もろとも君も死ぬんだぞ。,你要闹也没用。杀了啤酒的话，我们和你也会一起死掉。
17,アミ,それに、ピィジウが簡単に死ねるのなら\nそもそもこんな厄介なことには\nなっていない。,而且，如果啤酒会那么轻易死掉，事情从一开始就不会变得这么复杂了。
18,コク,<span class='scene-font-4'>黙れ黙れ黙れぇっ！</span>\n貴様らに弄ばれるのは、\nもう我慢の限界だッ！,<span class='scene-font-4'>闭嘴闭嘴闭嘴！</span>\n我已经受够被你们这些家伙摆布了！
21,ビィ/碧,うわっ……\nコク、本気みてぇだ……\nはやく止めねぇと！！,哇啊……蔻刻看起来是认真的……\n得快点阻止他！！
22,,姬塔は頷き、\nすぐにコクを止めようとするが──,姬塔点了点头，连忙出手阻止蔻刻──
27,コク,ぐっ、うぅぅっぅ……！！,唔、呜呜呜……！！
30,,何故かコクは唐突に動きを止め、\nその場に突っ伏した。,但不知为何，蔻刻突然停止了动作，直接趴倒\n在地。
31,チチリ,あれ……？　だ、大丈夫？\nコクくんちゃんさん様～……？,咦……？没、没事吧？蔻刻君酱大人～……？
32,コク,う、うるさい……\nうるさいうるさいうるさい……,烦、烦死了……\n烦死了烦死了烦死了……
33,ピィジウ,力が出せぬか。\n我が半身よ。,使不出力量了吗。我的半身啊。
34,ピィジウ,見たところ……何をきっかけかは\n計り知れぬが、黒麒麟の力が\nその身に宿りつつあるな。,在我看来……虽不知缘由为何，黑麒麟的力量正逐渐寄宿在你身上。
35,ピィジウ,然れど、その力は使えぬ。\n相違は。,然而，你却无法使用它的力量。没错吧。
36,コク,し、知った口をきくなぁ……,少、少在那自以为是了……
37,コク,（こいつにだけはバレてたまるか……\nコク様が誰かのためでないと、\nまともに力を使えんなどと……）,（岂能被这家伙看穿……本蔻刻大人若非为了他人，便无法正常使用力量，这种事……）
38,コク,クソ……ッ！　何故だ！\n何故、生まれただけなのに……,可恶……！为什么！\n为什么，我仅仅只是诞生……
39,コク,死なばならん……！！,就必须去死……！！
40,シュシュク,コク……,蔻刻……
41,コク,しかも劣等種どものために……\nぐぐぐ、ぅぅぅぅ……,而且还是为了劣等种……唔唔、呜呜呜……
42,シュシュク,大丈夫だ、コク！\nコクが消える作戦なんか、\nするわけないぞ。,你放心吧，蔻刻！如果是会导致你消失的计划，我们才不会实行呢。
43,ルリア/露莉亚,はい……！\nピィジウさんだって……\nいなくなったら嫌です！,是的……！啤酒也一样……你会消失的话，\n我们也不愿意！
44,ビィ/碧,それに殺す……なんてさ。\nほかにもっと方法はねぇのか……？,而且杀人……什么的。难道就没有其他更好的方法了吗……？
45,ピィジウ,他に術がなければ致し方なし。\n然れど、安心せよ。\n手を汚すのは己のみでよい。,若别无他法则也无可奈何。\n不过各位放心。弄脏手的只需我一人即可。
46,ビィ/碧,いや、そういう問題じゃ……\nお前が手を汚すことも\nオイラ達嫌なんだけども。,不，不是这个问题……而且我们也不乐意看到你弄脏手啊。
47,ビィ/碧,絶対嫌な思いするだろ、お前……\nそんな気持ちを抱いた挙句\n消えるかもしれねぇなんて……,你心里肯定也不好受吧……一直以来都是那种心情，结果还是可能会消失啊……
48,ルリア/露莉亚,はい……\nダメです、そんなの……,是的……那样怎么可以……
49,ピィジウ,…………,…………
50,ウルキ,ふふふ、ほら、\nみんなもうキミのこと\n大切なんだよ～,呵呵呵，你看，大家已经把你当作很重要的人了～
51,ウルキ,でもね、大丈夫。\nウルちゃんと約束したもんね～,但是呢，没关系的，因为啤酒和乌露约定好了嘛～
52,チチリ,約束？\nどんな約束したの？,约定？约定了什么？
53,ウルキ,ピィジウもコクくんちゃんさん様も\n消えちゃうなら\n絶対にこの策は無しって。,如果啤酒和蔻刻君酱大人都会消失的话，\n就绝对不采用这个方法。
54,コク,そ、そうだったのか……？,是、是这样吗……？
55,ウルキ,うん、でもまずは\n本当に太上老君がいるかどうか\n確かめるのが大事だと思う。,嗯，但是我觉得首先应该去确认太上老君是否真的存在，这才是最重要的。
56,ウルキ,だからとりあえず\nみんなで太上老君に会いに行こ～？,所以总之，大家一起去见太上老君吧～？
57,ウルキ,スェンの命を奪う以外の方法も、\n見つかるかもしれないし……,或许也能找到杀死司文之外的方法……
58,アミ,会って話を聞くだけなら賛成だ。\nえと……コクくんちゃんさん様。,只是去拜访并询问的话我赞成。\n那个……蔻刻君酱大人。
59,コク,青竜の、\n貴様まで我を馬鹿にするのか……,青龙，连你这家伙也要戏弄我吗……
60,コク,だがな。そこのクソ鬣が\n約束を守るとは思えん。,不过呢，我可不觉得那边的死长毛会遵守\n约定。
61,ピィジウ,本音を口にすれば、己と\nコクの犠牲だけで済むのならば\n試すべきと信じている。,说实话，若只需牺牲我与蔻刻便能解决，\n我认为值得一试。
62,コク,<span class='scene-font-4'>おい玄武の！！</span>\nこいつ道連れにする気満々だぞ！\n監督不行き届きだ！！,<span class='scene-font-4'>喂玄武！！</span>\n你看这家伙满心想着要拉我陪葬呢！\n你监管不力！！
63,ウルキ,ピ、ピィジウ～……,啤、啤酒～……
64,ピィジウ,そう嘆くな。\nあくまで最終手段よ。,不必叹息。这只是最后手段。
65,ピィジウ,コクも本音は……\nやぶさかではないのだろう。,要论蔻刻的本心……也并非完全不情愿吧。
66,コク,はぁ？！？！？！？？\n我の何をみてそう思った！？,啊？！？！？！？？\n我怎么会让你产生这种想法！？
67,,今にも殴りかかってきそうなコクに\nピィジウはそっと耳打ちをした。,对着眼看就要扑上来揍人的蔻刻，啤酒轻声耳语了几句。
68,ピィジウ,汝も愛着を持っているだろう。\n人の子に。シュシュクに。,你也有所眷恋了吧。对那些人子。对秀秀珂。
69,コク,～～～ッ。\n貴様ぁ……,～～～唔。\n你这家伙……
70,ピィジウ,仮面は正直故。\n隠し立ては無用よ。,面具是诚实的。无需隐瞒了。
71,コク,…………,…………
72,ピィジウ,己らの犠牲は最終手段。\nだがその時は……ともに逝こう。\n我が子らを、守るため。,我等的牺牲乃是最终手段。但真到那时……\n便一同逝去吧。为了守护我的孩子们。
73,コク,ゆかんわっ！\nええい、離れろ！！\n近いわ、クソ鬣！,我才不干啊！哎，离我远点！！\n你凑太近了，死长毛！
74,ルリア/露莉亚,え、えっと……？,呃、那个……？
75,コク,行くだけ行ってやる。\n試すかどうかさておきな。,去就去呗。至于要不要尝试另说。
76,ウルキ,コクくんちゃんさん様……！\nありがとう～！,蔻刻君酱大人……！谢谢你～！
77,コク,くっ……で、どう行くんだ。\n赤き地平なんぞ行けるのか。,咳……那，要怎么去？赤色地平那种地方能去得了吗？
78,チチリ,そうだよねぇ。あまりアタシは\n詳しくないんだけど……\n空の底、なんだよね？,说的也是呢。我不太清楚呢……那是天空的底部，对吧？
79,アミ,艇でただ突っ込んでも、\n死ぬだけだろうな。,就算驾艇直接冲进去，也只会送死吧。
80,ビィ/碧,浮力消失高度があるからな……\n普通にいったら墜落しちまう。,因为有浮力消失高度啊……用普通的方法过去会坠毁的。
81,シュシュク,じゃあ近くまで行って、\n艇から飛び降りれば\n着地はできるのではないか？,那么我们到达附近，再从艇上跳下去的话，是不是就能着陆了？
82,ビィ/碧,そういや……お前会った時も\n艇から飛び降りてたな……,说起来……和你相遇的时候你也是从艇上跳下来的呢……
83,チチリ,シュシュクちゃん、\n今は真面目な話をしてるからね～♡,秀秀珂，我们现在在谈正经事哦～♡
84,シュシュク,大真面目だが！？,我是认真的啊！？
85,ピィジウ,ふむ。,唔。
87,,ピィジウは首を傾げながら\n「扉」を作って見せる。,啤酒若有所思地创造了一扇「门」。
88,ピィジウ,己が作る扉を使えば、\n直ぐにでも行けよう。,使用我所创造的门，应该能够立刻前往。
89,ビィ/碧,あ、赤き地平にか！？\nそんな簡単に……,啊，是去赤色地平哎！？\n这么简单就……
90,コク,おい、待て。\nそんな権能はないだろう。,喂，等等。你应该没有那种权能才对。
91,ピィジウ,然り。赤き地平そのものに\n扉を繋げることは不可能だ。,诚然如此。将门直接连接至赤色地平本身确无可能。
92,コク,ならばこの扉はなんだ！！\n赤き地平に行けると\nついさっき言ったのは貴様だぞ！,那这门是什么！！刚才说能去赤色地平的不就是你吗！
93,ピィジウ,焦るな。確かに赤き地平\nそのものには扉は繋がらぬ。,莫要慌张。门确实无法连通至赤色地平本身。
94,ピィジウ,然れど扉は開かれた。\n太上老君が座する地へ。\n……何故だろうな。,然而门却开启了。通往太上老君坐落之地。……为何呢。
96,,ピィジウは首を傾げながら\n扉を潜って消えていく。,啤酒一边思索，径直穿过门消失。
97,コク,ま、待てぇ！！,等、等一下！！
98,,一行はコクと共に\nその後を追っていく。,一行人紧随蔻刻一同追了上去。
info,,,scene_evt251029_cp2_q3_s10
译者,,,朔夜Rei