id,name,text,trans
0-chapter_name,,終わりの始まり,终之始
0-synopsis,,シヴァはかつてトリプラ群島で起きた厄災を祓い、マハーデーヴァという名で崇められた存在だった。厄災の正体とは幽世の存在であり、ターラカの怨念がこの事態を引き起こしているという。事情を知った一行のもとに、幽世の瘴気に侵され自我を失った星晶獣が現れる。それはシヴァの弟子・パラシュラーマだった。シヴァは浄化の炎でパラシュラーマを瘴気から解放すると、一行と共に一度屋内に避難するのだった。,湿婆驱除了曾经发生在特里普拉群岛的灾难，被尊称为摩诃提婆。灾难实际由幽世的存在引起，陀罗迦的怨念导致了这一事态的发生。一行人刚刚得知真相，便遇见了被幽世瘴气侵蚀而失去自我的星晶兽。那是湿婆的弟子婆罗娑罗摩。湿婆用净化之焰把婆罗娑罗摩从瘴气中解放出来，然后和一行人前往房屋内避难。
1,ビィ/碧,全部が死ぬって……\nそのアスラってのは、\n一体なんなんだ？,全部都会死掉……那个阿修罗，到底是什么?
2,,『この状況が続けば\n全ての者が死に絶え、\nこの世は混沌に支配される』,『如果这种状况持续下去，所有人都会死亡，这个世界将会被混沌所支配』
3,,シヴァが語った事実に衝撃を\n受けながら、ビィは浮かんだ疑問を\n口にする。,碧因湿婆说出的事实而感到冲击，一边说出浮现在脑海中的疑问。
4,シヴァ/湿婆,アスラ、という存在は\n古きものの名だ。,阿修罗是一个古老的名字。
5,シヴァ/湿婆,地の底に蔓延る者。混沌の化身。\n死と絶望の概念。今の人の子らは、\nあれを<span class='scene-font-spword'>幽世</span>と呼ぶのだったか。,游荡地底之人。混沌的化身。死亡与绝望的概念。我记得如今的人子，是称之为<span class='scene-font-spword'>幽世</span>。
6,ビィ/碧,<span class='scene-font-4'>幽世だって！？</span>\nじゃあ、この街に溢れてるあの魔物は\n全部幽世の存在なのか？,<span class='scene-font-4'>幽世！？</span> 那么，这座城市里的魔兽全都是幽世的存在?
7,シヴァ/湿婆,今この地に蔓延っているものは\n厳密には異なるが、\n概ね同じものであると言える。,现在肆虐在这片土地上的东西严格来说有所不同，但总体来说是相同的。
8,シヴァ/湿婆,……半月ほど前だったか。\n我は、人の子らの救いを求める声を聞き\nこの地を訪れた。,……大概是半个月前。我听见人子求救的声音，便来到这地。
9,シヴァ/湿婆,その時、島の中心地より\n強大なアスラの気配を感じ、\nそれを排除しようとしたが……,此时，我感觉到了岛中心方向传来强大的阿修罗的气息，打算将其排除……
10,シヴァ/湿婆,我が浄化するよりも早く、\nあれらは人の命を喰らい\n侵食の根を広げていった。,但还没来得及净化，它们已经吞噬了人类的生命，扩大了侵蚀的根源。
11,シヴァ/湿婆,それが、今の状況だ。,成了现在的情况。
12,ルリア/露莉亚,それじゃあ、シヴァさんは\n私達がここに来るよりも先に\nこの島に来ていたんですね。,这么说，湿婆先生在我们到达这里之前就已经来到这个岛上了。
13,シヴァ/湿婆,然り。\n我はかつて、この地で同様の\n厄災を祓い浄化したことがある。,没错。我曾经在这片土地上驱除和净化过同样的灾难。
16,,その話を聞き、脳裏に蘇ったのは\n老婆が語り聞かせてくれた\nマハーデーヴァについての話だった。,听到这个故事，一行人脑海里浮现出老婆婆所说的摩诃提婆的故事。
19,ルリア/露莉亚,それじゃあ、この島の人達が言ってた\nマハーデーヴァさんって\nシヴァさんだったんですか……！？,那么，这个岛上的人所说的摩诃提婆就是湿婆先生吗……! ?
20,シヴァ/湿婆,む？　懐かしい名であるな。\nその名で呼ばれていた時代もあったが、\nまだこの地に残っていたのだな。,嗯?真是个令人怀念的名字。我确实有以这个名字被称呼的时代，没想到现今仍然留在这片土地上。
21,シヴァ/湿婆,だが、以前我が収めたそれよりも、\n今起きているこの厄災は\n余程深刻である。,但是，现在发生的这场灾难，比以前我所解决的还要严重得多。
22,ルリア/露莉亚,えっと……\nどういうことですか？,嗯……这是怎么回事?
23,シヴァ/湿婆,この事態を引き起こしているのは、\nターラカが遺せし執着と恨みの念だ。,造成这种局面的，是陀罗迦留下的执著和怨恨。
24,シヴァ/湿婆,死者が遺した念とは、生者のそれよりも\n昏く、重く、そして根深いもの。\n今もなお、この地を呪い続けるほどに。,死者留下的执念，比生者更昏暗、更沉重、更根深蒂固。直到现在还在诅咒这片土地。
25,シヴァ/湿婆,地上のアスラを幾ら祓えど、\n根が残り続ける限り\n何度でも同じことが起きる。,无论驱除多少地上的阿修罗，只要根还在，无论多少次都会发生同样的事情。
26,シヴァ/湿婆,これは、目に見えるものではない。\n大気に、大地に、命の中に潜む全ての\n根を排除しなければならぬのだ。,那不是肉眼能见的存在。我们必须清除所有潜藏在大气、大地和生命中的祸根。
27,ビィ/碧,なっ……！？\nそれじゃあ、島だけじゃなく、\n住人も助けられないってことかよ！？,什么……!? 这么说来，不只是岛屿，连居民也救不了喽!?
28,,やや怒りを含ませた声を上げるビィに、\nシヴァはしばしの沈黙の後、\n記憶を辿るように遠くを見つめる。,碧的声音里带着些许愤怒。湿婆沉默了一会儿，然后回忆似的看着远方。
29,シヴァ/湿婆,……かつての厄災の折、\nアスラを駆逐するために\n我が鍛えた弓がある。,……在曾经的灾难时刻，为了驱逐阿修罗，我锻造了一把弓。
30,シヴァ/湿婆,その弓は、この地を守っていた\n我が同族の核を素材とし、人々の祈りを\n紡いで作り上げた悪滅の弓。,那把弓是以守护这片土地的我们同族的核心为素材，由人们的祈祷而制成的恶灭之弓。
31,シヴァ/湿婆,この状況を解決する\nひとつの手段として、\nその弓の力があれば或いは……,为了解决现在的情况，若那把弓的力量的话还有可能……
32,ビィ/碧,おお……！\nそれじゃあ、さっさとその弓で\nあの魔物達を追っ払おうぜ！,噢噢……!现在，让我们用弓把那些怪物赶走吧!
33,シヴァ/湿婆,いや、その弓は今──,不，那把弓现在……
35,,その時、周囲に建物が崩れる\n大きな音が響き渡る。,这时，周围响起了建筑物倒塌的巨大声响。
36,,同時に聞こえてきた人々の悲鳴に\n顔を見合わせた姬塔達は、\n急いで悲鳴のした方へ向かう。,同时也传来的人们的惨叫声。姬塔等人面面相觑，急忙朝着惨叫声的方向赶去。
41,？？？,ウゥ…………,呜…………
42,ビィ/碧,な、なんだあいつ……！？,那、那家伙怎么了……! ?
43,,駆け付けた一行が見たものは、\n瓦礫の上からこちらを見下ろす\nひとつの影。,赶到现场的一行人所看到的，是从瓦砾上俯视众人的身影。
44,ルリア/露莉亚,あの人……星晶獣です！\nすごく苦しんでいて……消えそうな\n自分を必死に繋ぎとめてる……,那个人……是星晶兽!非常痛苦……拼命维系着快要消失的自己……
45,シヴァ/湿婆,ふむ……\n完全に堕ちたわけではないか。\nならば、まだ手の施しようはある。,唔……没有完全堕落吗。那我们还有办法。
46,シヴァ/湿婆,我が信徒よ。体のどこかにあれを\n蝕む種があるはずだ。それを砕けば、\n我が焔で浄化出来よう。,我的信徒啊。在他身体的某个部位一定有侵蚀他的种子。若将其击碎，便可以用我的火焰进行净化。
47,,そう言って焔を纏うシヴァに、\n影が微かな反応を見せた。,说着，影子对燃起火焰的湿婆有了微弱的反应。
48,？？？,……ゥ、ア……？\nワレ、ハ……チカイ、ヲ……,……呜、婆……?我……犯下……
49,ビィ/碧,なんだ？\nあいつ、何かブツブツ言って……,怎么了?那家伙在嘟囔些什么……
50,？？？,ウゥゥ……！\n<span class='scene-font-4'>アァァァァァッ！</span>,呜呜……!<span class='scene-font-4'>啊啊啊啊！</span>
51,シヴァ/湿婆,ッ！\n構えよ！,准战斗备!
53,,苦しげに呻いたかと思えば、\n咆哮を上げて姬塔へと\n襲い掛かる影。,那身影痛苦地呻吟了一声，便咆哮着向姬塔袭来。
55,,咄嗟に剣で攻撃を受け止めたものの、\nその力は凄まじく姬塔は\n勢いのまま吹き飛ばされる。,虽然立即用剑挡住了攻击，那力量却异常惊人，姬塔就这样被击飞了。
56,？？？,オォォォォォッ！！,哦哦哦哦哦! !
57,,なんとか立ち上がろうと顔を上げた\n姬塔の眼前には、\n既に斧が迫っていた。,姬塔才刚抬起头准备爬起来，已经看见一把斧子近在眼前。
59,？？？,グゥ……ッ！！,呜……! !
60,シヴァ/湿婆,我が信徒の魂を穢すことは、\n我が許さん。,我不允许你玷污我信徒的灵魂。
61,？？？,ウゥゥゥ……ッ！！,呜呜……! !
62,,シヴァの放った劫火によって\n拘束された影は、低い呻き声を\n上げながら抵抗を見せる。,被湿婆放出的劫火束缚住的人影发出低沉的呻吟，想要挣脱。
69,,藻掻く影の中央──丁度胸のあたりに、\n禍々しい光を放つ何かを見つけた\n姬塔は迷いなく貫いた。,挣扎的人影正中── 恰好在胸口附近，姬塔发现了散发不祥光芒的什么，毫不犹豫地贯穿了它。
70,？？？,ガァァァァァッ！,啊啊啊啊啊啊!
71,,その瞬間、影が悲鳴を上げ\n周囲に黒い霧のようなものが\n吹きあがる。,一瞬间，影子发出了惨叫，周围吹起一阵黑雾。
72,シヴァ/湿婆,我が浄化の焔は、\n全ての穢れを\n焼き尽くすまで決して消えぬ。,我的净化之焰，在烧尽一切污秽之前绝不会熄灭。
73,シヴァ/湿婆,汝の穢れが魂まで\n及んでいたならば……\n残るのは灰のみだ。,如果污秽已经蔓延至你的灵魂……那么剩下的只有灰烬。
74,,シヴァの言葉を聞き、\nビィと姬塔も\n固唾を呑んで見守る。,听到湿婆说这话，碧和姬塔也屏息注视着。
79,,永遠にも思える時間が経ち、\n次第に焔の勢いが弱まって来た頃。,仿佛经过了永恒的时间，火焰的势头终于逐渐减弱。
82,シヴァ/湿婆,……ほう、人の形を保っているか。\nどうやら間に合ったようだな。,……嗬，还保持着人形吗。看来我们及时赶到了。
83,？？？,う……\n我、は……,唔……我、我……
84,？？？,……マハーデーヴァ様……？,……摩诃提婆大人……?
85,シヴァ/湿婆,……！\nパラシュラーマ……？,……!婆罗娑罗摩……?
88,,焔の中から現れたその人物は、\nシヴァを見て微かに呟くと\n力尽きたように倒れこんでしまう。,从火焰中出现的那人看着湿婆，微微嘀咕了一声，就像用尽了力气一样倒了下去。
89,ルリア/露莉亚,だ、大丈夫ですか！？,没、没事吧! ?
91,,ルリアと共に慌てて駆け寄ると、\nその人物は気を失っているようで\n微動だにしない。,姬塔和露莉亚一起慌忙跑过去，那人似乎昏过去了，一动也不动。
92,ビィ/碧,なぁ、シヴァ……\nこいつ、もしかして\n知り合いなのか？,我说，湿婆……这家伙，难道你认识?
93,シヴァ/湿婆,……ああ。\nかつて、我が弟子であり、\n敬虔なる信徒のひとりであった。,……嗯。他曾是我的弟子，也是虔诚的信徒之一。
94,シヴァ/湿婆,だが……,但是……
95,,そこまで言って、シヴァは一度\n思案するように口を閉ざすと\n小さく頭を振った。,说到这里，湿婆沉思了一下，闭上嘴轻轻摇了摇头。
96,シヴァ/湿婆,……ひとまず、この者を連れ\nどこか安全な場所に\n身を潜めるとしよう。,……暂且先把他带到安全的地方藏身吧。
97,シヴァ/湿婆,いつ再びアスラに襲撃されるか\n分からぬ。それまでに、この者の\n目が覚めることを期待しよう。,不知道什么时候会再次遭到阿修罗的袭击。在那之前，让我们等他醒来。
98,,シヴァの提案に頷き、\n姬塔達は\n近くの小屋へと撤退するのだった。,姬塔他们点头同意，撤退到附近的小屋。
103,,影に取りつかれていた男──\nパラシュラーマを連れ、\n小屋へと撤退した一行。,带着被影子附身男人婆罗娑罗摩，一行人撤退到一座小屋内。
104,,男は未だに目は覚まさないものの、\n穏やかな様子に安堵しつつ\n姬塔はシヴァに声を掛けた。,男人虽然还没有醒来，但看到他平静的样子，姬塔放下心来，上前与湿婆搭话。
105,シヴァ/湿婆,ふむ……\n汝もその者について気になるか。,嗯……你也在意那个人吗。
106,シヴァ/湿婆,その者の名は<span class='scene-font-spword'>パラシュラーマ</span>という。\nかつて、このトリプラ群島に生まれし\n空の民であった。,他的名字叫<span class='scene-font-spword'>婆罗娑罗摩</span>。曾经是出生在这个特里普拉群岛的空之民。
107,ビィ/碧,空の民？\nでも、さっきルリアはこいつのこと\n星晶獣だって言ってたよな？,空之民?可是刚才露莉亚不是说这家伙是星晶兽吗?
108,ルリア/露莉亚,は、はい。\n今ははっきりとこの人から\n星晶獣の力を感じます。,是，是的。现在我能清楚地从这个人身上感受到星晶兽的力量。
109,シヴァ/湿婆,それについては我も分からぬ。\nだが、我の知る人物と同じであれば\n間違いなく人の子であった。,我不知道。但是，如果他就是我所认识的婆罗娑罗摩，那么无疑是人子。
110,シヴァ/湿婆,パラシュラーマが生を受けて間もなく、\nこの者の父である国王自ら\n我に報せを寄越したのだからな。,因为在婆罗娑罗摩人降生后不久，这个人的父亲，当时的国王亲自来向我报告了这个消息。
111,,パラシュラーマの故国は\nアスラの脅威に晒された際、\nシヴァによって救われていた。,婆罗娑罗摩的国家在受到阿修罗威胁时被湿婆拯救。
112,,それ故に、国の王族はシヴァを\n長年信仰しており、子が生まれる度に\nシヴァに報告していたという。,因此国家的王族长年信仰湿婆，每当有孩子降生都会向湿婆报告。
113,シヴァ/湿婆,パラシュラーマは、\nその父と同様に生まれた時から\n我の敬虔なる信徒であった。,婆罗娑罗摩和他的父亲一样，从出生起就是我虔诚的信徒。
114,シヴァ/湿婆,故に、我も目を掛けていたのだが……\nある日、突然「弟子にしてくれ」と\n我を訪ねてきたのだ。,因此，我也一直关注著他……有一天他突然来找我，说想成为我的弟子。
115,,その頃、既にトリプラ群島の国々は\nターラカによってアスラの侵攻を\n受け始めており……,那时，特里普拉群岛的各国都因陀罗迦而开始遭受阿修罗的入侵……
116,,パラシュラーマの故国も例外では無く、\n年々増えるアスラの怪物達によって\n多くの人々の命が失われていた。,婆罗娑罗摩的故国也不例外，阿修罗的数量逐年增加，很多人失去了生命。
117,シヴァ/湿婆,元々、これは幼き時分から武芸の才に\n恵まれていたが故に、自分の国や民を\n守りたいと思ったのであろう。,他自幼武艺高强，所以想保护自己的国家和百姓吧。
118,シヴァ/湿婆,敬虔なる信徒の願いとあらば\n叶えるのが我が役目。故に我は、\n彼の者を弟子として迎え入れたのだ。,他是我虔诚的信徒，那么实现他的愿望也是我的使命。所以我收他为徒。
119,シヴァ/湿婆,そして、かのターラカとの戦いに於いて\nこの者は人の身でありながら側近である\nアスラをひとりで打ち倒してみせた。,在与陀罗迦的战斗中，他以肉身击败了陀罗迦的亲信阿修罗。
120,シヴァ/湿婆,我はその功績を認め、\nこの者をトリプラ群島の守護者に任命し\nその証として弓を授けたのだ。,我承认他的功绩，任命他为特里普拉群岛的守护者，并授予他弓箭作为证明。
121,シヴァ/湿婆,アスラを屠るための武器……\n悪滅の弓、<span class='scene-font-spword'>「ヴィジャヤ」</span>を。,用来屠杀阿修罗的武器……恶灭之弓「维加亚」。
122,,過去を語り終えたシヴァは、\nやや険しい表情で眠ったままの\nパラシュラーマを見る。,说完这段过去，湿婆看着没有醒来的婆罗娑罗摩，表情有些严峻。
123,シヴァ/湿婆,しかし、ヴィジャヤは今、\nこの者の手に無いようだ。,但维加亚现在似乎不在他手里。
124,シヴァ/湿婆,ヴィジャヤは今どこにあるのか。\nそもそもこの者は、我の知る\nパラシュラーマと同一の者なのか？,维加亚现在在哪里。这个人和我所知道的婆罗娑罗摩是同一个人吗?
125,シヴァ/湿婆,全ては、この者の目が覚めれば\n分かることであろう。今はただ、\n体を休めその時を待つしかあるまい。,等他醒来就能明白了。现在也只有养精蓄锐，等待那一刻到来了。
126,,異変の中、突然現れた\nシヴァの弟子である男。,在异变中，湿婆的弟子突然出现。
127,,新たに生まれた疑問を抱きつつも、\n一行はパラシュラーマの\n目覚めを待つのだった。,抱着新的疑问，一行人等待婆罗娑罗摩的苏醒。
info,,,scene_ult_chr515_ep1_q2_s10
译者,,,煌月夜