id,name,text,trans
1,シヴァ/湿婆,我が信徒よ。\n汝にこれを授けよう。,我的信徒啊，我将此赐予你。
2,シヴァ/湿婆,我が加護の焔を灯した\nディーヤーだ。,点燃我加护之火的油灯。
3,シヴァ/湿婆,我が加護の焔は、何人も\n吹き消すことはかなわん。\nそして、如何なる邪悪をも遠ざけよう。,我的加护之火无人能灭。它能驱离所有邪恶。
4,シヴァ/湿婆,一夜の間、我が加護と共にあれ。\n汝が聖夜は、このシヴァの名のもとに\n祝福される。,我的加护将与你共度这个夜晚。你的平安夜由我湿婆给予祝福。
5,シヴァ/湿婆,人の子が望む安寧を授けるも、\n我の役目である。人の子にとって\n特別な夜となれば尚のこと。,赐予人子所希望的安宁，也是我的使命。更别说今晚对人子来说有特殊的意义。
6,シヴァ/湿婆,灯火がある限り、如何なるものも\n汝らの安寧を侵すことは出来ない。\n今宵は存分に楽しむが良い。,只要有这盏灯火，任何事物都不能侵扰你的安宁。尽情享受今晚吧。
info,,,scene_s4_christmas_3126_v1_0_2005_4_3040196000
译者,,,煌月夜