id,name,text,trans
0-chapter_name,,第1話 Pwr Lvl Chk.,第1话 Pwr Lvl Chk.
0-synopsis,,姬塔達は、ローナンに拠点の奥へ案内される。そこには、かつて組織が鹵獲した機神アリアネンサが保管されていた。バザラガのグロウノス、再建中のセスラカと合わせれば月への推進力に事足りる。しかしアリアネンサはコアの一部を失っており、暴走の危険が高いという。一行はアリアネンサのコアを探しつつ、アリアネンサと契約するグウィンを鍛えることになるのだった。,罗南带领姬塔一行人来到了据点内部。在这里保管着组织过去俘获的机神阿利安耐萨。和巴萨卡拉的古洛诺斯、再造中的赛斯拉卡加起来的话奔月的推进力就足够了。但是阿利安耐萨失去了一部分核心，暴走的危险极高。一行人决定一边寻找阿利安耐萨的核心，一边锻炼同阿利安耐萨签订契约的古茵。
1,ローナン,……皆、来たようだな。,……大伙，都来了啊。
2,,組織の拠点の奥にて、姬塔、\nマキラ、ビィ、ルリア、ユーステス、\nそしてイルザが招集された。,在组织据点内部，\n姬塔、玛琪拉、碧、露莉亚、尤斯缇斯、\n还有伊尔莎都应召而来。
3,ローナン,状況はどうだ？,情况如何？
4,ユーステス/尤斯缇斯,街の地形は把握した。\n万一の敵襲にも対応は可能だ。,我已经把握了周围的地形。\n敌人突击也可以应对。
5,イルザ/伊尔莎,イルザ隊、大部分が集結しました。\n現状、月へ向かうための騎空艇の建造に\n協力しています。,伊尔莎队大体都集结完毕。\n正协助建造奔月的骑空艇。
6,ローナン,わかった。\n皆、奥へ。,知道了。\n大家往里来。
7,,ローナンはうなずき、地下道の奥へと\n歩いていく。,罗南点了点头，\n朝地下通道深处走去。
9,ビィ/碧,……改まって話って、\nなんなんだ？,……又会是什么事？
10,ルリア/露莉亚,ユーステスさんは\n聞かされてるんですよね？,尤斯缇斯你知道吗？
11,ユーステス/尤斯缇斯,ああ。,啊嗯。
12,マキラ/玛琪拉,私達が呼ばれたって事は、\nもしかして……,叫上我们，该不会是……
13,ユーステス/尤斯缇斯,…………,…………
14,,何も言わず\nその後を行くユーステスの背中を\n姬塔達は追う。,姬塔们追着一言不发地\n跟着罗南的尤斯缇斯。
15,イルザ/伊尔莎,この奥に何が？,里面有什么？
16,ローナン,見せたいものがある。,我有东西要给你们看。
18,機神,────……,────……
19,イルザ/伊尔莎,これは……！,这是……！
20,ローナン,イルザは見覚えがあるだろう。\n機神アリアネンサだ。,伊尔莎肯定有印象。\n这是机神阿利安耐萨。
21,ビィ/碧,<span class='scene-font-4'>はぁ！？</span>\nなんでそんなモンが\nここにあるってんだよ？,<span class='scene-font-4'>啥！？</span>\n为什么这东西会在这里？
22,ローナン,かつて敵との戦いで鹵獲した。\n組織の本拠地に保管されていたものが\n先のゴタゴタで紛失してな。,之前和敌人的战斗中俘获的。\n虽然被保管在组织的总部，\n但因为上次纷乱而遗失了。
23,ローナン,ユーステスが手を尽くし、\nようやく回収できたのだ。,尤斯缇斯想尽办法，\n终于回收了它。
24,ユーステス/尤斯缇斯,…………,…………
25,イルザ/伊尔莎,再建中のセスラカ、\nバザラガとともにあるグロウノス、\nそして……,重造中的赛斯拉卡、\n和巴萨拉卡同在的古洛诺斯，\n还有……
26,マキラ/玛琪拉,これを合わせれば３体、ですね……,加上这台就是三台了吧……
27,ローナン,月へ行く推進力はこれで揃ったと\nお前達に伝えておく。,我是想告诉你们，\n前往月球的推进力足够了。
28,イルザ/伊尔莎,それで、契約者候補のグウィンを\nこの拠点に召喚せよと\n仰ったのですか。,所以你才说把契约者候补的古茵\n也叫到据点来啊。
29,ユーステス/尤斯缇斯,ああ。だがまだ奴には言うな。,嗯。不过暂时不要告诉她。
30,ローナン,調査報告書によれば、アリアネンサは\nコアの一部を失っており、\n暴走の危険が極めて高いとある。,不过调查报告显示，\n阿利安耐萨失去了一部分核心，\n暴走的危险极大。
31,ユーステス/尤斯缇斯,これを呼び出した「敵」のひとりが\n俺達の前で封印武器に食われただろう。,叫出这家伙的一个“敌人”\n在我们的面前被封印武器吞了吧。
32,イルザ/伊尔莎,……なるほど。\nまだグウィンに\n触らせるわけにはいかんな。,……原来是这样。\n所以还不能让古茵接触到它。
33,ローナン,……本来であれば無事な封印武器を持つ\nゼタ、イルザ、ユーステスのいずれかに\n任せたいところではあったが。,……原本是想交给拿着\n无危险的封印武器的泽塔、伊尔莎，\n或是尤斯缇斯来操作的。
34,ローナン,アルベスもニバスも機神化の兆しはなく\nフラメクは覚醒と呼ばれる\n状態にも至っていない。,阿尔贝斯和尼巴斯都没有机神化的征兆。\n弗拉梅克甚至都没有达到觉醒的状态。
35,ユーステス/尤斯缇斯,…………,…………
36,ローナン,武器との多重契約が及ぼす影響を\n調べている時間もない。,也没有时间去调查\n和武器的多重契约会造成的影响。
37,ローナン,機神化の実績を持つアリアネンサを\nあの候補者に託すほか、\n現状は手がなくてな。,现在除了把机神化过的\n阿利安耐萨交给候补者，\n也没有其他的办法了。
38,ユーステス/尤斯缇斯,月へ向かえる日は周期的に訪れる。\n出発はこの機神のコアと\nセスラカの制御が揃ってからだ。,能够前往月球的日子会周期性到来。\n等这台机神的核心集齐\n且能够控制赛斯拉卡之后再出发。
39,ユーステス/尤斯缇斯,それまであの半人前を鍛え、ついでに\n無茶をしないよう見張っておけ。,在那之前好好锻炼那个半吊子，\n顺便看着点别让她乱来。
40,イルザ/伊尔莎,了解した。,了解了。
41,ユーステス/尤斯缇斯,姬塔達も、\n見ていてくれるか。,也拜托姬塔你们帮忙看着了。
42,ビィ/碧,ああ。構わねえぜ！,没关系！
43,ビィ/碧,……っても、ファラ達の仕事手伝ったり\n色々あるから片手間になっちまうけど。,不过……又要帮法拉她们干活，\n还要做其他事情，\n可能也要空闲的时候才能了。
44,ユーステス/尤斯缇斯,それでいい。,足够了。
45,マキラ/玛琪拉,あの、アリアネンサを\nちょっと見てっていいですか？\n艇に積みこむ参考までに。,能让我稍微看看阿利安耐萨吗？\n我想用来做飞艇组装的参考。
46,ローナン,ああ。しかし、触れんように\n気を付けてくれ。,可以，\n不过注意别碰到它。
47,,そうして、姬塔達は\nローナンの格納庫を後にした。,之后姬塔一行人离开了罗南的仓库。
48,ユーステス/尤斯缇斯,あの半人前、見どころは？,那个半吊子有什么长处？
49,イルザ/伊尔莎,成績は優秀だ。\n……アリアネンサとの戦いで\n戦死したレスターの次にな。,成绩很优秀。\n……仅次于与阿利安耐萨一战中\n战死的雷斯塔。
50,ユーステス/尤斯缇斯,そうか。,是吗。
53,グウィン,ベア先輩！\n自分にだって、戦う理由があるんです！\n親元離れて訓練続けたのだって……！,贝阿前辈！\n我有自己战斗的理由！\n离开了父母身边来训练的也是……！
56,ユーステス/尤斯缇斯,…………,…………
57,ユーステス/尤斯缇斯,奴が何を目的に戦う気か知らんが、\n焦ってまた騒ぎ始めたら俺に言え。,她的斗志来自哪里我不知道，\n要是又暴躁了就来和我说。
58,イルザ/伊尔莎,憎まれ役を引き受ける気か？,你准备做个讨人嫌的角色？
59,ユーステス/尤斯缇斯,ああ。その後はお前が上手く収めろ。,是的。之后就由你来收场了。
60,イルザ/伊尔莎,わざわざ首を突っ込むとは珍しい。,你自己主动插手还真是少见。
61,ユーステス/尤斯缇斯,月の思惑を妨害するためだ。\nほかに手がない以上、奴を失えん。,为了干扰月球的想法。\n既然没有其他办法，就不能失去她。
62,,ユーステスの頭の中で、\n自らの成すべき事とその手順は\n組みあがっていた。,尤斯缇斯的脑中\n已经清楚地构筑出了\n自己必须要做的事情及其步骤。
63,,その思索の中で、\n不意に頭をよぎる光景──,在思索中，\n不经意涌上心头的那个场景──
66,ユーステス/尤斯缇斯,（封印武器は──）,（封印武器——）
67,ユーステス/尤斯缇斯,（それぞれの使い手とともに変化し\n得体のしれない力を振るう事がある。\nその姿を、俺は何度も見てきた）,（和各自的使用者一起变化，\n发挥出来路不明的力量。\n这样的事我见过好几次。）
70,ユーステス/尤斯缇斯,（……フラメクは何を待っている？）,（……弗拉梅克在等什么？）
71,,その胸にくすぶる静かな熱を感じながら\nユーステスは思索を巡らせる。,尤斯缇斯一边感受\n心中纠缠不休的静谧的热，\n一边思索着。
info,,,scene_evt210226_cp1_q2_s10
译者,,,灯泡马