id,name,text,trans
1,ネモネ/涅莫涅,ぬわーーー！！　大変だー！！<br>聞いておくれよ、姬塔！<br>ゾンビにかまれちったー！！,呜哇——————！！糟了——！！<br>听我说啊，姬塔！<br>我不小心被僵尸咬了——！！
2,ネモネ/涅莫涅,このままじゃゾンビになっちゃう～！<br>ネモ姉じゃなくて<br>ゾン姉になっちゃう～！,这样下去会变成僵尸的~！<br>那就不是涅莫姐姐，而是僵尸姐姐了~！
3,ネモネ/涅莫涅,うえーん、やだよー！,呜诶——不要啊——！
4,ネモネ/涅莫涅,おや、全く信じて頂けてない？<br>なるほど、わたしさんの日頃の行いが<br>悪いからですかね……,哎呀，你完全不信？<br>原来如此，因为我平时表现太恶劣了吗……
5,ネモネ/涅莫涅,つまりネモ姉はゾンビではなく……<br>オオカミ少年になってしまったわけだ！<br>狼姉だ！　にひひひっ♪,也就是说涅莫姐姐我不是变成僵尸姐姐……而是变成狼少年了吗！是狼姐姐呢！嘻嘻嘻嘻♪
6,ネモネ/涅莫涅,てーことでっ！<br>狼姉、いっきまぁーす♪<br>がっお～～～！,那么！狼姐姐我要上了哦♪<br>嗷呜~~~！
7,ネモネ/涅莫涅,お菓子くれないと、<br>身体中がぶがぶしちゃうぞー♪<br>がっお～～～♪,不给我糖果的话，<br>就让你全身咕噜咕噜哦——♪<br>嗷呜~~~♪
info,,,scene_s2_halloween_3061_v1_0_2004_2_3040085000
译者,,,