id,name,text,trans
0-chapter_name,,第2話 在りし日の記憶,第2话 往昔的记忆
0-synopsis,,ダルモアの民からの署名を目標数集めた一行はハイランド公王のもとを訪れる。ハイランド公王は約束通りガウェインの三国会談への参加を許可する。またガウェインの提案で姬塔一行も会談に出席することになる。その後一行はガウェインについて行きガウェインの両親の墓を訪れる。死んだ両親の墓石を前にして、ガウェインは両親の話を始めるのだった。,从达尔摩的民众征集到目标签名数的一行人造访了海兰德公王。海兰德公王依照约定许可了高文参加1三国会谈。又在高文的提议下，姬塔一行人也决定出席会谈。之后一行人跟着高文造访了高文双亲的墓。在死去双亲的墓碑前，高文开始讲述他双亲的故事。
11,,時は流れ、ついに約束の期日を迎えた\n姬塔一行は、ダルモア公国の\n玉座の間に集まっていた。,时间飞逝，很快约定之期便至。\n姬塔一行人聚集在\n达尔摩的王座之前。
12,ガウェイン/高文,ハイランド様、\nこちらが約束の署名になります。,海兰德大人，\n这便是约定的签名。
13,,ハイランド公王の御前に\n大量の署名を提出するガウェイン。,在海兰德公王的御前，\n高文交出了大量的签名。
14,ハイランド公王/海兰德公王,……おお！　まさか本当に\nこれだけの署名を集めてくるとはな。\n,……哦哦！　没想到你真的\n征集到了这么多签名。\n
15,ハイランド公王/海兰德公王,市中での振る舞いについては\n耳に入ってきていたぞ。\nよくやったな、ガウェイン。,我听说了你们\n在街市的作为。\n干得漂亮，高文。
16,ガウェイン/高文,決してひとりの力ではありません。,这绝非我一人能力所致。
18,姬塔達,…………,…………
19,ガウェイン/高文,仲間の協力があったからこそ\n成し遂げられました。,这是同伴齐心协力下\n才能完成的。
20,ハイランド公王/海兰德公王,ふむ……よもやお前から\n仲間などという言葉が聞けるとはな。,嗯……我没想到\n竟能从你的口中听到同伴二字。
21,フロレンス,陛下……,陛下……
22,フロレンス,約束通り、この署名をもって\nガウェインの三国会談への\n参加を認めていただけますね？,按照约定，既已征集到签名，\n陛下会允许高文\n参加三国会谈吧？
23,ハイランド公王/海兰德公王,ああ、認めざるを得ないな。,啊啊，这我不得不允许。
24,ハイランド公王/海兰德公王,なぁピートよ、\nお前も異論はないだろう？,是吧，皮特，\n你也没有异议吧？
25,ピート,……はい。,……是。
26,ピート,（くそっ……\nまさか本当に集めてきやがるとは）,（可恶……\n没想到他还真征集到了）
27,ピート,ですが、\nこれでガウェインの過去の過ちが\n消える訳ではありません。,但是，\n就算这样也不意味着\n高文过去犯下的错误就烟消云散了。
28,ピート,署名はダルモア国民の総意ではなく\nあくまで一部の者の意見ということを\nお忘れなく。,不要忘了签名\n不代表达尔摩国民全体的意见，\n只不过是一部分人的意见而已。
29,ハイランド公王/海兰德公王,うむ、肝に銘じておく。,嗯，我会铭记在心。
30,ピート,……では、\nこれにて失礼いたします。,……那么，\n我先告辞了。
32,,去り際に姬塔たちを\n睨みつけるピート。,皮特退下的时候\n死死瞪着姬塔等人。
33,ピート,（ガウェインのヤツに\n仲間ができたとは\n想定外だったな）,（高文那家伙\n竟有了同伴，\n真是出乎意料啊）
35,ハイランド公王/海兰德公王,ではガウェイン、\n当日はよろしく頼んだぞ。,那么高文，\n会谈当天就拜托你了。
36,ガウェイン/高文,御意。,领命。
37,,恭しく頭を垂れるガウェインは、\n改まった様子でハイランド公王に\n向き直る。,恭敬地垂下头的高文\n一本正经地再次\n面向海兰德公王。
38,ガウェイン/高文,最後にひとつお願いがあるのですが、\n聞いていただけますか？,我最后还有一个愿望，\n您能一听吗？
39,ハイランド公王,なんだ？　言ってみろ。,是什么？　说吧。
40,ガウェイン/高文,姬塔たちも\n三国会談に同席させては\nもらえませんでしょうか？,可以让\n姬塔等人也出席\n三国会谈吗？
41,ハイランド公王,なっ、そのような子供たちまで\n会談の場に同席させると言うのか？,什么，你是说让这样的孩子们\n也出席会谈吗？
42,ガウェイン/高文,はい。先ほども申しましたが、\nこの者たちの協力のおかげで\n今回の同席は許されたも同然です。,是的。正如我方才所说，\n我能够出席这次会谈\n可以说都是因为有他们协助。
43,ガウェイン/高文,それに、この者たちは\nただの子供ではありません。,而且，他们不只是\n孩子而已。
44,ガウェイン/高文,我らに恥をかかせるような\n真似は決してしないと\n俺の首をかけて誓います。,我用项上人头担保，\n他们绝不会做出任何\n令我们蒙羞之事。
45,フロレンス,陛下、\n私からも誓います。,陛下，\n我也发誓。
46,,ガウェインに合わせて\n進み出るフロレンス。,迎合高文，\n芙罗伦斯也进言道。
47,ハイランド公王,ふっ……お前たち姉弟を\nそこまで言わせるのなら、\nこれ以上は何も言うまい。,呼……你们姐弟\n说到这份上，\n我也没什么好说的了。
48,ハイランド公王,先方には、こちらの同席者が増えても\n問題はないか、事前に確認しておこう。,事先向另外两方确认好\n我们这边增加出席人数是否无碍。
49,ガウェインとフロレンス,はっ！\n有り難きお言葉。,是！\n感谢您的应允。
50,,こうして、ハイランド公王との\n謁見は無事に終わりを告げる。,就这样面见海兰德公王之行\n顺利结束了。
55,,玉座の間を後にしたガウェインたちは、\n道すがら先ほどの出来事について\n改めて話し始める。,离开御座之前，高文等人\n边走边说起\n方才之事。
56,ビィ/碧,やったなガウェイン！,做得好，高文！
57,ルリア/露莉亚,無事に参加が決まってよかったです！,能够顺利参加会谈真是太好了！
58,ガウェイン/高文,ああ、姬塔たちには\n感謝してもしきれないな。,啊啊，这必须感谢\n姬塔你们。
60,ルーソル,え～？\n僕への労いの言葉はないの？,诶～？\n就没有慰劳我的话吗？
61,ルーソル,噂によると、猫探しの後から\n依頼がたくさん来たんでしょ？,听闻传言，你们在找猫之后\n委托变多了吧？
62,,一行の前に突然姿を現した\nルーソルが、にやにやしながら\nガウェインに近寄ってくる。,突然出现在一行人面前的\n路索鲁笑盈盈地\n向高文走近。
63,ガウェイン/高文,まだ居たのか……\nまぁ、猫探しは良い契機には\nなったと思っている。,你还在啊……\n的确我也觉得\n找猫是个不错的契机。
64,ルーソル,ふふふっ……\n感謝の気持ちは言葉にしないと\n伝わらないよ？,呵呵呵……\n感激之情不付诸言语\n便不能传达给对方哟？
65,ルーソル,ったく、\nホント素直じゃ無いんだから\nガウェインくんはさ～,真是的，\n高文你还真是\n不率直呢～
66,ガウェイン/高文,貴様……調子に乗るなよ！,你这家伙…别得寸进尺了！
67,ルーソル,あはははっ！\nごめんごめん～！,啊哈哈哈！\n抱歉抱歉～！
68,ビィ/碧,でも、ガウェインとフロレンスが\nオイラたちまで一緒に連れて\n行きたいって言った時は驚いたよな～,不过高文和芙罗伦斯说\n要连我们一起都带去的时候，\n我还真是吓了一跳呢～
69,ガウェイン/高文,あれは成り行きだ。,那不过是顺势而为罢了。
70,フロレンス,ガウェインが切り出さなければ、\n私から伝えていました。,如果高文不说的话，\n我也会说的。
71,ルーソル,ほらほら！\n素直さ、忘れてるよガウェイン！,喂喂！\n高文你又忘了率直了！
72,ガウェイン/高文,うるさい！\n貴様は黙ってろ！,烦死了！\n你给我闭嘴！
73,ガウェイン/高文,それにいつまでついてくる気だ。\nまだ何か用があるのか？,而且你打算跟到何时。\n还有什么事吗？
74,ルーソル,はーいはい。\n言われなくても消えますよっと……,是——是。\n就算你不说，我也会消失的……
75,,そう言って\nルーソルは一行から\n距離を取って離れる。,这样说着，\n路索鲁和一行人\n拉开了些距离。
76,ルーソル,それじゃあ、僕はここで。,就这样，我告辞了。
77,ルリア/露莉亚,え、もう行っちゃうんですか？,诶，就这样走了吗？
78,ルーソル,うん、ちょっとガウェインを\nからかいに来ただけだしね。,嗯，我就是来捉弄一下\n高文的呢。
79,フロレンス,ルーソルさん、\n本当にありがとうございました。,路索鲁先生，\n真的很感谢你。
80,ルーソル,フロレンスさんもお元気で。,芙罗伦斯你也保重。
81,ビィ/碧,賑やかなヤツがいなくなると\nなんか寂しくなるな。,吵吵闹闹的家伙不在了，\n总觉得有点寂寞呢。
82,ルーソル,そんな風に言ってもらえるなんて\n嬉しいなぁ～,你这样说\n我真高兴呢～
83,ルーソル,まぁ、もうしばらくは\nこの辺りをぶらぶらしてるから\n運がよかったらどこかで会えるよ！,不过我还会在这一带\n晃悠上一段时间，\n运气好的话还会再见的！
84,,「また会おう」とルーソルに\n笑顔で答える姬塔。,姬塔笑着回答路索鲁\n「再会了」。
85,ルーソル,うん、姬塔さんとは\nまたどこかで会えそうな気がするよ。,嗯，我总觉得会在哪里\n与姬塔你再会的。
86,,最後に、ひとりばつが悪そうに\nしているガウェインに\n近づくルーソル。,最后，路索鲁\n靠近只身一人\n显得有些尴尬的高文。
87,ルーソル,ふふ……\n最後までぶっきらぼうなのが\nガウェインらしい。,呵呵……\n到最后还一副生人勿进的模样\n还真是很高文呢。
88,ガウェイン/高文,ふん……\n急に愛想よくなどできるか。,哼……\n一个人怎么可能突然变得平易近人。
89,ルーソル,それじゃあ、またね。\nガウェイン。,就这样，再见了。\n高文。
90,ガウェイン/高文,ああ、またな。,啊，再见了。
91,,ルーソルは、小さく手を振ると\nそのままどこかへ去って行った。,路索鲁稍稍挥了挥手，\n就这样离开了。
92,ガウェイン/高文,やれやれ……\nうるさいヤツがいなくなって\nせいせいしたな。,真是的……\n烦人的家伙走了\n真是耳根清净。
93,ガウェイン/高文,俺とフロレンスは\nこれから行くところがあるが、\n姬塔たちはどうする？,我和芙罗伦斯接下来\n有别的地方要去，\n姬塔你们准备怎么办？
94,ビィ/碧,オイラたちも\n特に用事はないよな？,我们也没什么\n要做的？
95,ルリア/露莉亚,はい、急ぎの依頼もありませんしね。,是啊，没有什么紧急的委托。
95-sel1_txt,,ついて行ってもいい？,我能跟上吗？
95-sel2_txt,,秘密の用事とか……？,是什么秘密行动……？
97,ガウェイン/高文,ああ、構わんが\n別に面白い事などないぞ。,啊啊，无所谓，\n但不是什么有趣的事。
98,フロレンス,では、せっかくなので\n姬塔さんたちも\n一緒に来ていただきましょうか。,那么，机会难得，\n姬塔你们也\n一起来吧。
100,フロレンス,いえ、\n秘密にしたい訳ではありません。,不，\n也不是什么秘密。
101,ガウェイン/高文,この際だ、\n姬塔たちも一緒について来い。,趁此机会，\n姬塔你们也跟上吧。
107,,ガウェインたちが向かった先は、\n街外れにある墓地であった。,高文等人前往的是\n城外的墓地。
108,,とある墓石の前で黙祷を捧げる\nガウェインとフロレンスに倣う\n姬塔たち。,姬塔等人模仿\n高文和芙罗伦斯在某块墓碑前\n默祷。
109,ガウェイン/高文,この墓には俺たちの両親が眠っている。,我的双亲在这座墓中安眠着。
110,ルリア/露莉亚,そうだったんですね……,是这样啊……
111,フロレンス,ロットとモルゴース、\n父と母はこのダルモア公国のために\n共にその生涯を捧げました。,洛特和摩尔格丝，\n父亲和母亲一同为达尔摩公国\n奉献了一生。
112,ビィ/碧,そういや猫探しの時に街の人が\nその名前をだして話してたような……,说起来找猫的时候，\n好像有听城里的人提到这个名字……
113,フロレンス,はい。実は、父のロットは\nダルモア公国の騎士団長でした。,是。其实父亲洛特曾是\n达尔摩公国的骑士团长。
114,ガウェイン/高文,そして母のモルゴースは、\n魔導師団の長を務めていた。,然而母亲摩尔格丝则担任\n魔导师团之长。
115,ルリア/露莉亚,え……ということは、\nおふたりと同じ立場だったんですか？,诶……也就是说，\n与你们二位所担的是同样的职位？
116,ガウェイン/高文,俺はもう騎士団長ではないが、\nそんな時期もあったな。,我已经不是骑士团长了，\n但的确有过这么段时期。
117,ビィ/碧,その父ちゃん母ちゃんって、\nどんな感じだったんだ？,你们的父母\n是怎样的人？
118,ルリア/露莉亚,ビィさん、こういう話は\nあまりずけずけ聞いちゃ──,碧，这种事\n不要随便探听比较──
119,フロレンス,いえ、思い出話をしてあげた方が、\nきっと両親も喜ぶと思います。,能提起这段往事，\n双亲一定会欢喜的。
119-sel1_txt,,両親のこと、教えて,告诉我你双亲的事吧
121,ガウェイン/高文,ここまで関わったんだからな、\n貴様らには話してもいいだろう。,你们都帮到这份上了，\n告诉你们也无妨。
122,,そうしてガウェインの口から、\n両親との思い出が\n静かに語られるのだった。,然后高文便\n静静地开始讲述\n他双亲的故事。
info,,,scene_evt200927_cp2_q1_s10
译者,,,