id,name,text,trans
0-chapter_name,,第1話 ・│・・│・・・,
0-synopsis,,月日は瞬く間に経ち、シンクと共に成長した姬塔。姬塔が15歳の誕生日を迎えた日の深夜、野原の方に何かが落ちる音がし、姬塔達は様子を見に行くことに。野原には小型艇が墜落しており、ひとりの女性が気を失っていたのだった。,时光流逝，姬塔和星一同成长了起来。在姬塔迎来15岁生日那一天的深夜，原野的方向传来了某种东西掉落的声音，姬塔他们决定前去查看。他们发现原野上坠落了一艘小型艇，以及一名昏迷的女性。
12,シンク,キェエエエッ！,喝啊啊啊啊！
17,シンク,いい反応だな、姬塔。\n不意打ちをいなすのが\n随分上手くなった。,姬塔，反应不错。\n变得很擅长躲开突击了呢。
18,ビィ/碧,すっげぇ強くなったよなぁ……\nもうここらの魔物は\n姬塔の敵じゃねぇもんな！,变得很强了呢……\n这一片的魔物已经没有\n能打得过姬塔的了！
19,ビィ/碧,これもシンクが\n修行の相手をしてくれたからだよな～,这也是多亏了星\n给姬塔当修行的陪练呀~
20,オロロジャイア,体動かすのも魔法使うのも\n姬塔は割とどっちも向いてて\n器用だねぇ。,不管是身体能力还是魔法能力，\n姬塔两边都很擅长，\n还真是个能干的孩子啊。
21,オロロジャイア,体動かすのも魔法使うのも\n姬塔は割とどっちも向いてて\n器用だねぇ。,不管是身体能力还是魔法能力，\n姬塔两边都很擅长，\n还真是个能干的孩子啊。
22,ビィ/碧,こんくらい強くなれば、\n他の島でも\n騎空士としてやってけるかな？,变得这么强了的话，\n在其他岛都能当骑空士了吧？
23,オロロジャイア,騎空士のヒトの意見が\n聞けるといいんだけどねぇ。,那还是要问问当骑空士的人才行啊。
24,オロロジャイア,騎空士のヒトの意見が\n聞けるといいんだけどねぇ。,那还是要问问当骑空士的人才行啊。
25,シンク,<span class='scene-font-place'>ザンクティンゼル</span>へ\n他所から騎空士が来ることなんて\n滅多にないしな……,从其他地方来<span class='scene-font-place'>赞克汀泽</span>的骑空士可不多啊……
28,,修行の手応えを感じつつも、\n姬塔は旅立ちの契機を\n得られずにいた。,虽然感觉到了修行的成果，\n但姬塔一直没有遇到踏上旅途的契机……
29,,そして、姬塔は\n15歳の誕生日を迎え──,然后，姬塔迎来了15岁的生日——
40,オロロジャイア,ハッピバースデートゥーユー♪,祝——你——生日快乐——♪
41,オロロジャイア,ハッピバースデートゥーユー♪,祝——你——生日快乐——♪
42,ビィ/碧,ハッピバースデートゥーユー♪,祝——你——生日快乐——♪
44,,あいにくの嵐に見舞われながらも、\n姬塔はビィ達に\n誕生日を祝われていた。,虽然不巧今天遇到了暴风雨，\n但碧他们还是给姬塔庆祝了生日。
45,シンク,誕生日おめでとう、\n姬塔。,生日快乐，\n姬塔。
46,オロロジャイア,ついこの間まで\nこーんなにちっちゃな\n赤ちゃんだったのになぁ……,一没注意就长这么大了，\n明明之前还是个小小个的小婴儿……
47,オロロジャイア,ついこの間まで\nこーんなにちっちゃな\n赤ちゃんだったのになぁ……,一没注意就长这么大了，\n明明之前还是个小小个的小婴儿……
48,オロロジャイア,もう15歳だもんねぇ。\n島によっては成人だよ～,已经15岁了呢。\n按岛的规矩来说已经是成年人了~
49,オロロジャイア,もう15歳だもんねぇ。\n島によっては成人だよ～,已经15岁了呢。\n按岛的规矩来说已经是成年人了~
50,ビィ/碧,あれ？　ってことは、\nオイラがロジャーと初めて会ってから\nもうそんなに経ってるのか……,哎呀？这么说来，\n距离我和罗伽初次见面，\n已经过去这么久了啊……
51,オロロジャイア,ね～、月日が経つのは早いよねぇ。\nシンクが来たのももう７年？　８年？\n10年はまだだったはずだけど……,是啊~时光流逝真是太快了呢。\n星也来了7年？8年？\n应该还没满10年吧……
52,オロロジャイア,ね～、月日が経つのは早いよねぇ。\nシンクが来たのももう７年？　８年？\n10年はまだだったはずだけど……,是啊~时光流逝真是太快了呢。\n星也来了7年？8年？\n应该还没满10年吧……
53,シンク,そんなに……,那么久了吗……
54,,しみじみと年月を思う中、\n姬塔は表情を改め\n決意を口にする。,就在大家沉浸于对岁月的沉思时，\n姬塔用认真的表情说出了自己的决意。
54-sel1_txt,,島を出ようと思う,我想离开岛出去外面。
56,オロロジャイア,そっか……\n姬塔、決めたんだね。,是嘛……\n姬塔，你已经决定好了吗。
57,オロロジャイア,そっか……\n姬塔、決めたんだね。,是嘛……\n姬塔，你已经决定好了吗。
58,ビィ/碧,へへ、親父さんを追いかけるために\n今まで頑張って来たんだもんな！\nオイラは勿論ついてくぜ！,嘿嘿，毕竟是为了追上老爹，\n才一直努力到现在的嘛！\n我当然也会跟你去的啦！
59,シンク,約束通り、俺も一緒に行く。,按照约定，我也会一起去。
60,オロロジャイア,この家のこと、\n誰にお願いするのがいいかな～？,那这个家该托付给谁好呢~？
61,オロロジャイア,この家のこと、\n誰にお願いするのがいいかな～？,那这个家该托付给谁好呢~？
62,ビィ/碧,あれ？　ロジャーも来るのか？,诶？罗伽也要跟来吗？
63,オロロジャイア,行くよ！？　毎日のご飯、\n誰が作るつもりでいるのさ！？,当然要去啦！？\n不然你们今后打算谁来做每天的饭！？
64,オロロジャイア,行くよ！？　毎日のご飯、\n誰が作るつもりでいるのさ！？,当然要去啦！？\n不然你们今后打算谁来做每天的饭！？
67,オロロジャイア,それにこう見えても空の世界のことには\n結構詳しいんだから。\nロジャーさん、お役立ちだよ～？,而且别看我这样，\n我对空之世界的事可是非常了解的。\n罗伽桑，可是很有用的哦~？
68,オロロジャイア,それにこう見えても空の世界のことには\n結構詳しいんだから。\nロジャーさん、お役立ちだよ～？,而且别看我这样，\n我对空之世界的事可是非常了解的。\n罗伽桑，可是很有用的哦~？
69,,誕生日のご馳走を食べながら、\n姬塔達は旅立ちのための\n計画について話し込む。,姬塔他们一边吃着庆贺生日的饭，\n一边为踏上旅行讨论着计划。
75,,その日の深夜──,那天深夜——
77,ビィ/碧,シンク、どうしたんだ？,星，你怎么了吗？
78,シンク,今、何か重い物が落ちた音がした。\n野原の方だと思うんだが……,刚刚，有个很重的东西掉下来的声音。\n应该是在原野那边……
79,オロロジャイア,この天気の中で\n割と遠いとこから聞こえる、\nってことはかなり大きいものだね。,这种天气还能听到那么远传来的声音，\n也就是说掉下来的东西相当大啊。
80,オロロジャイア,この天気の中で\n割と遠いとこから聞こえる、\nってことはかなり大きいものだね。,这种天气还能听到那么远传来的声音，\n也就是说掉下来的东西相当大啊。
81,オロロジャイア,（これって多分……）,（这个或许是……）
82,オロロジャイア,（これって多分……）,（这个或许是……）
83,ビィ/碧,なんだろな……？,会是什么呢……？
83-sel1_txt,,見に行こうよ！,去看看吧！
85,,姬塔は何かが起こる予感に\n立ち上がり、音の正体を\n確かめに行くことを決める。,姬塔预感到似乎有什么要发生，\n于是站起身来，\n决定要去确认那是什么声音。
91,,嵐は少し治まったとはいえ\n激しい雨の中、姬塔達は\n村近くの野原へ急いだ。,外面的暴风雨虽然有所减弱，\n但雨势仍然激烈，\n姬塔他们匆忙赶到了村庄附近的原野。
92,ビィ/碧,ありゃあ……,哎呀……
93,シンク,騎空艇……にしては\n小さいな……？,骑空艇……\n话说，还挺小只的……
94,,細い煙を立てる小型艇の中に\n人がいることに気づき、\n姬塔は慌てて駆け寄る。,发现冒出细细烟雾的小型艇中有人存在，\n姬塔连忙凑了过去。
95,？？？,…………,…………
96,ビィ/碧,<span class='scene-font-4'>大変だ！</span>\n怪我人がいるじゃねぇか！,<span class='scene-font-4'>糟糕了！</span>\n里面有个受伤的人！
97,シンク,体が挟まっているかもしれない。\n引っ張り出す前に調べた方がいいな……,身体可能被夹住了。\n拉出来之前最好确认一下……
98,,姬塔達は小型艇から\n女性を救助して\n自宅へと取って返すことになった。,姬塔他们把女性从小型艇中救出，\n带回到了自家。
info,,,scene_evt230225_cp1_q4_s10
译者,,,喜欢欧罗罗伽亚的凛
