id,name,text,trans
1,ナルメア/娜尔梅亚,姬塔ちゃん！<br>ハッピーバースデー！,姬塔！<br>生日快乐！
2,ナルメア/娜尔梅亚,今年もフュンフちゃんと<br>パーティーの準備頑張ったんだよ。<br>ケーキもお菓子もいっぱいあるからね！,今年也和芬芙一起<br>准备了生日派对。<br>有很多蛋糕和点心哦！
3,ナルメア/娜尔梅亚,またオクトーも来てくれるし、<br>みんなでお祝いするって素敵だよね。,奥克塔也还会来、<br>真不错，大家都来庆祝。
4,ナルメア/娜尔梅亚,でも、実はね、パーティーまでは<br>ちょっと時間があって……,但是，其实，在派对开始之前<br>还有一点时间……
5,ナルメア/娜尔梅亚,始まるまでの時間は、<br>ふたりでお話、できないかな……？,在开始之前，<br>能不能，两个人说说话呢……？
6,ナルメア/娜尔梅亚,みんなでのお祝いも素敵だけど……,和大家一起庆祝当然也好……
7,ナルメア/娜尔梅亚,お姉さんひとりでも、<br>姬塔ちゃんのこと、<br>お祝いしたいんだ。,但是姐姐想<br>单独给姬塔<br>庆祝一下。
info,,,scene_s5_birthday_3047_v1_0_2006_5_3040063000
译者,麻友桑的话筒,,