id,name,text,trans
4,ユエル,ハッピーバレンタイン……<br>姬塔。,情人节快乐……姬塔。
5,ユエル,うーん……どないしたんやろ……<br>姬塔……ウチ、<br>おかしなってもうたんかも。,唔……怎么回事啊……<br>姬塔……<br>我变得有点奇怪。
6,ユエル,ただ、日ごろの想いを<br>チョコにこめて……<br>渡しとるだけやのにな。,明，明明是想着以往的<br>回忆做的巧克力……
7,ユエル,年々な、<br>その、照れくさなってもうて……<br>敵わんわ、ほんま……！,结果每年都……<br>那个，会很害羞……<br>真是受不了……！
12,ユエル,もう、これも全部<br>姬塔のせいや！<br>そうに決まっとる！,真是的，这全都是姬塔的责任！<br>肯定是这样！
13,ユエル,こんなんいつもの<br>ユエルちゃんらしぃないで……<br>調子狂うわ……ほんまに……,完全没有平时尤艾尔的样子……<br>有点失常了……真是的……
14,ユエル,……ちゃんと責任とってもらうで。<br>覚悟しぃや、姬塔……♪,你要负起责任来啊。<br>拿出觉悟来吧，姬塔……♪
info,,,scene_s4_valentine_3006_v1_0_2002_4_3040006000_1