id,name,text,trans
0,マルキアレス/马尔基亚雷斯,いやはや、めでたき日じゃのう\n姬塔殿！,哎呀哎呀，今天可真是个值得庆贺的日子啊，姬塔大人。
1,マルキアレス/马尔基亚雷斯,ずいぶんと長い時を\n生きてきたゆえ、時の流れには\nちょーっと鈍感じゃったが……,活了这么长时间，对时间的流逝已经有些迟钝了……
2,マルキアレス/马尔基亚雷斯,ここ最近は姬塔殿のおかげで\n日々を色濃く、密に実感できておる。,但是最近和姬塔大人在一起，每天都有着十分深刻的感受。
3,マルキアレス/马尔基亚雷斯,充実した時間を\n過ごすことができているとも\n言えるやもしれぬな。,可以说是度过了非常充实的一段时间。
4,マルキアレス/马尔基亚雷斯,その証拠に、大アストラルの高まりは\n以前とは比べ物にならぬほどじゃ！,证据就是，大星幽之力现在的高涨程度完全不是之前能比的！
5,マルキアレス/马尔基亚雷斯,姬塔殿には改めて\n礼を言わねばなぁ。,必须再次向姬塔大人致谢才行。
6,マルキアレス/马尔基亚雷斯,さ、では甲板に参ろうかの！\n今年は盛大な爆裂光華でお祝いじゃ！,那么我们就去甲板上吧！\n今年就用盛大的爆裂光华来庆祝！
info,,,scene_s4_birthday_3074_v1_0_2006_4_3040108000
译者,,,