id,name,text,trans
0,マギサ/玛姬莎,姬塔さん、<br>誕生日おめでとう。<br>この一年、どうだったかしら？,姬塔，生日快乐。<br>这一年过得怎么样？
1,マギサ/玛姬莎,私としては、去年した予言が<br>当たっているといいのだけれど。,对我来说，去年我预言的内容说中了就好了。
2,マギサ/玛姬莎,でもね、きっと貴方といて<br>幸せだったのは私の方だと思うの。,不过，我觉得跟你在一起觉得幸福的一定是我。
3,マギサ/玛姬莎,ふふふ、貴方の傍では万能の魔女も<br>形無しね。でも、もう離れるなんて<br>考えられないもの。,呵呵呵，在你身边万能的魔女也颜面尽失啊。<br>不过，我已经不会考虑离开你了。
4,マギサ/玛姬莎,あなたが生まれてきてくれて、<br>そして出会うことができて、<br>本当に嬉しいの。,我真的很高兴，你能诞生在这世界上，<br>我能与你相遇。
5,マギサ/玛姬莎,不束者だけど、これからもよろしくね。<br>姬塔さん。,小女子不才，以后请多关照。<br>姬塔。
info,,,scene_s3_birthday_3011_v1_0_2006_3_3040011000