id,name,text,trans
0-chapter_name,,聖夜の手作りコンサート エピソード１０,圣夜的手工音乐会（10）
1,,演奏会が終わった翌日、\n聖夜を迎えた艇内は\nどこもかしこも賑わっていた。,演奏会结束后的翌日，\n迎来圣诞夜的骑空艇内\n到处都是热闹非凡。
2,サラ/莎拉,ボレミア、これ……！\n枕元にあったこのぬいぐるみ、\nボレミアが置いてくれたの？,波蕾米亚，这个……！\n我枕边的这个毛绒玩偶，\n是波蕾米亚放的吗？
3,ボレミア,ああ。素晴らしい演奏を聴かせて\nもらっただろう？\n私からも聖夜の贈り物だ。,嗯。你让我听了精彩的音乐，对吧？\n这是我送你的圣诞夜礼物。
4,ボレミア,共に旅を続けてくれて\nありがとう、サラ。,谢谢你与我一起旅行，莎拉。
5,サラ/莎拉,ううん！　私の方こそ！\nボレミアと一緒にいられて\n今、本当に幸せ！,嗯，我也是！\n能和波蕾米亚在一起，\n我现在真的很幸福！
6,フュンフ/芬芙,ナル姉ちゃん、ありがとー！\nこのキャンディー、キラッキラの\nピッカピカですっごくきれい！,娜尔姐姐，谢谢！\n这个糖果亮晶晶的，好漂亮！
7,ナルメア/娜尔梅亚,気に入ってくれてよかった～！\nナルメアサンタからのプレゼントだよ！,你喜欢真是太好了！\n这是娜尔梅亚圣诞老人送的礼物哦！
8,カイム/凯姆,ねぇ、この積み木の玩具、\nハングドマンがくれたんでしょ？\nありがとー！,这些积木玩具是倒吊男送的吗？\n谢谢！
9,ザ・ハングドマン/倒吊男,昨日頑張ったご褒美ってところだよ。\nずっといい子に過ごしてた\nみたいだしな。,这是给你昨天那么努力的奖励。\n就好像你一直是个好孩子一样。
10,エルタ/埃尔塔,ふふっ、皆さん大喜びですね！,呵呵，大家都很开心呢。
11,セレフィラ/瑟蕾菲拉,参加してくれた子達は自分が聖夜の\n贈り物がしたいって言ってたけど……,参加的孩子都说，\n想要送出圣诞夜的礼物……
12,セレフィラ/瑟蕾菲拉,やっぱり聖夜には、\n贈り物を受け取った子供達の\n笑顔がなくっちゃね！,不过圣诞夜的时候，\n收到礼物的孩子们的灿烂笑容\n果然是不可缺少的！
13,キハール/齐哈尔,ンハハハハ！　その通りである！\nそこで吾輩からもふたりに\nプレゼントであるぞ！,哈哈哈哈！正是如此。\n这里是老夫给你俩的礼物！
14,セレフィラ/瑟蕾菲拉,えっ、これ……手袋……？,咦，这是……手套……？
15,セレフィラ/瑟蕾菲拉,ありがとう、お爺ちゃん！\n大切に使うわ！,谢谢爷爷！\n我会爱惜的！
16,エルタ/埃尔塔,あの、キハールさん。\n僕まで手袋をいただいてしまって\nいいんでしょうか？,那个，齐哈尔先生。\n您甚至给我也准备了手套，\n这样好吗？
17,キハール/齐哈尔,もちろんなのである！\nふたりとも指先は大事にしなくては。\n存分に使い潰して欲しいのである！,这是理所当然的事！\n你俩得好好爱惜自己的手指。\n希望你们尽情地使用！
18,コウ/蔻,ヨウ、僕からも聖夜のプレゼントです。\nいつも僕と一緒にいてくれて、\nありがとうございます。,容，这是我给你的圣诞礼物。\n谢谢你一直与我在一起。
19,ヨウ/容,え……ホントにいいのか？\nだって、こ、これ……\nピンクのリップクリームじゃねぇか……,咦……真的可以收下吗？\n因为、这、这个……\n这不是粉红色的润唇膏吗……
20,ヨウ/容,これさ、これさ……ちょうど欲しくて、\nすっげぇ嬉しいよ！　オレの方こそ、\nいつも一緒にいてくれて、ありがとう！,这、这个……我想要！\n好开心啊！我才是呢！\n感谢你一直与我在一起！
21,ジュリエット/朱丽叶,「澄んだ瞳にキラキラとした光を\n躍らせて、トロットのようなリズムを\n奏でる君の横顔は……」,“清澈的眼睛里跃动着闪烁的光芒，\n奏响马蹄般节奏的你的侧脸……”
22,ロミオ/罗密欧,ま、待ってくれ、ジュリエット！\nさすがにここで読まれると\n恥ずかしいよ……,等、等等，朱丽叶！\n在这里读也太让我不好意思了！
23,ジュリエット/朱丽叶,だってせっかく秘密にしていたのに\n練習しているところを覗いてたなんて！\nこれは仕返しです！,因为好不容易想要当成秘密的，\n你却偷看我们练习！\n这是我的报复！
24,ロミオ/罗密欧,ははは、ごめんよ。\nひたむきな君があまりに綺麗だったから\nどうしても詩を贈りたかったんだ。,哈哈，真抱歉。\n因为全神贯注的你实在太美丽，\n我无论如何都想送你一首诗。
25,ルリア/露莉亚,ふふっ、演奏会に来てくれた皆さんも\nプレゼントを用意してたんですね！,呵呵，来看演奏会的大家\n都准备了礼物呢！
25-sel1_txt,,ルリアにもこれ、プレゼントだよ,露莉亚，这是礼物
27,ルリア/露莉亚,え……？　いいんですか？,咦……？这样好吗？
29,ルリア/露莉亚,はわわ～\n青いお花の綺麗な髪飾りです！,哇啊~\n蓝色的花朵头饰，好漂亮！
29-sel1_txt,,いつもそばにいてくれてありがとう,谢谢你一直在我身边
31,ルリア/露莉亚,えへへ、私こそ！\n姬塔もビィさんも一緒に\nいてくれてありがとうございます！,嘻嘻，我也是！\n感谢姬塔和碧一直在我身边！
33,アンリエット/安丽特,みんなー！\nそろそろパーティー始めるわよー！,大家~！\n派对马上就要开始啦！
34,フュンフ/芬芙,うん！　って、あはは！\n口のところクリームついてるよ！\nつまみ食いしたのー？,嗯？啊哈哈哈！\n你的嘴上有奶油！吃零食了吗？
35,アンリエット/安丽特,あ、しまった……！\nちょっとだけ味見をね！,啊，糟糕……！\n我只是试试味道而已！
36,ルリア/露莉亚,ふふっ、私お腹空いちゃいました！\n行きましょう、姬塔！,呵呵，我也肚子饿了！\n我们走吧，姬塔！
37,,各々が大切な人に感謝を伝え合い、\n誰もが嬉しそうに顔をほころばせる。,大家向各自重要的人表达了感激之情，\n每个人的脸上都洋溢着喜悦之情。
38,,ともに穏やかに過ごす時間──\nそんな当たり前な幸せを噛み締めながら\n皆聖夜のご馳走に舌鼓を打つのだった。,一起度过的安详时光——\n大家一边品味着这理所当然的幸福，\n一边享用圣诞夜的晚宴。
info,,,scene_evt211216_cp10_q1_s10
译者,,,psyche
