id,name,text,trans
0,ノア/诺亚,あけましておめでとう、<br>姬塔さん。,新年快乐，姬塔。
1,ノア/诺亚,さて、早速だけど、<br>年初めの初飛行に行こうか。,那么赶紧去做年初的初飞吧。
2,ノア/诺亚,毎年行うことだけれど、<br>疎かにしてはいけないよ。,虽然每年都会做，但你可不能生疏了哦。
3,ノア/诺亚,初飛行は、<br>旅の安全を祈願するだけでなく、<br>改めて安全を意識する意味もあるんだ。,初飞不只是祈愿旅途顺利，还意味着唤起安全意识。
4,ノア/诺亚,団を預かる団長と、<br>艇を預かる操舵士にとっては、<br>欠かすことの出来ない大切な仕事さ。,对被托付了团的团长，和被托付了船的舵手来说，这可是必不可少的重要的工作啊。
5,ノア/诺亚,ふふ……そう畏まる必要は無いよ。<br>姬塔さんは、<br>いつも皆を大切に思っているだろう？,呵呵……没必要那么害怕嘛。姬塔不是一直都很重视大家吗？
6,ノア/诺亚,その気持ちを……<br>団の皆への気持ちを、<br>改めて確認するだけだからね。,只是让你再次确认……你对团里大家的心情而已。
info,,,scene_s5_newyear_2035_v2_0_2001_5_3040255000
译者,,,