id,name,text,trans
0,フェリ/菲莉,姬塔、<br>誕生日おめでとう。,姬塔，生日快乐。
1,フェリ/菲莉,姬塔の成長を<br>こうして毎年祝えることを<br>心から嬉しく思う。,我打从心底里高兴能够像这样每年为姬塔的成长庆祝。
2,フェリ/菲莉,やっぱり、人が成長していく姿を<br>見るのは嬉しいからな。,大概是因为看着人成长会很高兴吧。
3,フェリ/菲莉,妹も<br>気が付いたらどんどん<br>大きくなっていって……,我妹妹也是，不知不觉就不断长大了……
4,フェリ/菲莉,きっと姬塔も<br>これから、<br>どんどん成長していくんだろうな。,姬塔以后也会不断成长吧。
5,フェリ/菲莉,ふふっ、姬塔のことは<br>家族みたいに思っているんだ。,呵呵，我把姬塔当成家人啊。
6,フェリ/菲莉,だから、これからも<br>姬塔のことを<br>見守らせてもらうよ。,所以往后我也会看着姬塔的。
7,フェリ/菲莉,なにせ、私の今の一番の楽しみは<br>姬塔が成長していく姿を<br>見ることなんだからな。,因为，我现在最大的乐趣就是看姬塔成长起来的样子啊。
info,,,scene_s3_birthday_2029_v3_0_2006_3_3040073000