id,name,text,trans
0,コウ/蔻,今日はハロウィンですが……\n姬塔さんは仮装もバッチリだし\nやる気満々のようですね。,今天是万圣节啊……\n姬塔的换装也很完美，\n看起来干劲十足呢。
1,コウ/蔻,こ、今年はお菓子を沢山\n用意しましたから、悪戯はなしですよ！,今，今年我准备了很多点心，\n所以不准对我恶作剧哦！
2,コウ/蔻,え？　そんな、露骨に\n残念そうな顔しないでくださいよ。\n悪い事してるみたいじゃないですか……,诶？请别露出那么明显的失落表情啊。\n搞得我像做了坏事一样……
3,コウ/蔻,うぅ……仕方ない……\nそんなに楽しみだったんなら、\n少しだけなら悪戯してもいいですよ。,呜呜……没办法……\n你那么期待的话，\n稍微恶作剧一下也是可以的哟。
4,コウ/蔻,って、急に元気になった！？,诶，突然变得精神了！？
6,コウ/蔻,あっ、やっ！　待って、近っ──,啊，不！等等，好近——
7,コウ/蔻,あの！\n本当に、本当に少しだけですからね！？\n……ね！？,那个！真的，真的只是稍微哦！？\n……好吗！？
info,,,scene_s2_halloween_3146_v1_0_2004_2_3040242000
译者,,,