id,name,text,trans
0,オクトー/奥克托,所詮、新たな年の訪れは<br>人が作った目安に過ぎぬ。,说到底，新年到来也不过是人为的表面安宁。
1,オクトー/奥克托,だが、生きれば生きる程<br>魂は惰性に犯される。<br>防ぐためには節目も必要よ。,但是越活越久<br>人就会犯懒。<br>所以为了防止这，有必要有这么一个时期。
2,オクトー/奥克托,節目にあって、己を律する……<br>生きることに対する、<br>礼儀と言うものだ。,在这关键时期，节制自身……<br>也是一种活着的礼仪吧。
3,オクトー/奥克托,己に礼を失する者は、<br>他者にも礼儀を失しよう。,对自己失礼的人，<br>也会对别人失礼的吧。
4,オクトー/奥克托,己を軽んじる者は、<br>世界をも軽んじよう。,看轻自己的人，<br>也会被世界看轻的吧。
5,オクトー/奥克托,すべからく軽き世に、<br>生きる所期などあるものか。,自然在这轻忽的世间里，哪能达到人生所期望的呢。
6,オクトー/奥克托,真剣に生き、真剣に楽しめ。<br>そのためにこそ、<br>春を迎えるを寿ごうぞ！,认真活着，认真享乐。<br>为了那么做，<br>来祈愿春天的到来吧！
info,,,scene_s5_newyear_4008_v1_0_2001_5_3040037000
译者,,,