id,name,text,trans
0,ソーン/索恩,新年は、独特の活気があるわね。,新年有独特的活力呢。
1,ソーン/索恩,暖かい部屋でご馳走をつつきながら、<br>のんびりお話しするのも<br>魅力的だし……,在暖和的房间里一边享受着丰盛的菜肴，一边悠闲的聊天，是很有魅力的事情……
2,ソーン/索恩,みんなで新年の市場に繰り出して、<br>限定の商品を探すのも楽しそう。,大家一起去新年的市场上逛街，寻找限定的商品也很有趣。
3,ソーン/索恩,選択肢が与えられているからこその、<br>ある意味贅沢な悩みね。  <br>,正因为有选项可以选，所以在某种意义上也是奢侈的烦恼啊。
4,ソーン/索恩,姬塔は<br>どうしたらお正月をもっと<br>楽しく過ごせると思う？,你觉得该怎样才能把正月过得更加快乐？
5,ソーン/索恩,ふふ……これからもみんなで、<br>いろんなことができるといいな。,呵呵……以后能够大家一起做更多的事就好了。
6,ソーン/索恩,今年もよろしくね。,今年也请多关照了。
info,,,scene_s4_newyear_4002_v1_0_2001_4_3040031000
