id,name,text,trans
0,ハーゼリーラ/哈泽丽拉,ハッピーハロウィンですわね、\n姬塔さん。,万圣节快乐哦、\n姬塔。
1,ハーゼリーラ/哈泽丽拉,今年は、姬塔さんが\nハーゼに悪戯を仕掛けてみませんか？,今年、\n不妨让姬塔来对哈泽做恶作剧吧？
2,ハーゼリーラ/哈泽丽拉,去年はハーゼが\n悪戯を仕掛けましたから、\nそのお返しに、ということですわ。,因为去年\n是哈泽做的恶作剧、\n所以这是回礼、就是这么回事哦。
3,ハーゼリーラ/哈泽丽拉,昔は孤児院の子供達に\nたくさん悪戯をされていましたので、\n悪戯には慣れていますの。,以前孤儿院的孩子们\n对我做了很多恶作剧、\n所以我已经习惯恶作剧了。
4,ハーゼリーラ/哈泽丽拉,ですが、お手柔らかに\nお願いいたしますわね。,不过、\n还请手下留情哟。
5,ハーゼリーラ/哈泽丽拉,心の準備をしていないと、その……\n思わず心の声が漏れてしまう\nかもしれませんので。,如果没有做好心理准备、那个……\n内心的声音\n可能会不小心泄露出来。
6,ハーゼリーラ/哈泽丽拉,なんて、ただの冗談ですわ。\nハーゼが姬塔さんのことを\n悪く言うはずないですもの。ふふ……,才怪、只是开个玩笑而已哦。\n哈泽可不会\n说姬塔的坏话哟。呵呵……
info,,,scene_s2_halloween_3107_v1_0_2004_2_3040168000
译者,,,Ekko_Echo