id,name,text,trans
0-chapter_name,,第5話 起死回生の一手を求めて,回天之术
0-synopsis,,教室棟に戻った姬塔一行は、ハンナ達と状況を整理していた。そこにモノリスに捕らわれていた生徒達が現れる。生徒達は、「赤き地平」「幽世」と呼ばれる異界を調べるため、禁忌の闇魔法を使ったと告白し、一行に一冊の魔導書を渡す。その魔導書には、禁忌の闇魔法も、異界に関する知識も、全て載っているという。一行は状況を打破するため、魔導書の解読に挑むのだった。,回到教室的姬塔一行人，与汉娜一起整理情报。之后被独石柱抓住的学生们来了。学生们说他们为了调查被称之为‘赤之地’‘幽世’的异界而使用了禁忌的暗魔法，然后把一本魔导书交了出来。魔导书上记载着禁忌的暗魔法、与异界相关的知识。一行人为了打破现状，开始尝试解读魔导书。
1,,<span class='scene-font-katari'>教室棟へと戻った後、</span><br><span class='scene-font-katari'>姬塔達は</span><br><span class='scene-font-katari'>ハンナ達に現状を報告する。</span>,回到教室后，姬塔他们向汉娜报告情况。
2,ハンナ/汉娜,なるほど……<br>情報をまとめさせて<br>いただきますわね。,原来如此……那我来总结一下。
8,ハンナ/汉娜,時計塔の中にある<br>異界と繋がった法陣。,钟楼内连接异界的法阵。
9,ハンナ/汉娜,これを破壊しなければ、<br>あの魔物達がそこを通り<br>こちらの世界に押し寄せてくる。,不破坏掉这个，那些魔物就会通过法阵来到这个世界。
15,ハンナ/汉娜,しかし、時計塔の入り口には<br>敵の張った結界が施されており、<br>現状、中に入ることができない……,但是，现在钟楼门口有敌人张开的结界，无法进入内部。
21,ハンナ/汉娜,そして皆さん達が<br>助けてくださった生徒達。,然后大家救出来的学生。
22,ハンナ/汉娜,彼らが何らかの術式を用いて、<br>この世界と異界を繋いだ。,他们使用了某种魔术，连接了两个世界
27,ハンナ/汉娜,これで間違いありませんわね。,事实是这样没错吧.
28,グレア/古蕾雅,……うん……ごめんなさい。<br>私がモノリスを壊したせいで、<br>こんなことに……,……嗯……非常抱歉.都是因为我破坏了独石柱、才会变成这样……
29,ハンナ/汉娜,グレアさんは<br>何も悪くありませんわ。,古蕾雅没有做错什么。
30,ハンナ/汉娜,むしろ、ワタクシの責任ですわね。,不如说，这些是我的责任.
31,ハンナ/汉娜,グレアさんにコア・モノリスの破壊を<br>お願いしたのは、他でもない<br>ワタクシなんですから……,拜托古蕾雅去破坏独石柱的 不是别人，正是我.
32,グレア/古蕾雅,<span class='scene-font-4'>ち、違うよ！</span><br><span class='scene-font-4'>言い出したのは私だよ！</span><br>だから……,不，不是！是我主动请缨的！所以……
33,アン/安,はいはい。<br>ハンナちゃんもグレアも<br>そこまで！,好了好了。汉娜也好古蕾雅也好都到此为止！
34,アン/安,終わった事はいいから、<br>これからの事を話そうよ！,过去的就让它过去，来商量一下接下来的事！
35,ハンナ/汉娜,そ、そうですわね。<br>アンさんの言うとおりですわ。,说得也是，就听安的吧。
36,ハンナ/汉娜,コホン。取りあえず、<br>元凶となった生徒達の事は<br>今は置いておくとして……,咳。总之、事件的元凶是学生这件事先撇开不谈。
37,ハンナ/汉娜,問題はどうやって<br>時計塔に侵入するか……<br>ですわね。,目前问题是如何侵入钟楼……对吧。
38,グレア/古蕾雅,結界は私が何とかできると思う。<br>でも、問題は<br>門になっている法陣のほう……,结界的话我有办法。但是，构成门的法阵要怎么办……
39,グレア/古蕾雅,モノリスみたいに壊したら発動する……<br>なんていう仕掛けがされてるかも<br>しれないし。,像破坏独石柱一样破坏的话就会发动...被设计成这样也不是没有可能。
40,イオ/伊欧,敵も頭がキレるみたいだし、<br>あり得るわね。,敌人似乎也不是半吊子，不是没有可能。
41,アン/安,……ねぇ、ハンナちゃん。<br>異界の門を開いたって言う人達は？,……呐、汉娜。之前说异界之门打开了的那些人呢？
42,アン/安,何があったのか<br>ちゃんとお話ししてくれるって<br>言ってたんだけど……,之前说好要好好解释一番的……
43,ハンナ/汉娜,彼らでしたら<br>今、保健室で……,他们的话现在在保健室……
46,女子生徒１/女学生１,あ、あの……,那、那个……
47,,<span class='scene-font-katari'>ドアを開け、</span><br><span class='scene-font-katari'>おずおずと室内に入ってくる</span><br><span class='scene-font-katari'>複数人の生徒。</span>,门被打开后，怯生生地走进来一批学生。
48,ハンナ/汉娜,貴方達……<br>身体の方はもう大丈夫ですの？,你们...身体没事了吗？
49,女子生徒１/女学生１,は、はい……<br>ミランダ先生に<br>治療してもらいましたので……,唔、嗯...米兰达老师帮我们治疗了……
50,女子生徒１/女学生１,そ、それと、ごめんなさい！,非、非常抱歉！
51,男子生徒２,すみませんでした！,非常抱歉！
52,,<span class='scene-font-katari'>ハンナと姬塔達に向かい、</span><br><span class='scene-font-katari'>生徒達は深々と頭を下げる。</span>,面对着汉娜和姬塔他们，学生们深深地鞠了一躬。
53,ハンナ/汉娜,……その様子ですと<br>学院の現状は<br>しっかり把握できたようですわね。,...看样子，你们已经明白学院里发生了什么事情了。
54,女子生徒２/女学生２,……はい。<br>ミランダ先生から全部聞きました。,...是的。米兰达老师全部告诉我们了。
55,女子生徒１/女学生１,私達の所為で学院どころか、<br>世界そのものが危ないって……,因为我们不止学院、世界都陷入了危机……
56,女子生徒１/女学生１,本当に……どうしたらいいか……<br>……ごめんなさい……,这、我们该如何是好...对不起……
57,ハンナ/汉娜,貴方達のしたことは<br>謝って済む問題ではありませんわ。,你们做的事情可不是道歉就能解决的问题。
58,,<span class='scene-font-katari'>ハンナの冷たい言葉に</span><br><span class='scene-font-katari'>元凶の生徒達は顔を</span><br><span class='scene-font-katari'>蒼白にしていく。</span>,听着汉娜冷冰冰的话语，罪魁祸首的学生们脸都白了。
59,男子生徒１,だって……<br>こんな大変なことになるとは<br>思ってなかった……,因为……完全没想到事态会发展得这么严重……
60,男子生徒１,俺達はただ、「空の底」に<br>ついての事を調べようとしただけで……,我们只是...想要调查一下‘空之底’的事情罢了……
61,ハンナ/汉娜,「空の底」……ですの？,‘空之底’？
62,男子生徒２,はい。「空の底」には<br>伝説にある星の世界とは<br>別の世界──,嗯，在‘空之底’有着和空域完全不同的另一个世界--
63,男子生徒２,「赤き地平」「幽世」と<br>呼ばれる異界が存在する──,存在着被称作‘赤之地’‘幽世’的异界--
64,男子生徒２,この魔導書には<br>そう書かれていたんです。,这本魔导书里是这么写的。
65,アン/安,「赤き地平」……それって、<br>空の底にあるって言われる<br>場所のことだよね。,‘赤之地’...说是在空之底的地方对吧.
66,,<span class='scene-font-katari'>そう言うと男子学生はアンに</span><br><span class='scene-font-katari'>一冊の本を渡す。</span>,这么说着男学生递给安一本书.
67,男子生徒２,僕たちはそれを確かめたくて……<br>それで魔導書に書かれていた<br>禁忌の闇魔法を使ったんです。,我们想确认它的存在...于是使用了写在魔导书上的禁忌的暗魔法.
68,ハンナ/汉娜,禁忌の闇魔法って……,禁忌的暗魔法……
69,ハンナ/汉娜,<span class='scene-font-4'>貴方達！</span>,你们!
70,アン/安,まぁ、まぁ、落ちついて<br>ハンナちゃん。,好了、好了、冷静一下汉娜。
71,ハンナ/汉娜,っ！？<br>わ、わかりましたわ。,嗯！？好、好的。
72,アン/安,それで、その禁忌の闇魔法は<br>どんな術なの？,然后呢、那个禁忌的暗魔法是怎样的？
73,男子生徒２,ええと……異なる世界同士を繋ぐ<br>門を生み出す術……だそうです。,唔...据说是将不同世界的人连接起来进而制造门的魔法。
74,男子生徒２,僕たちはこの術を使って<br>「赤き地平」「幽世」へと<br>門を開こうとしたんです。,我们打算用这个魔法开启通往‘赤之地’‘幽世’的门。
75,男子生徒２,そして、その異界を<br>直接、確かめようとしたんです。,然后、打算直接去确认异界。
76,ハンナ/汉娜,どうして、<br>そんな事をしようと<br>思ったんですの？,你们为什么会想着这么做呢？
77,男子生徒１,俺達の手で実証したかったんだ。<br>「幽世」と呼ばれる異界の存在を。,我们想亲手印证‘幽世’的存在。
78,男子生徒１,「空の世界」と「空の底」は<br>物理的な高低のみの関係。<br>つまり繋がっている世界のはず。,空域与‘空之底’只是物理上的高低不同，两个世界是连在一起的。
79,男子生徒１,なのになぜ、<br>底にあるとされる「赤き地平」は<br>「幽世」とされてるのか。,但是。为什么成为底的‘赤之地’会变成‘幽世’。
80,男子生徒１,異界として定義されているのか……,为什么会被称作异界……
81,男子生徒１,この世界の、隠されている秘密を<br>俺達の手で暴きたかったんだ。,我们要亲手揭开这个世界所隐藏的秘密。
82,男子生徒１,そうすれば誰もが俺達を<br>一流と認めてくれる。<br>だから……,那样的话谁都会认为我们是一流的魔法使。所以……
83,ハンナ/汉娜,…………,……
84,男子生徒２,ですけど、この術は小さな穴を<br>あけるだけでも凄い魔力と<br>強力な媒介が必要で……,但是。即使只是用这个魔法张开一个小洞穴都需要很庞大的魔力和强力的媒介作支撑……
85,男子生徒１,だから、俺達は<br>「増幅」のコア・モノリスを<br>媒介にして魔法をつかったんだ。,所以我们以核·独石柱为媒介使用了魔法。
86,女子生徒１/女学生１,最初は何も起きなかったから<br>失敗したと思ったんです。,一开始什么都没有发生。还以为是失败了。
87,女子生徒１/女学生１,でも、気づいたら<br>そこに門ができていて……,但是回过神来，那里已经张开了门……
88,アン/安,なるほどね……,原来如此……
89,アン/安,ねぇ、その本には門を開く魔法の<br>術式が書いてあったんだよね？,呐、这本书上写着开门的魔法术式对吧？
90,アン/安,なら、門を閉じる魔法も……,那么、关门的方法……
91,男子生徒２,ええと、それは……<br>すみません、アン先輩。<br>僕達も全部読んだわけではないので。,唔、关门的...抱歉、安前辈。我们全部读了一遍，没有发现关门的。
92,ハンナ/汉娜,……呆れましたわね。<br>閉じる方法も知らずに門を開くなんて。<br>流石に軽率すぎますわ。,……惊了。你们不知道关门的方法就开启了门。怎么说也过于草率。
93,男子生徒１,魔力の供給を止めれば<br>門が閉まると考えてたんだ。<br>でも……,我们以为停止魔力供给门就会关闭。没想到……
94,ハンナ/汉娜,それは勇み足から湧き出た<br>都合のいい想像で、<br>実際は閉じることはなかった。,那不过是你们一厢情愿的想象罢了、实际上门没有关闭。
95,男子生徒２,はい……,嗯……
96,アン/安,となると、残りの部分は<br>私達で解読するしかないね。,这样的话、剩下的部分只能由我们接手解读了。
97,ハンナ/汉娜,そうですわね。<br>それと先生方にも<br>手伝っていただきましょう。,是啊。叫老师们也来帮帮忙吧。
98,ハンナ/汉娜,ワタクシ達だけでは理解できない部分も<br>あるでしょうし。,只靠我们肯定有不明白的地方。
99,アン/安,そうだね……,说的也是……
100,,<span class='scene-font-katari'>事態を収束する唯一の手がかりである</span><br><span class='scene-font-katari'>生徒達から渡された魔導書を</span><br><span class='scene-font-katari'>アンはじっと見つめる。</span>,安凝视着解决事件的唯唯一钥匙--学生们递过来的魔导书。
101,,<span class='scene-font-katari'>その瞳には、</span><br><span class='scene-font-katari'>必ず学院を、大切な場所を守るという</span><br><span class='scene-font-katari'>確かな決意の炎を宿していた。</span>,瞳孔中燃烧着守护学院的决意的火焰。
info,麻友桑的话筒,,scene_evt170831_cp5_q3_s10