id,name,text,trans
0,イルザ/伊尔莎,姬塔、<br>少し時間はあるか？,姬塔，你有时间吗？
1,イルザ/伊尔莎,今日はバレンタインデーだろう？<br>チョコレートを作ってきたので<br>受け取ってほしい。,今天是情人节吧？我做了巧克力，请收下。
2,イルザ/伊尔莎,……これが本命かだと？<br>姬塔も鬼と呼ばれる私相手に<br>大胆なことを聞くものだな。,……你问这是不是本命？<br>姬塔就算面对被称为鬼的我也会问那么大胆的问题啊。
3,イルザ/伊尔莎,ならば聞くが、年上が好みなのか？<br>私は相手が年下でも一向に構わないが。,那么我问你，你喜欢比你年纪大的人吗？<br>我是不在乎对方是不是比我年纪小的。
4,イルザ/伊尔莎,ふふふ……<br>なんて、少しからかいがすぎたか。,呵呵呵……<br>别在意，捉弄你有点捉弄过头了。
5,イルザ/伊尔莎,これは日頃の感謝の気持ちだ。<br>誠心誠意込めて作らせてもらった。,这是平日我对你的感谢之情。诚心诚意做出来的。
6,イルザ/伊尔莎,味わって食べてほしい。,希望你好好品尝。
info,,,scene_s1_valentine_3094_v2_0_2002_1_3040177000_1