id,name,text,trans
0,姬塔ーサ/萨拉萨,トリック・オア・トリートって、<br>お菓子かいたずらかって意味らしいな！,不给糖就捣蛋这话，好像意思是让人选糖果还是恶作剧。
1,姬塔ーサ/萨拉萨,でもなーイタズラはな―<br>美味しくないし、<br>腹もふくれないからな……,但是恶作剧又不好吃，肚子也不会饱……
2,姬塔ーサ/萨拉萨,うん、だから、イタズラの代わりに<br>あたしと勝負だ！,所以，作为恶作剧的替代，跟我比试一下吧！
4,姬塔ーサ/萨拉萨,さぁ、どれを選ぶんだ？<br>姬塔となら<br>あたしはどれだってかまわないぞ！,那么，你选哪个？<br>姬塔的话不管选哪个我都无所谓！
5,姬塔ーサ/萨拉萨,お菓子でもケーキでも勝負でもな！<br>何なら全部……,糖果也好蛋糕也好比试也行！<br>干脆就全都……
6,姬塔ーサ/萨拉萨,うん！<br>全部がいいな！,嗯！<br>全都要吧！
7,姬塔ーサ/萨拉萨,お菓子喰って、ケーキ喰って、<br>勝負しようぜ！,吃糖果，吃蛋糕，然后比试！
info,,,scene_s3_halloween_4003_v1_0_2004_3_3040032000
译者,,,