id,name,text,trans
0,ノア/诺亚,誕生日を迎えて、\n君はまた一層成長したみたいだね。,迎来了生日，\n你又有了一番成长。
1,ノア/诺亚,強くなった……\nいや、戦いの中で強くならざるを\n得なかったのかな。,你变强了……\n不，应该说在战斗中必须变得更强吗。
2,ノア/诺亚,これからもきっと、\nそんな旅が続いていく……\nけれど、忘れないでいてほしいな。,从今往后，\n这样的旅途一定也会继续吧……\n然而，希望你不要忘记。
3,ノア/诺亚,君には僕達がいる。\n君をいつも大切に思う仲間がいる。,你还有我们。\n你有我们这些永远重视你的伙伴。
4,ノア/诺亚,君には帰る場所がある。\nこの艇が、仲間達が、\nいつだって君を待っている。,你是有归宿的。\n这艘船，这些同伴们，\n永远在等带着你。
5,ノア/诺亚,進み続けることが辛くなった時、\nそのことを思い出してほしいな。,当你在前进的路上感到辛苦时，\n就想想这些吧。
6,ノア/诺亚,改めて、誕生日おめでとう。\nそしてこれからもよろしくね、\nジョイナさん。,再次祝你生日快乐。\n今后也请你多多关照，姬塔。
info,,,scene_s5_birthday_2035_v1_0_2006_5_3030039000
译者,,,psyche
