id,name,text,trans
0,モニカ/莫妮卡,誕生日、おめでとう。,生日快乐。
1,モニカ/莫妮卡,この一年は、<br>思うように過ごせただろうか？,这一年过得顺利吗？
2,モニカ/莫妮卡,自分が掲げた目標を達成する事も、<br>自分が信じる道を貫く事も<br>容易に出来る事ではない。,想要达成自己设定的目标，<br>或是贯彻自己相信的道路，<br>都不是容易办到的事情。
3,モニカ/莫妮卡,だが、己の人生を振り返った時、<br>後悔がないと思える事は、<br>とても幸せだと思わないか？,不过，你不觉得，将来回顾自己的人生的时候，<br>能够觉得没有后悔是件非常幸福的事情吗？
4,モニカ/莫妮卡,その為には、たまに息を抜きながらでも<br>己に誇れる人生を歩むべきだと<br>私は思う。,为了这个，我觉得应该偶尔缓口气，坚持走在自己自豪的人生道路上。
5,モニカ/莫妮卡,貴公ならばそれが出来ると信じている。<br>この一年、豊かな一年となるよう、<br>祈っているぞ。,我相信你能够做到。<br>我祈祷这一年会是收获丰硕的一年。
info,,,scene_s4_birthday_3121_v1_0_2006_4_3040186000