id,name,text,trans
0,イルザ/伊尔莎,あけましておめでとう。<br>早起きだな、姬塔。,新年快乐。<br>起的好早啊，姬塔。
1,イルザ/伊尔莎,ほう、今日は予定が多いので<br>団員達が起きる前に<br>鍛錬を済ませておくというのか。,哦？因为今天要做的事很多，<br>就赶在团员们起床前结束锻炼啊。
2,イルザ/伊尔莎,さすがだ、<br>騎空団を率いる団長なら<br>それくらいの覚悟がなければな。,不愧是你。<br>作为率领骑空团的团长<br>必须要有这份觉悟啊。
3,イルザ/伊尔莎,私か？　いつもの通り<br>訓練のメニューをこなすつもりだ。,我吗？<br>像往常一样消化训练项目。
4,イルザ/伊尔莎,ここで会ったのも何かの縁だ。<br>今年も私と来るか？<br>無理にとは言わないが……,能在这儿见面算是有缘吧。<br>今年要不要和我一起？<br>当然不会强制你……
5,イルザ/伊尔莎,ははっ、そうか！<br>私の訓練が気に入ったようだな。,哈哈，是吗！<br>看来你很感兴趣我的训练啊。
6,イルザ/伊尔莎,ならば今日はビシバシ行くぞ。<br><span class='scene-font-4'>心してかかれ！</span>,那么今天就痛快地训练。<br><span class='scene-font-4'>做好心理准备吧！</span>
info,,,scene_s2_newyear_3094_v1_0_2001_2_3040148000