id,name,text,trans
0-chapter_name,,第6話 自由をその手に,第6话 亲手抓住自由
0-synopsis,,信徒達に追われる中雪原を逃げる一行。そんな中スカルは、元家族達がライログールに騙され信徒となってしまったのは、グルザレッザを倒した自分にも責任があるのではと考える。目を覚まさせてやりたいというスカルの想いに姬塔達も応え、一行は教団シャマスを止める決意を固めるのだった。,一行人在信徒的追逐下，于雪原上奔逃。其间，斯卡尔心想，曾经的家人被莱洛古尔欺骗成为信徒，这其中是否也有打倒古扎雷萨的自己的责任。姬塔等人回应了斯卡尔想要唤醒他们的想法，一行人坚定了阻止教团沙玛斯的决心。
8,,ブッチャギーを駆り、\n大雪原を突き進む姬塔達を\n信徒達が怒声をあげながら追走する。,姬塔一行人驾驶着猛战车在雪原上疾驰，身后还有发出怒吼的信徒们紧追不舍。
9,ルリア/露莉亚,…………,…………
11,バルルガン,サンキュー、ルリア。\n幾分か痛みが引いたぜ……,谢了，露莉亚。疼痛减轻了几分……
12,教団シャマスの信徒13,<span class='scene-font-4'>ヒィィィハァァッ！！</span>\n待ぢやがれ、スカル～～！！,<span class='scene-font-4'>咿——哈——！！</span>\n给我站住，斯卡尔～！！
13,バルルガン,しつけぇ奴らだぜ……\nこのままじゃ追いつかれんのも\n時間の問題か……,真是群难缠的家伙……照这样下去，被追上只是时间问题吧……
14,ユーステス/尤斯缇斯,ならば少しでも時を稼ごう。,那就尽量争取点时间吧。
15,スカル,おうよぉ！,好嘞！
16,,追っ手を銃撃するユーステスとスカル。\nしかし、スカルの腕は震え、\n照準が定まらない。,尤斯缇斯和斯卡尔向追兵开枪射击。但斯卡尔的手臂在颤抖，无法瞄准。
17,,それでも泣き言を言わず、\n懸命に戦うスカルを見て、\nユーステスはふと微笑む。,看着即便如此也毫不抱怨、拼命战斗的斯卡尔，尤斯缇斯不由得微微一笑。
18,ユーステス/尤斯缇斯,生きて帰るぞ。,我们要活着回去。
19,スカル,ったりめぇよ！,那还用说！
20,バルルガン,よぉし……いいぞぉ！\nこのままなら、\nどうにか奴らをぶっちぎれる……！,好……干得好！\n这样下去总能把他们甩掉的……！
21,,バルルガンがブッチャギーの手綱を\n左手でグッと握り締めたその時、\n上空で爆発音がこだまする。,就在巴鲁鲁干用左手紧紧握住猛战车的缰绳时，上空响起了爆炸声及其回音。
22,バルルガン,<span class='scene-font-4'>なっ！？</span>\nもしかしてアイツら……,<span class='scene-font-4'>什么！？</span>难道是那些家伙……
23,ユーステス/尤斯缇斯,ああ、ダイナマイトだ。,嗯，是炸药。
24,バルルガン,ふざけやがって……！,开什么玩笑……！
25,,直後、爆発による衝撃によって\n雪崩が発生し、地響きと共に\n姬塔達に押し寄せて来る。,紧接着，爆炸的冲击引发了雪崩，伴随着地面的轰鸣向姬塔一行人袭来。
26,ユーステス/尤斯缇斯,チッ……,啧……
27,スカル,バルルガン、交代だぁ！,巴鲁鲁干，换人！
29,スカル,姬塔はオレ様の後ろを\nしっかりついて来な！,姬塔，你要紧紧跟在我后面！
30,スカル,んじゃあ、ワンちゃん達よぉ！\n<span class='scene-font-4'>気張ってこうぜええええっ！</span>,好了，狗狗们啊！\n<span class='scene-font-4'>加油冲啊——！</span>
31,ノース・ハスキー達,ワオーン！！,汪——呜！！
32,,号令と共にスピードをあげた\nノース・ハスキー達は、襲い来る\n雪崩の上を滑るようにして走る。,随着号令，北雪橇犬们开始加速，如履平地般在袭来的雪崩之上飞驰。
33,,その繊細かつ的確な操縦や指示は\nまさにこの地で育った者にしか出来ない\n芸当であった。,那细腻且精准的驾驶和指示，是只有在这片土地上长大的人才能做到的绝技。
34,スカル,<span class='scene-font-4'>ヒャッハァァァァ！</span>\n天才のオレ様にかかれば\nこんなモンよぉ！,<span class='scene-font-4'>呀哈——！！</span>就交给我这个天才吧，\n这种程度算不了什么！
35,バルルガン,へへっ、やるじゃねぇか！,嘿嘿，干得不错嘛！
36,ユーステス/尤斯缇斯,…………,…………
37,スカル,お？　どうしたユーステス。,哦？怎么了尤斯缇斯。
38,ユーステス/尤斯缇斯,奴らもお前と同様、\n犬橇の扱いには慣れているらしい。,那些家伙似乎也和你一样，很擅长驾驶狗拉\n雪橇。
39,,スカルが振り返ると、\n信徒達もまた雪崩の上を\n滑るようにして追走していた。,斯卡尔回头一看，信徒们也同样在雪崩之上紧追不舍。
40,教団シャマスの信徒達,イャアアァヤァッハアアアッ！！,呀——哈——！！
41,バルルガン,あの血走った目に鬼気迫る表情……\nもはや獣じゃねぇか。,那些布满血丝的双眼，那鬼气逼人的表情……简直跟野兽没什么区别。
42,ユーステス/尤斯缇斯,奴らをここまで狂信的にさせるとは……\n恐るべきはライログールの才覚か。,能将他们变得如此狂热……可怕的或许是莱洛古尔的才能吧。
43,スカル,…………,…………
46,元オダヅモッキー,教団シャマスさ入信しちまった奴らは、\nテメェで考えるごどすら\n放棄してやがる。思考停止してんのさ。,那些加入夏玛斯教团的家伙，连靠自己来思考这件事都放弃了。他们完全停止思考了。
47,元オダヅモッキー,「奔放に暴れ回れる自由」っつー\n免罪符ば得だ気になって\nいいように踊らされでよぉ。,他们以为自己得到了名为<span class='scene-font-spword'>「恣意妄为的自由」</span>的免罪符，被人随意摆布。
48,元オダヅモッキー,もしくは……\n暴力と富に溺れだだげなのがも\n知れねぇなぁ～……,也有可能……\n只是沉溺于暴力和财富罢了～……
51,スカル,アイツら……\n命令に従ってるだけっつーか……,那些家伙……该说只是服从命令吗……
52,スカル,マジで考えることを\nやめちまったみてぇだな。\n……マジで不自由な奴らだな。,好像真的停止思考了啊。\n……真是群失去了自由的家伙。
53,スカル,自由ってのはよぉ、\nそもそもテメェの手で\n掴み取るモンだよなぁ？,所谓的自由啊，本来就是该由自己亲手去抓住的东西对吧？
54,バルルガン,…………,…………
55,スカル,なのにアイツらはヘンテコ野郎に\n偽モンの自由を与えてもらって……\nそれで満足してやがる。,可那些家伙却从那个怪胎那里得到了虚假的自由……还因此十分满足。
56,スカル,昔のオレ様みてぇだ。,跟以前的我一样。
57,スカル,……オヤジもそうだった。\nテメェの勝手な自由を叶える為に、\nオレ様達を好き勝手しやがった。,……老大也是这样。为了实现他自己的自由，随心所欲地摆布我们。
58,スカル,自由っつー名の、\n不自由をエサにしてなぁ！,拿名为自由，实为不自由的东西当诱饵！
59,スカル,でもよぉ！　それだけじゃなかった！\nオレ様は家族として迎えられたし……\nバルルガン、お前だって……,但是啊！并不只有这样！我被老大当作家人接纳了……巴鲁鲁干，你也是……
60,バルルガン,アタイを初めて認めてくれたんだ。\nオヤジにはホント、世話になったぜ。,他是第一个认可我的人。\n我真的受老大他照顾。
61,スカル,オダヅモッキーは……\n偽りの家族だったけどよ、\n本物の家族でもあったんだ。,奥达兹莫奇……虽然是虚假的家人，但也曾是真正的家人。
62,スカル,けどよぉ、アイツらはどうだ？\nただ狂ったように\n暴れ回ってるだけじゃねぇか！,但是啊，他们呢？\n不就只是疯狂地四处捣乱吗！
63,スカル,オレ様が……！！\nオレ様が求める自由は！！\nあんな不自由なもんじゃねぇ！,我啊……！！我所追求的自由！！\n才不是那种不自由的东西！
64,バルルガン,スカル……,斯卡尔……
65,スカル,チッ、ワリィな。\nうまく言葉が出てこねぇけど。,啧，抱歉啊。我虽然说不清楚。
66,スカル,もしかして……\nオレ様がオヤジをやらなけりゃ……,搞不好……如果我没有干掉老大的话……
67,スカル,オダヅモッキーにいた奴らも\n信徒になったって奴らも……,无论是奥达兹莫奇原本的那些家伙，还是现在成了信徒的家伙……
68,スカル,あんなヘンテコ野郎に\n騙されることなんか\nなかったんじゃねーかなってよぉ……,说不定就不会受那种怪胎欺骗了……
69,ユーステス/尤斯缇斯,で……お前はどうしたい？,那么……你想怎么做？
71,スカル,出来るモンならよぉ、\n奴らの目を覚ましてやりてぇ。,如果可以的话，我想让他们清醒过来。
72,スカル,昔の兄弟があんなヘンテコ野郎に\nこき使われる姿なんざ、\n見たかねぇからよぉ～～！！,我可不想看到曾经的兄弟们被那种怪胎呼来喝去的样子～！！
73,,スカルの想いに触れ、\n姬塔はゆっくりと\n言葉を紡ぐ。,感受到斯卡尔的意志，姬塔也缓缓说出自己的想法。
74,,教団シャマスの信徒達を止めるのは\n圧倒的な戦力などではなく……,要阻止夏玛斯教团的信徒们，要靠的并非压倒性的战斗力……
75,,彼らにとって憧れでもあり、\n執着でもあるグルザレッザからの解放。\nそして、新たなる偶像ではないかと。,而是将他们从对古扎雷萨的憧憬与执着中那里解放出来。以及，还要解决那个新的偶像。
76,スカル,姬塔……,姬塔……
77,バルルガン,……アタイは乗るぜ。,……我也去。
78,スカル,バルルガン……\nいや、でもお前は……,巴鲁鲁干……可是你……
79,バルルガン,うるせぇ。こんな怪我……\n気合いで乗り切ってやらぁ！,少啰嗦。这点伤……\n我会凭毅力挺过去给你看！
80,ルリア/露莉亚,私も賛成です！\nスカルさんの力になりたいです！,我也赞成！我也想帮上斯卡尔的忙！
81,ユーステス/尤斯缇斯,…………,…………
82,スカル,なぁ、ユーステス……\nせっかく助けに来てくれたってのに\n悪ぃんだけどよぉ～……,喂，尤斯缇斯……\n难得你来救我，真是不好意思～……
83,ユーステス/尤斯缇斯,油断するなよ。,那就别大意。
84,スカル,い、いいのかっ！？,可、可以吗！？
85,ユーステス/尤斯缇斯,目的は果たした。\n後のことは知らん。,目的已经达成了。之后的事我不管。
86,バルルガン,ハッ、意外と熱いじゃねぇか。,哈，没想到你还挺热血的嘛。
info,,,scene_evt220429_cp6_q1_s10
译者,,,朔夜Rei