id,name,text,trans
0,フォリア/芙莉亚,今日はお主の誕生日だそうじゃな！<br>実に良き日じゃ！,听说今天是你的生日！<br>真是好日子啊！
1,フォリア/芙莉亚,如何な妾といえど、<br>国を挙げて<br>祝ってやることは出来ぬが……,就算是我也没有办法举国之力为你庆祝……
2,フォリア/芙莉亚,ささやかながら、<br>祝いの席を用意したのじゃ。,不过虽然很小，我还是准备了庆祝的宴席。
3,フォリア/芙莉亚,料理については、<br>妾自ら腕を振るったのじゃぞ！,料理可是我亲自制作的哦！
4,フォリア/芙莉亚,ま、まぁ……<br>かなりハクタクの手も借りたがの……,嘛，嘛……<br>也有借很多白泽的力量啦……
5,フォリア/芙莉亚,ともあれ今日は、王としてではなく、<br>妾個人として、<br>お主を祝わせてほしいのじゃ。,总之今天不是作为王，<br>而是作为我个人，来为你庆祝。
6,フォリア/芙莉亚,今日ばかりは無礼講じゃ。<br>大いに楽しむのじゃぞ！,今天不用讲究客套，尽情享受吧！
info,,,scene_s1_birthday_3112_v1_0_2006_1_3040181000