id,name,text,trans
0,ジュリエット/朱丽叶,毎年この日になると、<br>亡くなった大切な人達のことを<br>思い出してしまいます。,每年一到这个日子，我就会想起已经去世了的重要的人们。
1,ジュリエット/朱丽叶,やはり皆さんの魂は<br>近くに来ているのでしょうか？<br>……きっとそうですよね。,大家的灵魂是不是已经到附近了？<br>……一定是这样。
2,ジュリエット/朱丽叶,皆さんに元気な姿を見せるためにも、<br>今日はハロウィンを<br>楽しみたいと思います。,也为了让大家看到我精神的样子，今天我准备享受万圣节。
3,ジュリエット/朱丽叶,ところで姬塔さん、<br>街の子供からハロウィンを<br>楽しむコツは悪戯だと聞きました。,话说回来，姬塔。<br>我听街上的孩子们说，享受万圣节的窍门是恶作剧。
4,ジュリエット/朱丽叶,ですが皆さんがどんな悪戯を<br>しているのかわからないんです。<br>姬塔さんは知っていますか？,但是我并不清楚大家是怎么恶作剧的。<br>姬塔你知道吗？
5,ジュリエット/朱丽叶,知っているんですね！<br>でしたら私にやってみせてください。<br>その方がわかりやすいですから。,你知道啊！<br>那么请对我恶作剧一下。<br>这样更容易理解。
6,ジュリエット/朱丽叶,びっくりする準備ならできていますよ。<br>遠慮せずに、どうぞ！,我已经做好准备吓一大跳了。<br>不要顾虑，来吧！
info,,,scene_s4_halloween_3066_v1_0_2004_4_3040096000
译者,,,