id,name,text,trans
0-chapter_name,,最高のコーダへ,抵达最完美的终章
0-synopsis,,ナーヴェは自身のみの力を確かめるため、演奏会行脚の締めくくりにストリートセッションを行う。カロとカンターテも参加し、ストリートセッションは大成功を収めた。その後、一行はバーで打ち上げをして互いの仕事の成功を祝う。ナーヴェは最高の仲間達と演奏会行脚の成功を肴に酒を飲み、忘れられない一夜を過ごすのだった。,为了确认自己的实力，娜维在巡演结束后进行了一场街头即兴演奏，卡洛和坎塔特也参与其中，演出获得了巨大的成功。随后，一行人来到酒吧庆祝，互相祝贺彼此工作的圆满完成。娜维与最好的伙伴们一起，以巡演的成功为话题喝酒畅聊，度过了一个难以忘怀的夜晚。
1,,数時間前。\n最後の演奏会終了直後……,数小时前。\n最后一场演奏会结束后……
8,ルリア/露莉亚,ナーヴェさん！\nお疲れ様でした！,娜维小姐！\n辛苦了！
9,ナーヴェ/娜维,ありがとうございます。\nこれも皆さんのおかげです。,谢谢。\n这都要感谢大家的帮助。
10,ビィ/碧,オイラ達の依頼も終わったし\n打ち上げでもするか！,咱们的任务也完成了，\n要不要来个庆功宴？
11,ナーヴェ/娜维,打ち上げ、ですか。\n……ええっと。,庆功宴吗？\n呃……
12,カロ/卡洛,どうしたんだい？\nあまり乗り気じゃないのかな。,怎么啦？\n你似乎不是很有兴致？
13,ナーヴェ/娜维,あ、いえ……\n実はもうひとつだけ\nやり残したことがありまして……,啊，不是的……\n其实我还有一件想做的事……
20,ルリア/露莉亚,ストリートセッション？,街头演奏？
21,カンターテ/坎塔特,ろろ、路上で演奏するの……\nそ、その場で思いついた曲とかを\n小人数で……,就、就是在大街上演奏……\n少数几个人随性地\n演奏突然想到的曲子……
22,ナーヴェ/娜维,演奏会の告知や楽団の権威。\nそういうものを当てにしない\n自分だけの力……,不依赖演奏会的宣传或乐团的声望，\n只凭借我自己的力量……
23,ナーヴェ/娜维,それを確かめる意味も込めて\nストリートセッションに\n挑戦してみたいんです。,为了确认这一点，\n我想挑战一下街头演奏。
24,カロ/卡洛,それはいいね。\nとても面白そうだ。\nよければ僕も参加したいな。,这主意真好，听起来很有趣。\n如果可以的话，我也想参加呢。
25,カンターテ/坎塔特,カ、カロがやるなら\nうちもやってみたい……！,如果卡洛要参加，\n我也想要……！
26,カロ/卡洛,僕達はサイドに徹して\nナーヴェの音の邪魔はしないと\n約束するよ。どうだい？,我们至始至终都是伴奏，\n绝对不会喧宾夺主妨碍娜维的，\n好不好？
27,ナーヴェ/娜维,はい！　もちろん大歓迎です。\nトリオで最後の演奏を\n楽しみましょう！,当然！非常欢迎。\n让我们一起享受这最后的三重奏吧！
38,ルリア/露莉亚,どんどん人が集まってきます！\nナーヴェさん達……\n本当に凄いです！,人越聚越多了！\n娜维小姐他们……真的太厉害了！
39,ビィ/碧,スッゲェ盛り上がりだな！,气氛真是太好啦！
40,ナーヴェ/娜维,（指がいつも以上に動く。\nこれまでにないほど心が弾む。\n身体の奥から力が湧き上がる……）,（手指比平时更加灵活。\n心情也从未如此激动。\n力量从身体深处不断涌出……）,
41,ナーヴェ/娜维,（この感覚を……\nしっかりと魂に刻み付けよう！）,（我要将这种感觉……\n深深铭刻在我的灵魂里！）
44,,沸き上がる観衆の声に包まれて\nナーヴェのストリートセッションは\n大成功に終わった。,在观众的欢呼声中，\n娜维的街头演奏取得了巨大的成功。
50,,そして約束通り、\n打ち上げをやることになり\n向かった先は……,接着，大家按照事先约好的，\n前往某个地方准备举办庆功宴……
55,ルリア/露莉亚,ここって……\n最初にナーヴェさんが\n看板を見ていたお店ですよね？,这里是……\n起初娜维小姐看招牌的那家店吧？
56,ビィ/碧,メニューをチェックしてたから\n初めからその予定だった\nってことなのか？,菜单都看过了，\n一开始就决定要来这里吧？
57,カロ/卡洛,いい雰囲気の店だね。\n気に入ったよ。\nどうだい？　カンターテ。,这家店的氛围真好，我很喜欢。\n你觉得呢？坎塔特。
58,カンターテ/坎塔特,う、うちにはちょっと……\n敷居が高いかも……,我、我觉得这里……\n对我来说有点太高级了……
59,ナーヴェ/娜维,うふふっ、\nあれだけの演奏をしたんです！\nもっと気楽に行きましょう♪,呵呵，\n你演奏的时候可一点都不怯场！\n放松点吧♪
60,カンターテ/坎塔特,ぶぶ、舞台の上のなぁちゃんと\n同じくらい、緊張してるかも……,我、我现在可能\n跟小娜在舞台上时一样紧张……
61,,そんなやり取りをしているうちに\n全員分のドリンクが\nテーブルに行き渡った。,大家聊着天，\n每个人的饮料都被摆上了桌子。
62,,乾杯の一言とともに、\nそれぞれが各々の飲み方で\n最初の１杯を口にする。,伴随着一声“干杯”，\n大家用各自的方式喝下了第一杯。
63,ルリア/露莉亚,このジュース、\nすっごく美味しいです！,这果汁真是太好喝了！
64,ビィ/碧,リンゴジュースも\nこだわってるって感じの味だぜ！,这苹果汁的味道\n真有讲究！
65,,ほのぼのとした感想を\n口にするふたり。\nそんな中ナーヴェは……,露莉亚和碧在愉快地\n表达着他们的感想。\n与此同时，娜维……
66,ナーヴェ/娜维,はぁー……\nこんなに美味しくお酒が\n飲めるなんて最高です……！,哈……\n能喝到这么美味的酒，\n真是太棒了……！
67,カロ/卡洛,随分とご機嫌だね。\nナーヴェ。,你看起来心情真好呢，\n娜维。
68,ナーヴェ/娜维,演奏会の緊張も疲労も\n全て吹き飛ぶこの一杯！\nこれを待っていたんです……！,演出时的紧张和疲劳，\n都被这杯酒一扫而空！\n我一直期待这一刻……！
69,ナーヴェ/娜维,客演と任務の成功にかんぱーい！\n皆さんにもかんぱーい！,为这次演出和任务的成功干杯！\n也为大家干杯！
70,ナーヴェ/娜维,って、あれっ？\n乾杯はもう終わってましたっけ……,诶，咦？\n我们已经碰过杯了吗……
71,カンターテ/坎塔特,まま、まだ酔ってないのに\nす、すごいテンション……！,明明还没醉呢，\n就、就这么兴奋了……！
78,ナーヴェ/娜维,すみません。\nこれと同じものをもう一杯\nお願いします。,不好意思。\n这种酒请再给我来一杯。
79,ビィ/碧,んー？\nさっきから同じものばっかり\n注文してねーか？,嗯？\n你从刚才起就一直\n点同样的酒啊。
80,ナーヴェ/娜维,そうですね。\n今日はこのお酒ばかり\n飲んでいます。,是啊。\n今天我一直都在喝这种酒。
81,ルリア/露莉亚,豪華な瓶で高そうなお酒ですけど……\nやっぱり、お酒は高いほうが\n美味しいんでしょうか？,这酒装在华美的瓶子里，\n好像很贵……\n果然，贵的酒更好喝吗？
82,ナーヴェ/娜维,ふふふ、違いますよ。\n値段が高ければ美味しいお酒、\nというわけではありません。,呵呵，不是这样的。\n酒并不是因为贵才好喝。
83,ナーヴェ/娜维,こういう場所で\nお酒を最大限に楽しむには\nちょっとしたコツがあるんです。,要在这种场合\n最大限度地享受美酒，\n其实有一个小秘诀。
84,カロ/卡洛,興味があるね。\n聞かせてほしいな。,这让我很感兴趣。\n能告诉我是什么吗？
85,ナーヴェ/娜维,簡単なことですよ。\nそれはいつ、どこで、\n誰と一緒に飲むか……,其实很简单。\n关键在于你什么时候、在哪里，\n和谁一起喝……
86,ナーヴェ/娜维,そしてどんな理由で\n飲むのか、ということです。,以及你是为了什么\n而喝这杯酒。
87,カンターテ/坎塔特,どんな理由で……,为了什么……
88,カロ/卡洛,ああ、そういうことか。\nなるほどね。,啊，原来是这样。\n我明白了。
89,ビィ/碧,な、なんだぁ？\nカロ、\nなにを納得してるんだよ。,什、什么啊？\n卡洛，你明白了什么？
90,カロ/卡洛,つまりこういうことだよ。\n僕達はお互いの目的のために\n協力し合った「仲間」だ。,意思是说，我们是为了各自的目标\n而互相帮助的“伙伴”。
91,カロ/卡洛,そして見事に\nそれぞれの目的は達成された。\n予想以上の成果を出してね。,而且我们每个人\n都完美地实现了各自的目标，\n结果远超预期。
92,カンターテ/坎塔特,な、仲間と一緒に、\n嬉しい気分で飲むお酒は……\nどれでも、美味しい……？,和、和伙伴一起，\n怀着喜悦的心情喝的酒……\n无论是什么，都很好喝吧……？
93,ルリア/露莉亚,なるほど！\nそういうことなんですね！,原来如此！\n原来是这个意思啊！
94,ナーヴェ/娜维,皆さんとの再会から各地を回って、\nそして最後のセッションまで\n最高の形で終える事ができた……,从和大家重逢，到各地巡演，\n还有最后的街头演奏也是\n以最完美的形式结束……
95,ナーヴェ/娜维,この事実は私にとって\n最上の酒の肴ということです。,这些事对我来说，\n就是最好的下酒菜。
96,カンターテ/坎塔特,ししし……\nい、今のなぁちゃんなら\nお水でも美味しく飲める、かも。,嘻嘻……\n现、现在的小娜\n就算是水也会觉得特别好喝吧。
97,ナーヴェ/娜维,確かに……！　\n今ならお水でもジュースでも\n何でも酔えちゃう気がします……！,确实……！\n现在的话，无论是水还是果汁，\n都能让我喝醉……！
98,ビィ/碧,おいおい、大丈夫かぁ？\n飲み過ぎには気をつけろよ？,喂喂，没事吧？\n小心不要喝太多了哦？
99,ナーヴェ/娜维,えっ……飲み過ぎって？\n私、ぜんぜん酔ってないですよ？,诶……喝太多？\n我完全没醉啊？
99-sel1_txt,,アルコールはほどほどにね,酒精要适量哦
99-sel2_txt,,アンコールはほどほどにね,安可要适量哦
101,ナーヴェ/娜维,大丈夫大丈夫！\nアンコールの時間は残してあるから！,没事没事！\n我还留了安可的时间呢！
102,カンターテ/坎塔特,や、やっぱり酔ってる……かも？,果、果然已经喝醉了吧？
104,ナーヴェ/娜维,その通り！\nアンコールもアルコールも、\nほどほどが大事ってね！,没错！\n无论是安可还是酒，\n适量才是最重要的！
105,カロ/卡洛,経験に裏打ちされた箴言は、\nなかなか含蓄があるね。,从经验中总结出的箴言，\n真是很有深意呢。
106,ナーヴェ/娜维,というわけで……\n<span class='scene-font-4'>カンパーイ……！</span>,那么……\n<span class='scene-font-4'>干杯……！</span>
107,,悪戯っぽく笑うナーヴェは\nグラスに注がれた酒を\n陽気に口に運んだ。,娜维带着调皮的笑容，\n愉快地举起了酒杯，\n喝了一口倒入杯中的酒。
108,,最高の夜に最高の仲間達と、\n最高の結果を祝う宴の席……,在这个美妙的夜晚，\n与最好的伙伴们一起，\n庆祝他们取得的杰出成果……
109,,今夜は彼女にとっても\n仲間達にとっても、\n忘れられない一夜となるだろう。,今晚对她和她的伙伴们来说，\n都将是一个难以忘怀的夜晚。
info,,,scene_chr892_q3_s10
译者,,,psyche